Tipo,NombreRestaurante_,NombreUsuario_,LocalizaciónUsario_,NivelUsuario_,OpinionesTotalesUsuario_,VotosUtiles_,IDComentario_,ValoracionComentario_,TituloComentario_,Comentario_,FechaCometario_,FechaVisitaRestaurante_,ValoracionesComentario_,ResumenPuntuacionesRestaurante_,PrecioMedio_,TipoCocina_,Comida_,CaracteristicasDelResaurante_,AconsejablePara_,Horarios_,DireccionCompletaRestaurante_,Descripcion_
¬Restaurante¬;¬La Oveja Negra Taberna Vegana¬;¬Alex_Ferrandes¬;¬España¬;¬4¬;¬27¬;¬15¬;¬Alex_FerrandesNo_Fui¬;¬2¬;¬No me ha convencido¬;¬Fuimos en familia, la comida está bien, sobre todo la tarta de chocolate pero el sitio parece muy sucio y descuidado. Tenemos un bebé y no tienen trona, nos daba cosa ya que donde tocaba no parecía nada limpio. La sala oscura y pequeña. No regresaremos.¬;¬28 marzo 2016¬;¬¬;¬¬;¬¬;¬¬;¬Española, Menús vegetarianos, Opciones veganas¬;¬Abierto hasta tarde¬;¬Reservas¬;¬Comer barato¬;¬domingo 13:00 - 18:00 martes 13:00 - 00:30 miércoles 13:00 - 00:30 jueves 13:00 - 00:30 viernes 13:00 - 01:30 sábado 13:00 - 01:30¬;¬Dirección: Calle Buenavista 42, 28012 Madrid, España Ubicación: Europa  >  España  >  Comunidad de Madrid  >  Madrid>  > Lavapiés Barrio: Lavapiés¬;¬Dirección: Calle Buenavista 42, 28012 Madrid, España Ubicación: Europa  >  España  >  Comunidad de Madrid  >  Madrid>  > Lavapiés Barrio: Lavapiés¬
¬Restaurante¬;¬La Oveja Negra Taberna Vegana¬;¬celiaeyre¬;¬¬;¬0¬;¬2¬;¬0¬;¬celiaeyreCe_Fui¬;¬2¬;¬Cerrado sin avisar¬;¬Fuimos a Madrid centro expresamente para comer después de haber consultado horarios y su perfil de facebook y cual es nuestra sorpresa al encontrarlo cerrado sin un cartel o un aviso. Llamamos por tlf y nos dijeron que al ser el día de la mujer trabajadora, se lo habían tomado como festivo, totalmente lícito pero que mínimo que avisar. Encontramos... Más  Fuimos a Madrid centro expresamente para comer después de haber consultado horarios y su perfil de facebook y cual es nuestra sorpresa al encontrarlo cerrado sin un cartel o un aviso. Llamamos por tlf y nos dijeron que al ser el día de la mujer trabajadora, se lo habían tomado como festivo, totalmente lícito pero que mínimo que avisar. Encontramos en la puerta a dos parejas mas que también se quedaron tirados por sorpresa, en fin .¬;¬8 marzo 2015¬;¬Visitado el marzo de 2015¬;¬Relación calidad-precio 2;Ambiente 2;Servicio 2;Comida 2¬;¬¬;¬¬;¬Española, Menús vegetarianos, Opciones veganas¬;¬Abierto hasta tarde¬;¬Reservas¬;¬Comer barato¬;¬domingo 13:00 - 18:00 martes 13:00 - 00:30 miércoles 13:00 - 00:30 jueves 13:00 - 00:30 viernes 13:00 - 01:30 sábado 13:00 - 01:30¬;¬Dirección: Calle Buenavista 42, 28012 Madrid, España Ubicación: Europa  >  España  >  Comunidad de Madrid  >  Madrid>  > Lavapiés Barrio: Lavapiés¬;¬Dirección: Calle Buenavista 42, 28012 Madrid, España Ubicación: Europa  >  España  >  Comunidad de Madrid  >  Madrid>  > Lavapiés Barrio: Lavapiés¬
¬Restaurante¬;¬La Oveja Negra Taberna Vegana¬;¬hiel1982¬;¬Murcia, España¬;¬5¬;¬86¬;¬33¬;¬hiel1982De_Ap¬;¬2¬;¬Demasiadas sorpresas¬;¬A primera vista una típica taberna con comida vegana. Mucha gente, con movimiento cultural. Después la cruda realidad. El local hacinado, tan solo dos camareras que atendían tanto barra como mesas, hasta el cocinero tenía que salir a servir los platos. La carta poco variada y los platos poco elaborados. La higiene del lugar era cuestionable: cubiertos sucios y el... Más  A primera vista una típica taberna con comida vegana. Mucha gente, con movimiento cultural. Después la cruda realidad. El local hacinado, tan solo dos camareras que atendían tanto barra como mesas, hasta el cocinero tenía que salir a servir los platos. La carta poco variada y los platos poco elaborados. La higiene del lugar era cuestionable: cubiertos sucios y el agua del grifo. Encima no nos trajeron lo que habíamos pedido. Salimos de allí en cuanto pudimos.¬;¬8 febrero 2015¬;¬Visitado el febrero de 2015¬;¬Relación calidad-precio 2;Ambiente 2;Servicio 2;Comida 2¬;¬¬;¬¬;¬Española, Menús vegetarianos, Opciones veganas¬;¬Abierto hasta tarde¬;¬Reservas¬;¬Comer barato¬;¬domingo 13:00 - 18:00 martes 13:00 - 00:30 miércoles 13:00 - 00:30 jueves 13:00 - 00:30 viernes 13:00 - 01:30 sábado 13:00 - 01:30¬;¬Dirección: Calle Buenavista 42, 28012 Madrid, España Ubicación: Europa  >  España  >  Comunidad de Madrid  >  Madrid>  > Lavapiés Barrio: Lavapiés¬;¬Dirección: Calle Buenavista 42, 28012 Madrid, España Ubicación: Europa  >  España  >  Comunidad de Madrid  >  Madrid>  > Lavapiés Barrio: Lavapiés¬
¬Restaurante¬;¬La Oveja Negra Taberna Vegana¬;¬Maruca_C¬;¬Liestal, Suiza¬;¬4¬;¬28¬;¬18¬;¬Maruca_CLo_Nos¬;¬2¬;¬Lo quería como este... no pidas Seitan!¬;¬Nos gustó el ambiente político, activista de este lugar y normalmente nos gusta vegetariano o comida vegetariana. Pedimos los dos platos de seitan en el menú, y eran terribles. Sabía de nada y la mía tenía la textura de goma dura. La ensalada estaba bien, las patatas fritas bien. Las bebidas orgánicas estaban bien. Comida de otras personas (hamburguesas, wraps)... Más ¬;¬20 octubre 2016¬;¬¬;¬¬;¬¬;¬¬;¬Española, Menús vegetarianos, Opciones veganas¬;¬Abierto hasta tarde¬;¬Reservas¬;¬Comer barato¬;¬domingo 13:00 - 18:00 martes 13:00 - 00:30 miércoles 13:00 - 00:30 jueves 13:00 - 00:30 viernes 13:00 - 01:30 sábado 13:00 - 01:30¬;¬Dirección: Calle Buenavista 42, 28012 Madrid, España Ubicación: Europa  >  España  >  Comunidad de Madrid  >  Madrid>  > Lavapiés Barrio: Lavapiés¬;¬Dirección: Calle Buenavista 42, 28012 Madrid, España Ubicación: Europa  >  España  >  Comunidad de Madrid  >  Madrid>  > Lavapiés Barrio: Lavapiés¬
¬Restaurante¬;¬La Oveja Negra Taberna Vegana¬;¬JS20912¬;¬¬;¬1¬;¬4¬;¬2¬;¬JS20912Da_Aun¬;¬2¬;¬Dar comida vegetariana estricta un mal nombre¬;¬Aunque la comida era terrible, sólo tienes que mirar alrededor para darse cuenta la comida no es la razón por la cuál la gente viene aquí. Como una embarazada, casados sólo buscando algo de comida vegetariana estricta decente nos sentimos inmediatamente fuera de lugar con los jóvenes, revolucionario multitud, por los cuales veganismo es sin duda una protesta en vez... Más ¬;¬18 octubre 2014¬;¬¬;¬¬;¬¬;¬¬;¬Española, Menús vegetarianos, Opciones veganas¬;¬Abierto hasta tarde¬;¬Reservas¬;¬Comer barato¬;¬domingo 13:00 - 18:00 martes 13:00 - 00:30 miércoles 13:00 - 00:30 jueves 13:00 - 00:30 viernes 13:00 - 01:30 sábado 13:00 - 01:30¬;¬Dirección: Calle Buenavista 42, 28012 Madrid, España Ubicación: Europa  >  España  >  Comunidad de Madrid  >  Madrid>  > Lavapiés Barrio: Lavapiés¬;¬Dirección: Calle Buenavista 42, 28012 Madrid, España Ubicación: Europa  >  España  >  Comunidad de Madrid  >  Madrid>  > Lavapiés Barrio: Lavapiés¬
¬Restaurante¬;¬La Oveja Negra Taberna Vegana¬;¬Lunar27¬;¬San Francisco, California¬;¬3¬;¬10¬;¬5¬;¬Lunar27gr_Fui¬;¬2¬;¬gran decepción¬;¬Fuimos allí buscando una buena comida vegetariana estricta después de un largo día de viaje, pero la comida estaba grasienta y baja calidad. No se acercan a estar sano. El servicio era pobre. Lo único bueno fueron los zumos recién exprimidos.¬;¬23 abril 2014¬;¬¬;¬¬;¬¬;¬¬;¬Española, Menús vegetarianos, Opciones veganas¬;¬Abierto hasta tarde¬;¬Reservas¬;¬Comer barato¬;¬domingo 13:00 - 18:00 martes 13:00 - 00:30 miércoles 13:00 - 00:30 jueves 13:00 - 00:30 viernes 13:00 - 01:30 sábado 13:00 - 01:30¬;¬Dirección: Calle Buenavista 42, 28012 Madrid, España Ubicación: Europa  >  España  >  Comunidad de Madrid  >  Madrid>  > Lavapiés Barrio: Lavapiés¬;¬Dirección: Calle Buenavista 42, 28012 Madrid, España Ubicación: Europa  >  España  >  Comunidad de Madrid  >  Madrid>  > Lavapiés Barrio: Lavapiés¬
