Tipo,NombreRestaurante_,NombreUsuario_,LocalizaciónUsario_,NivelUsuario_,OpinionesTotalesUsuario_,VotosUtiles_,IDComentario_,ValoracionComentario_,TituloComentario_,Comentario_,FechaCometario_,FechaVisitaRestaurante_,ValoracionesComentario_,ResumenPuntuacionesRestaurante_,PrecioMedio_,TipoCocina_,Comida_,CaracteristicasDelResaurante_,AconsejablePara_,Horarios_,DireccionCompletaRestaurante_,Descripcion_
¬Restaurante¬;¬La Taberna de Mister Pinkleton¬;¬hawkmdend¬;¬San Juan, Puerto Rico¬;¬4¬;¬32¬;¬19¬;¬hawkmdendA _el¬;¬3¬;¬A ver el espectaculo SI!!, a comer NO!!!¬;¬el lugar es estupendo para una noche de flamenco. La verdad que la calidad vocal de los interpretes es muy buena y las damas bailan muy bien. Pero la calidad de la comida es pesima y cara!. Deben de buscarse un nuevo cocinero y se lo que digo porque vi el espectaculo dos veces. Y las dos veces todo lo... Más  el lugar es estupendo para una noche de flamenco. La verdad que la calidad vocal de los interpretes es muy buena y las damas bailan muy bien. Pero la calidad de la comida es pesima y cara!. Deben de buscarse un nuevo cocinero y se lo que digo porque vi el espectaculo dos veces. Y las dos veces todo lo relacionado con el flamenco estuvo muy bueno pero la comida fue malisima en las dos ocasiones. Por lo demas el ambiente es lo clasico de un bar turistico en madrid, agradable al turista.¬;¬30 diciembre 2015¬;¬Visitado el noviembre de 2015¬;¬Relación calidad-precio 3;Servicio 5;Comida 1¬;¬¬;¬30 € - 60 €¬;¬Bar, Mediterránea, Europea, Española¬;¬Cenas, Abierto hasta tarde, Bebidas¬;¬Reservas, Capacidad, Camareros, Sirve alcohol, Bar completo¬;¬Ocasiones especiales, Cocina local, Familias con niños, Ambiente de bar, Grupos grandes¬;¬domingo 18:30 - 01:30 lunes 18:30 - 01:30 martes 18:30 - 01:30 miércoles 18:30 - 01:30 jueves 18:30 - 01:30 viernes 18:30 - 01:30 sábado 18:30 - 01:30¬;¬Dirección: Calle Cuchilleros 7, 28005 Madrid, España Ubicación: Europa  >  España  >  Comunidad de Madrid  >  Madrid>  > Centro Barrio: Centro Número de teléfono: +34 913 64 02 63¬;¬Flamenco en directo!¬
¬Restaurante¬;¬La Taberna de Mister Pinkleton¬;¬danna d¬;¬¬;¬0¬;¬2¬;¬1¬;¬danna dBu_El¬;¬3¬;¬Buen espectáculo, comida regular¬;¬El espectáculo es muy bonito y divertido pero no recomiendo la comida... esta bien para tomar un vinito y un poco de jamoncito... Pero no para cenar. La comida deja mucho que desear. El espectáculo es muy bonito y divertido pero no recomiendo la comida... esta bien para tomar un vinito y un poco de jamoncito... Pero no para cenar. La comida deja mucho que desear.¬;¬8 noviembre 2015¬;¬¬;¬¬;¬¬;¬30 € - 60 €¬;¬Bar, Mediterránea, Europea, Española¬;¬Cenas, Abierto hasta tarde, Bebidas¬;¬Reservas, Capacidad, Camareros, Sirve alcohol, Bar completo¬;¬Ocasiones especiales, Cocina local, Familias con niños, Ambiente de bar, Grupos grandes¬;¬domingo 18:30 - 01:30 lunes 18:30 - 01:30 martes 18:30 - 01:30 miércoles 18:30 - 01:30 jueves 18:30 - 01:30 viernes 18:30 - 01:30 sábado 18:30 - 01:30¬;¬Dirección: Calle Cuchilleros 7, 28005 Madrid, España Ubicación: Europa  >  España  >  Comunidad de Madrid  >  Madrid>  > Centro Barrio: Centro Número de teléfono: +34 913 64 02 63¬;¬Flamenco en directo!¬
¬Restaurante¬;¬La Taberna de Mister Pinkleton¬;¬Tonelero¬;¬¬;¬4¬;¬42¬;¬15¬;¬ToneleroPa_Típ¬;¬3¬;¬Para turistas...¬;¬Típico sitio para turistas. Si lo que quieres es comer, no te lo pienses, elige otro lugar. El espectáculo entretenido sin mas. Típico sitio para turistas. Si lo que quieres es comer, no te lo pienses, elige otro lugar. El espectáculo entretenido sin mas.¬;¬3 abril 2015¬;¬¬;¬¬;¬¬;¬30 € - 60 €¬;¬Bar, Mediterránea, Europea, Española¬;¬Cenas, Abierto hasta tarde, Bebidas¬;¬Reservas, Capacidad, Camareros, Sirve alcohol, Bar completo¬;¬Ocasiones especiales, Cocina local, Familias con niños, Ambiente de bar, Grupos grandes¬;¬domingo 18:30 - 01:30 lunes 18:30 - 01:30 martes 18:30 - 01:30 miércoles 18:30 - 01:30 jueves 18:30 - 01:30 viernes 18:30 - 01:30 sábado 18:30 - 01:30¬;¬Dirección: Calle Cuchilleros 7, 28005 Madrid, España Ubicación: Europa  >  España  >  Comunidad de Madrid  >  Madrid>  > Centro Barrio: Centro Número de teléfono: +34 913 64 02 63¬;¬Flamenco en directo!¬
¬Restaurante¬;¬La Taberna de Mister Pinkleton¬;¬Pollywu8¬;¬Madrid, España¬;¬0¬;¬1¬;¬2¬;¬Pollywu8Bu_Fui¬;¬3¬;¬Buen espectáculo!¬;¬Fui al turno del jueves a las 19.00. No había mucha gente, me imaginaba era por el día, también por el horario. El espectáculo fue muy bueno y profesional. Los cantantes y bailarines expresaban muy bien las canciones. Aunque sea bueno, siento que falta algo. Podría ser más entretenido. Fui al turno del jueves a las 19.00. No había mucha gente, me imaginaba era por el día, también por el horario. El espectáculo fue muy bueno y profesional. Los cantantes y bailarines expresaban muy bien las canciones. Aunque sea bueno, siento que falta algo. Podría ser más entretenido.¬;¬5 marzo 2015¬;¬Visitado el marzo de 2015¬;¬Ambiente 4;Servicio 4¬;¬¬;¬30 € - 60 €¬;¬Bar, Mediterránea, Europea, Española¬;¬Cenas, Abierto hasta tarde, Bebidas¬;¬Reservas, Capacidad, Camareros, Sirve alcohol, Bar completo¬;¬Ocasiones especiales, Cocina local, Familias con niños, Ambiente de bar, Grupos grandes¬;¬domingo 18:30 - 01:30 lunes 18:30 - 01:30 martes 18:30 - 01:30 miércoles 18:30 - 01:30 jueves 18:30 - 01:30 viernes 18:30 - 01:30 sábado 18:30 - 01:30¬;¬Dirección: Calle Cuchilleros 7, 28005 Madrid, España Ubicación: Europa  >  España  >  Comunidad de Madrid  >  Madrid>  > Centro Barrio: Centro Número de teléfono: +34 913 64 02 63¬;¬Flamenco en directo!¬
¬Restaurante¬;¬La Taberna de Mister Pinkleton¬;¬Mandymiz1...¬;¬Malta¬;¬1¬;¬1¬;¬0¬;¬Mandymiz1...Fa_Fui¬;¬3¬;¬Fantástico espectáculo pero la comida era horrible¬;¬Fuimos en un viernes por la noche para la cena a las 9:00 pm. La camarera fue perdida en el espacio, la mayoría de los platos ordenados no estaban disponibles y tuvimos que pedir las disponibles en su mayoría queso platos y nos dieron el mismo tipo de queso en casi todos nuestros platos. No puede ser considerado como una... Más ¬;¬1 noviembre 2014¬;¬¬;¬¬;¬¬;¬30 € - 60 €¬;¬Bar, Mediterránea, Europea, Española¬;¬Cenas, Abierto hasta tarde, Bebidas¬;¬Reservas, Capacidad, Camareros, Sirve alcohol, Bar completo¬;¬Ocasiones especiales, Cocina local, Familias con niños, Ambiente de bar, Grupos grandes¬;¬domingo 18:30 - 01:30 lunes 18:30 - 01:30 martes 18:30 - 01:30 miércoles 18:30 - 01:30 jueves 18:30 - 01:30 viernes 18:30 - 01:30 sábado 18:30 - 01:30¬;¬Dirección: Calle Cuchilleros 7, 28005 Madrid, España Ubicación: Europa  >  España  >  Comunidad de Madrid  >  Madrid>  > Centro Barrio: Centro Número de teléfono: +34 913 64 02 63¬;¬Flamenco en directo!¬
¬Restaurante¬;¬La Taberna de Mister Pinkleton¬;¬??????? ?¬;¬¬;¬3¬;¬10¬;¬6¬;¬??????? ?Co_No¬;¬3¬;¬Cosas extrañas ...¬;¬No es obvio lo que pagas ... 10 euros es un ""boleto"" incluyendo algunas bebidas. Pagamos por nuestra cerveza más 10 euros para las bebidas nunca tuvimos.¬;¬1 junio 2014¬;¬¬;¬¬;¬¬;¬30 € - 60 €¬;¬Bar, Mediterránea, Europea, Española¬;¬Cenas, Abierto hasta tarde, Bebidas¬;¬Reservas, Capacidad, Camareros, Sirve alcohol, Bar completo¬;¬Ocasiones especiales, Cocina local, Familias con niños, Ambiente de bar, Grupos grandes¬;¬domingo 18:30 - 01:30 lunes 18:30 - 01:30 martes 18:30 - 01:30 miércoles 18:30 - 01:30 jueves 18:30 - 01:30 viernes 18:30 - 01:30 sábado 18:30 - 01:30¬;¬Dirección: Calle Cuchilleros 7, 28005 Madrid, España Ubicación: Europa  >  España  >  Comunidad de Madrid  >  Madrid>  > Centro Barrio: Centro Número de teléfono: +34 913 64 02 63¬;¬Flamenco en directo!¬
