Tipo,NombreRestaurante_,NombreUsuario_,LocalizaciónUsario_,NivelUsuario_,OpinionesTotalesUsuario_,VotosUtiles_,IDComentario_,ValoracionComentario_,TituloComentario_,Comentario_,FechaCometario_,FechaVisitaRestaurante_,ValoracionesComentario_,ResumenPuntuacionesRestaurante_,PrecioMedio_,TipoCocina_,Comida_,CaracteristicasDelResaurante_,AconsejablePara_,Horarios_,DireccionCompletaRestaurante_,Descripcion_
¬Restaurante¬;¬Alright¬;¬lunacreciente23¬;¬Madrid, España¬;¬1¬;¬3¬;¬3¬;¬lunacreciente23Es_Me¬;¬3¬;¬Esta muy bien¬;¬Me gusto en cuanto entre, buen servicio buena comida, buenos precios. Alomejor se podrian mejorar unas cuantas cosas pero es cuestion de gustos. Teniendo en cuenta el tiempo y las opiniones me esperaba un sitio espectacular pero esta claro que para gustos los colores pero a pesar de todo sin duda volvere no fue una mala experiencia.¬;¬29 abril 2015¬;¬¬;¬¬;¬¬;¬¬;¬Americana, Internacional, Menú para celíacos¬;¬Cenas, Comidas¬;¬Para llevar, Camareros, Tronas disponibles, Acceso para discapacitados, Sirve alcohol, Bar completo, Acepta Mastercard, Acepta Visa, Reservas, Capacidad¬;¬Familias con niños, Comer barato, Grupos grandes, Ocasiones especiales¬;¬domingo 13:30 - 16:00 martes 13:30 - 16:00 miércoles 13:30 - 16:00 jueves 13:30 - 16:00 viernes 13:30 - 16:00 sábado 13:30 - 16:00¬;¬Dirección: Calle de Pedro Rico, 41 | Lateral Avda de la Ilustracion, 28029 Madrid, España Ubicación: Europa  >  España  >  Comunidad de Madrid  >  Madrid Número de teléfono: 34912190725¬;¬PERMANECEREMOS CERRADOS EN AGOSTO¬
¬Restaurante¬;¬Alright¬;¬Papain7¬;¬¬;¬4¬;¬39¬;¬22¬;¬Papain7Bi_El¬;¬3¬;¬Bien, pero esperaba más por las opiniones que había visto¬;¬El restaurante no está mal. Cómodo porque aparcas bien en la puerta, el servicio muy amable, bastante rápido, eficiente y la comida bien. Un poco caro en mi opinión para el tipo de comida que sirven, pero no se come mal. Nos pusieron un falso risotto de entrante al pedir la bebida que estaba muy bueno. Pedimos unos tirabuzones de... Más  El restaurante no está mal. Cómodo porque aparcas bien en la puerta, el servicio muy amable, bastante rápido, eficiente y la comida bien. Un poco caro en mi opinión para el tipo de comida que sirven, pero no se come mal. Nos pusieron un falso risotto de entrante al pedir la bebida que estaba muy bueno. Pedimos unos tirabuzones de pollo y unos nachos al centro, ricos. De principal yo probé las costillas por las buenas críticas que había leído y porque las recomiendan como especialidad. Están bien pero tampoco son para tirar cohetes. En general bastante bien, un sitio recomendable. Probablemente nos decepcionó algo por las buenas críticas que habíamos leído.¬;¬5 abril 2015¬;¬Visitado el abril de 2015¬;¬Relación calidad-precio 2;Servicio 4;Comida 3¬;¬¬;¬¬;¬Americana, Internacional, Menú para celíacos¬;¬Cenas, Comidas¬;¬Para llevar, Camareros, Tronas disponibles, Acceso para discapacitados, Sirve alcohol, Bar completo, Acepta Mastercard, Acepta Visa, Reservas, Capacidad¬;¬Familias con niños, Comer barato, Grupos grandes, Ocasiones especiales¬;¬domingo 13:30 - 16:00 martes 13:30 - 16:00 miércoles 13:30 - 16:00 jueves 13:30 - 16:00 viernes 13:30 - 16:00 sábado 13:30 - 16:00¬;¬Dirección: Calle de Pedro Rico, 41 | Lateral Avda de la Ilustracion, 28029 Madrid, España Ubicación: Europa  >  España  >  Comunidad de Madrid  >  Madrid Número de teléfono: 34912190725¬;¬PERMANECEREMOS CERRADOS EN AGOSTO¬
¬Restaurante¬;¬Alright¬;¬Zyrianos¬;¬Madrid, Comunidad de Madrid, Spain¬;¬3¬;¬11¬;¬7¬;¬ZyrianosCo_Si¬;¬3¬;¬Comida informal americana¬;¬Si te gusta la comida americana con un plus de innovación te gustará este restaurante. Carne, hamburguesas y costillas tiernas y sabrosas. De entrante nos propusieron huevos escalfados con patatas paja y trufa y fue un éxito. Y los postres...Hmmmmm No dejes de probar un bizcocho con crema de naranja y frambuesa. Es un sitio ideal para ir con amigos... Más  Si te gusta la comida americana con un plus de innovación te gustará este restaurante. Carne, hamburguesas y costillas tiernas y sabrosas. De entrante nos propusieron huevos escalfados con patatas paja y trufa y fue un éxito. Y los postres...Hmmmmm No dejes de probar un bizcocho con crema de naranja y frambuesa. Es un sitio ideal para ir con amigos en plan informal.¬;¬17 marzo 2015¬;¬¬;¬¬;¬¬;¬¬;¬Americana, Internacional, Menú para celíacos¬;¬Cenas, Comidas¬;¬Para llevar, Camareros, Tronas disponibles, Acceso para discapacitados, Sirve alcohol, Bar completo, Acepta Mastercard, Acepta Visa, Reservas, Capacidad¬;¬Familias con niños, Comer barato, Grupos grandes, Ocasiones especiales¬;¬domingo 13:30 - 16:00 martes 13:30 - 16:00 miércoles 13:30 - 16:00 jueves 13:30 - 16:00 viernes 13:30 - 16:00 sábado 13:30 - 16:00¬;¬Dirección: Calle de Pedro Rico, 41 | Lateral Avda de la Ilustracion, 28029 Madrid, España Ubicación: Europa  >  España  >  Comunidad de Madrid  >  Madrid Número de teléfono: 34912190725¬;¬PERMANECEREMOS CERRADOS EN AGOSTO¬
¬Restaurante¬;¬Alright¬;¬Jorge9221¬;¬Madrid, España¬;¬5¬;¬59¬;¬45¬;¬Jorge9221No_Fui¬;¬3¬;¬No está mal¬;¬Fuimos atraídos por los excelentes comentarios de tripadvisor sobre las costillas de este restaurante y por su posición en el ranking. No obstante, a pesar de que no esta mal y de la rapidez y amabilidad de los camareros, hemos comido costillas mucho mejores; estas no saben como la auténtica costilla a na barbacoa y no esta suficientemente desgrasada. Es... Más  Fuimos atraídos por los excelentes comentarios de tripadvisor sobre las costillas de este restaurante y por su posición en el ranking. No obstante, a pesar de que no esta mal y de la rapidez y amabilidad de los camareros, hemos comido costillas mucho mejores; estas no saben como la auténtica costilla a na barbacoa y no esta suficientemente desgrasada. Es mas, al tiene grandes trozos del costillar que son solo grasa tipo tocino y que hay que quitar. Los entrantes y los postres bastante buenos pero el supuesto plato estrella nos pareció decepcionante.¬;¬8 marzo 2015¬;¬¬;¬¬;¬¬;¬¬;¬Americana, Internacional, Menú para celíacos¬;¬Cenas, Comidas¬;¬Para llevar, Camareros, Tronas disponibles, Acceso para discapacitados, Sirve alcohol, Bar completo, Acepta Mastercard, Acepta Visa, Reservas, Capacidad¬;¬Familias con niños, Comer barato, Grupos grandes, Ocasiones especiales¬;¬domingo 13:30 - 16:00 martes 13:30 - 16:00 miércoles 13:30 - 16:00 jueves 13:30 - 16:00 viernes 13:30 - 16:00 sábado 13:30 - 16:00¬;¬Dirección: Calle de Pedro Rico, 41 | Lateral Avda de la Ilustracion, 28029 Madrid, España Ubicación: Europa  >  España  >  Comunidad de Madrid  >  Madrid Número de teléfono: 34912190725¬;¬PERMANECEREMOS CERRADOS EN AGOSTO¬
¬Restaurante¬;¬Alright¬;¬Juan F¬;¬¬;¬6¬;¬219¬;¬56¬;¬Juan FPe_Fui¬;¬3¬;¬Pequeña decepción¬;¬Fuimos a cenar. La razón de visitar Alright fue ya que según algunos colaboradores de Trypadvisor, aquí preparan las mejores costillas de Madrid y por tanto es la razón por la que se encuentran en el 3 puesto en Madrid. El local es acogedor y bien acondicionado. Cuidado con el aireacondicionado, ya que si te da directamente el chorro de... Más  Fuimos a cenar. La razón de visitar Alright fue ya que según algunos colaboradores de Trypadvisor, aquí preparan las mejores costillas de Madrid y por tanto es la razón por la que se encuentran en el 3 puesto en Madrid. El local es acogedor y bien acondicionado. Cuidado con el aireacondicionado, ya que si te da directamente el chorro de aire caliente puede ser bastante molesto. Como no podía ser de otra forma pedimos las costillas además de unos nachos de entrante. Los nachos con carne son bastante sabrosos y tanto la carne como el resto de ingredientes son de calidad, muy recomendable pedirlos. Como plato principal, llegaron las costillas, ese momento tan esperado... y es ahí donde llegó la decepción. Pese al buen aspecto de las costillas, la carne estaba un poco fría y había un claro exceso de sal. La salsa es muy sabrosa y se percibe que es de elaboración propia, sin embargo, al igual que la carne estaba bastante salada. Por su parte, la carne, tenía muy buen sabor pero tenía demasiada grasa. Tras esto nos quedamos tan llenos que no pudimos siquiera pedir postre. Por su parte el servicio, es muy atento y estuvieron muy cordiales tanto al sentarnos como al tomarnos la orden, incluso nos ofrecieron cafe y chupito por cuenta de la casa. El precio rondará los 17Euros/persona. Pese a que las costillas nos decepcionaron, considero que fue mala suerte y volveremos para degustar de nuevo esas costillas, así como tantos otros platos que tenían muy buena pinta.¬;¬20 enero 2015¬;¬Visitado el enero de 2015¬;¬Relación calidad-precio 4;Ambiente 3;Servicio 4;Comida 3¬;¬¬;¬¬;¬Americana, Internacional, Menú para celíacos¬;¬Cenas, Comidas¬;¬Para llevar, Camareros, Tronas disponibles, Acceso para discapacitados, Sirve alcohol, Bar completo, Acepta Mastercard, Acepta Visa, Reservas, Capacidad¬;¬Familias con niños, Comer barato, Grupos grandes, Ocasiones especiales¬;¬domingo 13:30 - 16:00 martes 13:30 - 16:00 miércoles 13:30 - 16:00 jueves 13:30 - 16:00 viernes 13:30 - 16:00 sábado 13:30 - 16:00¬;¬Dirección: Calle de Pedro Rico, 41 | Lateral Avda de la Ilustracion, 28029 Madrid, España Ubicación: Europa  >  España  >  Comunidad de Madrid  >  Madrid Número de teléfono: 34912190725¬;¬PERMANECEREMOS CERRADOS EN AGOSTO¬
¬Restaurante¬;¬Alright¬;¬daniel j¬;¬¬;¬3¬;¬16¬;¬10¬;¬daniel jBu_Deb¬;¬3¬;¬Buen sitio¬;¬Debo ser muy exigente y ruego me disculpen por mi modesta opinion pero la hamburguesa que yo probé con cabrales y cebolla, llevaba poquisimo cabrales y no me gustó su olor y no era por el cabrales que se como huele y me encanta. Me dejé la mitad y no suelo dejar nunca una hamburguesa. Las patatas fritas muy buenas.... Más  Debo ser muy exigente y ruego me disculpen por mi modesta opinion pero la hamburguesa que yo probé con cabrales y cebolla, llevaba poquisimo cabrales y no me gustó su olor y no era por el cabrales que se como huele y me encanta. Me dejé la mitad y no suelo dejar nunca una hamburguesa. Las patatas fritas muy buenas. En cuanto a las costillas tenian una textura magnifica, casi mantequilla, lastima que tanta salsa barbacoa no te deje apreciar el sabor de la carne. Por lo demas todo correcto y una buena atencion.¬;¬19 enero 2015¬;¬¬;¬¬;¬¬;¬¬;¬Americana, Internacional, Menú para celíacos¬;¬Cenas, Comidas¬;¬Para llevar, Camareros, Tronas disponibles, Acceso para discapacitados, Sirve alcohol, Bar completo, Acepta Mastercard, Acepta Visa, Reservas, Capacidad¬;¬Familias con niños, Comer barato, Grupos grandes, Ocasiones especiales¬;¬domingo 13:30 - 16:00 martes 13:30 - 16:00 miércoles 13:30 - 16:00 jueves 13:30 - 16:00 viernes 13:30 - 16:00 sábado 13:30 - 16:00¬;¬Dirección: Calle de Pedro Rico, 41 | Lateral Avda de la Ilustracion, 28029 Madrid, España Ubicación: Europa  >  España  >  Comunidad de Madrid  >  Madrid Número de teléfono: 34912190725¬;¬PERMANECEREMOS CERRADOS EN AGOSTO¬
¬Restaurante¬;¬Alright¬;¬D. O¬;¬¬;¬0¬;¬2¬;¬1¬;¬D. OBu_Bas¬;¬3¬;¬Buena relación calidad-precio¬;¬Bastante sorprendido cuando vi esta hamburguesa en el top 3 en la lista de tripadvisor. 'Mixto probamos de triangulitos', una hamburguesa y costillas. Todo estaba sabroso como la calidad de la comida es muy buena. Sin embargo, el servicio es muy bueno creo que es un poco sobrevalorado, desde mi punto de vista. Hay un montón de ofertas más allá... Más ¬;¬17 julio 2016¬;¬¬;¬¬;¬¬;¬¬;¬Americana, Internacional, Menú para celíacos¬;¬Cenas, Comidas¬;¬Para llevar, Camareros, Tronas disponibles, Acceso para discapacitados, Sirve alcohol, Bar completo, Acepta Mastercard, Acepta Visa, Reservas, Capacidad¬;¬Familias con niños, Comer barato, Grupos grandes, Ocasiones especiales¬;¬domingo 13:30 - 16:00 martes 13:30 - 16:00 miércoles 13:30 - 16:00 jueves 13:30 - 16:00 viernes 13:30 - 16:00 sábado 13:30 - 16:00¬;¬Dirección: Calle de Pedro Rico, 41 | Lateral Avda de la Ilustracion, 28029 Madrid, España Ubicación: Europa  >  España  >  Comunidad de Madrid  >  Madrid Número de teléfono: 34912190725¬;¬PERMANECEREMOS CERRADOS EN AGOSTO¬
