Tipo,NombreRestaurante_,NombreUsuario_,LocalizaciónUsario_,NivelUsuario_,OpinionesTotalesUsuario_,VotosUtiles_,IDComentario_,ValoracionComentario_,TituloComentario_,Comentario_,FechaCometario_,FechaVisitaRestaurante_,ValoracionesComentario_,ResumenPuntuacionesRestaurante_,PrecioMedio_,TipoCocina_,Comida_,CaracteristicasDelResaurante_,AconsejablePara_,Horarios_,DireccionCompletaRestaurante_,Descripcion_
¬Restaurante¬;¬La Oveja Negra Taberna Vegana¬;¬Marc B¬;¬Berlín, Alemania¬;¬5¬;¬78¬;¬62¬;¬Marc BMu_Com¬;¬3¬;¬Muy normalito¬;¬Comimos dos entrantes a compartir: tabla de patés vegetales y queso vegano y una ración de croquetas. Las croquetas estaban ricas, pero de los patés no se salvaba ninguno de los 4. El menú por 8,5 incluyó una sopa -que estaba muy buena- y un principal que era arroz con 3 mini hamburguesas que estaban refritas. Una bebida, pan y... Más  Comimos dos entrantes a compartir: tabla de patés vegetales y queso vegano y una ración de croquetas. Las croquetas estaban ricas, pero de los patés no se salvaba ninguno de los 4. El menú por 8,5 incluyó una sopa -que estaba muy buena- y un principal que era arroz con 3 mini hamburguesas que estaban refritas. Una bebida, pan y yogur (del súper). El precio está muy bien, por lo que tampoco se podía esperar mucho. Lo bueno: tienen muchísima variedad vegana en la carta. Me pareció un buen sitio para ir a tomar cañas y pedir algo para picar, pero no para ir a sentarse a comer. El servicio fue amable aunque sólo tenían a dos personas para toda la taberna, y se quedaba corto.¬;¬21 septiembre 2016¬;¬Visitado el septiembre de 2016¬;¬Relación calidad-precio 4;Servicio 3;Comida 5¬;¬¬;¬¬;¬Española, Menús vegetarianos, Opciones veganas¬;¬Abierto hasta tarde¬;¬Reservas¬;¬Comer barato¬;¬domingo 13:00 - 18:00 martes 13:00 - 00:30 miércoles 13:00 - 00:30 jueves 13:00 - 00:30 viernes 13:00 - 01:30 sábado 13:00 - 01:30¬;¬Dirección: Calle Buenavista 42, 28012 Madrid, España Ubicación: Europa  >  España  >  Comunidad de Madrid  >  Madrid>  > Lavapiés Barrio: Lavapiés¬;¬Dirección: Calle Buenavista 42, 28012 Madrid, España Ubicación: Europa  >  España  >  Comunidad de Madrid  >  Madrid>  > Lavapiés Barrio: Lavapiés¬
¬Restaurante¬;¬La Oveja Negra Taberna Vegana¬;¬TyyniTahti¬;¬Madrid, España¬;¬3¬;¬11¬;¬4¬;¬TyyniTahtiPr_La¬;¬3¬;¬Prescindamos del servicio...¬;¬La verdad que anda bastante a la zaga del B13; quizá su situación menos céntrica la haga menos atractiva pero esta tabernilla no se queda atrás. La comida estaba buena y correcta, simple pero saciante, una ración buena y sabroso en general. Realmente era una muestra de que un menú del día puede ser vegano, típico y sencillo. Generalmente los... Más  La verdad que anda bastante a la zaga del B13; quizá su situación menos céntrica la haga menos atractiva pero esta tabernilla no se queda atrás. La comida estaba buena y correcta, simple pero saciante, una ración buena y sabroso en general. Realmente era una muestra de que un menú del día puede ser vegano, típico y sencillo. Generalmente los restaurantes veganos y los veganos en general nos vemos obligados a recurrir a cosas muy elaboradas para convencer; pero una vez has visitado la Oveja te demuestras que no es así. La decoración me encantó y el ambiente feminista, animalista y anarquista es muy agradable. Lo único que me ha hecho no valorar completamente de forma positiva ha sido el trato del personal: bastante frío y borde, hablando en plata. Ni gracias ni nada, vamos no merecían propina por su amabilidad. Barato, bueno y típico pero no resaltan por su trato de primera.¬;¬6 junio 2016¬;¬Visitado el abril de 2016¬;¬Relación calidad-precio 4;Servicio 3;Comida 4¬;¬¬;¬¬;¬Española, Menús vegetarianos, Opciones veganas¬;¬Abierto hasta tarde¬;¬Reservas¬;¬Comer barato¬;¬domingo 13:00 - 18:00 martes 13:00 - 00:30 miércoles 13:00 - 00:30 jueves 13:00 - 00:30 viernes 13:00 - 01:30 sábado 13:00 - 01:30¬;¬Dirección: Calle Buenavista 42, 28012 Madrid, España Ubicación: Europa  >  España  >  Comunidad de Madrid  >  Madrid>  > Lavapiés Barrio: Lavapiés¬;¬Dirección: Calle Buenavista 42, 28012 Madrid, España Ubicación: Europa  >  España  >  Comunidad de Madrid  >  Madrid>  > Lavapiés Barrio: Lavapiés¬
¬Restaurante¬;¬La Oveja Negra Taberna Vegana¬;¬Brenda V¬;¬Madrid, España¬;¬3¬;¬14¬;¬2¬;¬Brenda VCo_Fui¬;¬3¬;¬Comida vegana pero no gourmet, buen precio y trato mejorable¬;¬Fui con mis amigos de la universidad y personalmente me gustó la comida, las cantidades también bien aunque tardaron bastante en traer ciertos platos, y eso que prácticamente estábamos solo nosotros. Comí croquetas, creo que eran de calabacín y otras de setas, y estaban bastante ricas, también una ensalada de guisantes que me pareció extremadamente simple porque no llevaba ningún... Más  Fui con mis amigos de la universidad y personalmente me gustó la comida, las cantidades también bien aunque tardaron bastante en traer ciertos platos, y eso que prácticamente estábamos solo nosotros. Comí croquetas, creo que eran de calabacín y otras de setas, y estaban bastante ricas, también una ensalada de guisantes que me pareció extremadamente simple porque no llevaba ningún aderezo. Luego patatas fritas con salsa, normales, y no recuerdo nada más reseñable. El precio era muy asequible pero apenas nos hicieron caso cuando queríamos pedir o simplemente pedir la cuenta para irnos, así que nos sentimos un poco ignorados.¬;¬25 mayo 2016¬;¬Visitado el octubre de 2015¬;¬Relación calidad-precio 5;Servicio 2;Comida 4¬;¬¬;¬¬;¬Española, Menús vegetarianos, Opciones veganas¬;¬Abierto hasta tarde¬;¬Reservas¬;¬Comer barato¬;¬domingo 13:00 - 18:00 martes 13:00 - 00:30 miércoles 13:00 - 00:30 jueves 13:00 - 00:30 viernes 13:00 - 01:30 sábado 13:00 - 01:30¬;¬Dirección: Calle Buenavista 42, 28012 Madrid, España Ubicación: Europa  >  España  >  Comunidad de Madrid  >  Madrid>  > Lavapiés Barrio: Lavapiés¬;¬Dirección: Calle Buenavista 42, 28012 Madrid, España Ubicación: Europa  >  España  >  Comunidad de Madrid  >  Madrid>  > Lavapiés Barrio: Lavapiés¬
¬Restaurante¬;¬La Oveja Negra Taberna Vegana¬;¬Mirko M¬;¬¬;¬4¬;¬20¬;¬10¬;¬Mirko MDi_La¬;¬3¬;¬Diferente¬;¬La comida está buena y es barata pero solo en plan hamburguesas y tacos, así que como no pidas varias cosas te quedas con hambre; el menú de lunes a viernes y lo que hay en la carta es lo que hay, no te preparan nada fuera de eso. La comida está buena y es barata pero solo en plan hamburguesas y tacos, así que como no pidas varias cosas te quedas con hambre; el menú de lunes a viernes y lo que hay en la carta es lo que hay, no te preparan nada fuera de eso.¬;¬20 febrero 2016¬;¬Visitado el febrero de 2016¬;¬Relación calidad-precio 4;Servicio 3;Comida 3¬;¬¬;¬¬;¬Española, Menús vegetarianos, Opciones veganas¬;¬Abierto hasta tarde¬;¬Reservas¬;¬Comer barato¬;¬domingo 13:00 - 18:00 martes 13:00 - 00:30 miércoles 13:00 - 00:30 jueves 13:00 - 00:30 viernes 13:00 - 01:30 sábado 13:00 - 01:30¬;¬Dirección: Calle Buenavista 42, 28012 Madrid, España Ubicación: Europa  >  España  >  Comunidad de Madrid  >  Madrid>  > Lavapiés Barrio: Lavapiés¬;¬Dirección: Calle Buenavista 42, 28012 Madrid, España Ubicación: Europa  >  España  >  Comunidad de Madrid  >  Madrid>  > Lavapiés Barrio: Lavapiés¬
¬Restaurante¬;¬La Oveja Negra Taberna Vegana¬;¬Astroabel¬;¬Madrid, España¬;¬3¬;¬10¬;¬2¬;¬AstroabelLa_La¬;¬3¬;¬La Oveja Negra¬;¬La taberna La Oveja Negra está bien. El ambiente que se respira es relajado, aunque si vas en fín de semana, casi hay que pelearse para poder coger sitio. La hamburguesa de aceitunas negras y quinoa está muy rica. El último día que fui pedí la fajita de seitán y, la verdad, me pareció comprado en el Carrefour. Correoso, insípido... Más  La taberna La Oveja Negra está bien. El ambiente que se respira es relajado, aunque si vas en fín de semana, casi hay que pelearse para poder coger sitio. La hamburguesa de aceitunas negras y quinoa está muy rica. El último día que fui pedí la fajita de seitán y, la verdad, me pareció comprado en el Carrefour. Correoso, insípido y encima me la sirvieron fría. Se ve que no tenían muchas ganas de cocinar esa noche y recalentaron un poco la que me ofrecieron a mí. La verdad, era la tercera vez que iba y la que me confirmó que es un sitio al que no me apetece demasiado volver. Otra cosa que se agradecería es la atención de los/las camareras. Ni una sola palabra, caras como si siempre estuvieran enfadadas… Creo que hay sitios mejores del mismo estilo y tipo de comida en Madrid. Si me preguntan si lo recomendaría, hoy por hoy, no. Quizá vuelva más adelante, pero mi última experiencia no fue buena. Eso sí, el pisto estaba muy bueno, todo hay que decirlo.¬;¬17 febrero 2016¬;¬Visitado el febrero de 2016¬;¬Relación calidad-precio 3;Servicio 3;Comida 3¬;¬¬;¬¬;¬Española, Menús vegetarianos, Opciones veganas¬;¬Abierto hasta tarde¬;¬Reservas¬;¬Comer barato¬;¬domingo 13:00 - 18:00 martes 13:00 - 00:30 miércoles 13:00 - 00:30 jueves 13:00 - 00:30 viernes 13:00 - 01:30 sábado 13:00 - 01:30¬;¬Dirección: Calle Buenavista 42, 28012 Madrid, España Ubicación: Europa  >  España  >  Comunidad de Madrid  >  Madrid>  > Lavapiés Barrio: Lavapiés¬;¬Dirección: Calle Buenavista 42, 28012 Madrid, España Ubicación: Europa  >  España  >  Comunidad de Madrid  >  Madrid>  > Lavapiés Barrio: Lavapiés¬
¬Restaurante¬;¬La Oveja Negra Taberna Vegana¬;¬afioravanti¬;¬Madrid, España¬;¬5¬;¬66¬;¬16¬;¬afioravantiBu_Est¬;¬3¬;¬Buen ambiente y muy economico¬;¬Estuve aquí ayer, el sitio es bastante espartano aunque el ambiente es bueno, la comida no me ha entusiasmado sinceramente me esperaba algo más. El precio es muy economico. Estuve aquí ayer, el sitio es bastante espartano aunque el ambiente es bueno, la comida no me ha entusiasmado sinceramente me esperaba algo más. El precio es muy economico.¬;¬30 enero 2016¬;¬Visitado el enero de 2016¬;¬Relación calidad-precio 4;Servicio 3;Comida 3¬;¬¬;¬¬;¬Española, Menús vegetarianos, Opciones veganas¬;¬Abierto hasta tarde¬;¬Reservas¬;¬Comer barato¬;¬domingo 13:00 - 18:00 martes 13:00 - 00:30 miércoles 13:00 - 00:30 jueves 13:00 - 00:30 viernes 13:00 - 01:30 sábado 13:00 - 01:30¬;¬Dirección: Calle Buenavista 42, 28012 Madrid, España Ubicación: Europa  >  España  >  Comunidad de Madrid  >  Madrid>  > Lavapiés Barrio: Lavapiés¬;¬Dirección: Calle Buenavista 42, 28012 Madrid, España Ubicación: Europa  >  España  >  Comunidad de Madrid  >  Madrid>  > Lavapiés Barrio: Lavapiés¬
¬Restaurante¬;¬La Oveja Negra Taberna Vegana¬;¬Sozir¬;¬Madrid¬;¬6¬;¬42¬;¬23¬;¬SozirSi_Fui¬;¬3¬;¬Sin más¬;¬Fui hace un par de meses con unos amigos. Estábamos buscando comer algo y decidimos probar suerte ahi porque había sitio sentados un sábado por la noche. Pedimos de todo, la hamburguesa, el cus cus y no recuerdo qué más había en la carta. La experiencia pasó sin pena ni gloria. Ni caro ni barato, mata el hambre pero no... Más  Fui hace un par de meses con unos amigos. Estábamos buscando comer algo y decidimos probar suerte ahi porque había sitio sentados un sábado por la noche. Pedimos de todo, la hamburguesa, el cus cus y no recuerdo qué más había en la carta. La experiencia pasó sin pena ni gloria. Ni caro ni barato, mata el hambre pero no te satisface del todo, el sitio es bonito y el servicio correcto. En la media... Recuerdo el pastel de chocolate, estaba super rico, eso si.¬;¬24 noviembre 2014¬;¬Visitado el septiembre de 2014¬;¬Relación calidad-precio 3;Ambiente 3;Servicio 3;Comida 3¬;¬¬;¬¬;¬Española, Menús vegetarianos, Opciones veganas¬;¬Abierto hasta tarde¬;¬Reservas¬;¬Comer barato¬;¬domingo 13:00 - 18:00 martes 13:00 - 00:30 miércoles 13:00 - 00:30 jueves 13:00 - 00:30 viernes 13:00 - 01:30 sábado 13:00 - 01:30¬;¬Dirección: Calle Buenavista 42, 28012 Madrid, España Ubicación: Europa  >  España  >  Comunidad de Madrid  >  Madrid>  > Lavapiés Barrio: Lavapiés¬;¬Dirección: Calle Buenavista 42, 28012 Madrid, España Ubicación: Europa  >  España  >  Comunidad de Madrid  >  Madrid>  > Lavapiés Barrio: Lavapiés¬
¬Restaurante¬;¬La Oveja Negra Taberna Vegana¬;¬Juan T¬;¬¬;¬3¬;¬23¬;¬18¬;¬Juan TTa_Es¬;¬3¬;¬Taberna Vegana¬;¬Es la segunda vez que acudo y no será la última. Es una buena opción para comer vegano a buen precio por el centro de Madrid. Destacar que es un sitio políticamente posicionado, asunto a aplaudir en estos días que corren. Por poner un pero, creo que estaría bien cuidar un poco la ""imagen"" de la cocina y cociner@s, no... Más  Es la segunda vez que acudo y no será la última. Es una buena opción para comer vegano a buen precio por el centro de Madrid. Destacar que es un sitio políticamente posicionado, asunto a aplaudir en estos días que corren. Por poner un pero, creo que estaría bien cuidar un poco la ""imagen"" de la cocina y cociner@s, no digo nada más que estaría bien un delantal reivindicativo o similar, pero que sea ""vestimenta"" de cocina y no de calle...pero es una mera sugerencia. Bravo por el sitio!!!!¬;¬10 agosto 2014¬;¬¬;¬¬;¬¬;¬¬;¬Española, Menús vegetarianos, Opciones veganas¬;¬Abierto hasta tarde¬;¬Reservas¬;¬Comer barato¬;¬domingo 13:00 - 18:00 martes 13:00 - 00:30 miércoles 13:00 - 00:30 jueves 13:00 - 00:30 viernes 13:00 - 01:30 sábado 13:00 - 01:30¬;¬Dirección: Calle Buenavista 42, 28012 Madrid, España Ubicación: Europa  >  España  >  Comunidad de Madrid  >  Madrid>  > Lavapiés Barrio: Lavapiés¬;¬Dirección: Calle Buenavista 42, 28012 Madrid, España Ubicación: Europa  >  España  >  Comunidad de Madrid  >  Madrid>  > Lavapiés Barrio: Lavapiés¬
¬Restaurante¬;¬La Oveja Negra Taberna Vegana¬;¬Michele M¬;¬Madrid, España¬;¬4¬;¬39¬;¬1¬;¬Michele MAm_Muy¬;¬3¬;¬Ambiente alternativo, presupuesto de comida rápida.¬;¬Muy sencillo bar/restaurante que ofrece platos sabrosos, basado principalmente en el uso de derivados de soja y seitan. Buena calidad y precios muy asequibles. Normalmente llena. Sistema anti-ambiente abiertamente y alternativa decoración.¬;¬19 mayo 2016¬;¬¬;¬¬;¬¬;¬¬;¬Española, Menús vegetarianos, Opciones veganas¬;¬Abierto hasta tarde¬;¬Reservas¬;¬Comer barato¬;¬domingo 13:00 - 18:00 martes 13:00 - 00:30 miércoles 13:00 - 00:30 jueves 13:00 - 00:30 viernes 13:00 - 01:30 sábado 13:00 - 01:30¬;¬Dirección: Calle Buenavista 42, 28012 Madrid, España Ubicación: Europa  >  España  >  Comunidad de Madrid  >  Madrid>  > Lavapiés Barrio: Lavapiés¬;¬Dirección: Calle Buenavista 42, 28012 Madrid, España Ubicación: Europa  >  España  >  Comunidad de Madrid  >  Madrid>  > Lavapiés Barrio: Lavapiés¬
