Tipo,NombreRestaurante_,NombreUsuario_,LocalizaciónUsario_,NivelUsuario_,OpinionesTotalesUsuario_,VotosUtiles_,IDComentario_,ValoracionComentario_,TituloComentario_,Comentario_,FechaCometario_,FechaVisitaRestaurante_,ValoracionesComentario_,ResumenPuntuacionesRestaurante_,PrecioMedio_,TipoCocina_,Comida_,CaracteristicasDelResaurante_,AconsejablePara_,Horarios_,DireccionCompletaRestaurante_,Descripcion_
¬Restaurante¬;¬Bacoa Sol¬;¬Jean Pierre D¬;¬¬;¬2¬;¬5¬;¬4¬;¬Jean Pierre DCa_Dem¬;¬2¬;¬Caro y malo! Prefiero la de más adelante!¬;¬Demasiado y exageradamente caro y para nada estilo americano. Y con un sabor artificial que no se asemeja a los vídeos que muestran en los vídeos.! Demasiado y exageradamente caro y para nada estilo americano. Y con un sabor artificial que no se asemeja a los vídeos que muestran en los vídeos.!¬;¬4 agosto 2016¬;¬¬;¬¬;¬¬;¬5 € - 15 €¬;¬Americana, Comida rápida, Internacional, Menús vegetarianos, Opciones veganas¬;¬Comidas, Cenas¬;¬Para llevar, Capacidad, Camareros, Tronas disponibles, Acceso para discapacitados, Sirve alcohol, Vino y cerveza, Acepta Mastercard, Acepta Visa, Wifi gratuito¬;¬Comer barato, Familias con niños, Niños¬;¬domingo 12:30 - 00:00 lunes 12:30 - 00:00 martes 12:30 - 00:00 miércoles 12:30 - 00:00 jueves 12:30 - 00:00 viernes 12:30 - 02:00 sábado 12:30 - 02:00¬;¬Dirección: Carrera San Jeronimo 3, 28014 Madrid, España Ubicación: Europa  >  España  >  Comunidad de Madrid  >  Madrid>  > Centro Barrio: Centro Número de teléfono: +34 915 21 22 58¬;¬Bacoa es más que un restaurante. Es una hamburguesería, donde comida rápida es también comida de calidad. Ven a conocernos y prueba nuestras hamburguesas gourmet y nuestras patatas fritas cortadas a mano.¬
¬Restaurante¬;¬Bacoa Sol¬;¬eliseo g¬;¬Madrid, España¬;¬3¬;¬13¬;¬17¬;¬eliseo gVa_Cre¬;¬2¬;¬Va a peor ,prima el negocio¬;¬Creo que fuimos de los primeros en comer ahí, cuando abrieron las hamburguesas y el servicio eran distintas y mejores que otros locales de fast food La vaca del Pirineo a la que mimaban era el alma del local,buenos productos y amable servicio. Eso se ha terminado, se han dado cuenta que para el montón de gente que sobre todo... Más  Creo que fuimos de los primeros en comer ahí, cuando abrieron las hamburguesas y el servicio eran distintas y mejores que otros locales de fast food La vaca del Pirineo a la que mimaban era el alma del local,buenos productos y amable servicio. Eso se ha terminado, se han dado cuenta que para el montón de gente que sobre todo los fines de semana abarrotan el local, muchos extranjeros que pululan por la zona, el tema calidad da igual, ja ja pobre vaca del Pirineo estará desestresandose del giro que ha dado el local. Lo resumo, hamburguesas grandes, la carne picada es muy barata, pero de calidad baja, que entre por el ojo (doble big Mac...),bebidas caras y componentes de verduras ,patatas,quesos etc que son cada vez peores semana a semana.Y el servicio que consiste en apuntar en una hoja lo que quieres y entregarla al de la caja , bastante desagradable en el trato , encima te exigen que primero pidas y pagues y luego escojas la mesa, por Dios .... Sic.En fin , le salva que está donde está, ahí le pones un pesebre a la vaca del Pirineo y no acerca el morro.¬;¬16 mayo 2016¬;¬¬;¬¬;¬¬;¬5 € - 15 €¬;¬Americana, Comida rápida, Internacional, Menús vegetarianos, Opciones veganas¬;¬Comidas, Cenas¬;¬Para llevar, Capacidad, Camareros, Tronas disponibles, Acceso para discapacitados, Sirve alcohol, Vino y cerveza, Acepta Mastercard, Acepta Visa, Wifi gratuito¬;¬Comer barato, Familias con niños, Niños¬;¬domingo 12:30 - 00:00 lunes 12:30 - 00:00 martes 12:30 - 00:00 miércoles 12:30 - 00:00 jueves 12:30 - 00:00 viernes 12:30 - 02:00 sábado 12:30 - 02:00¬;¬Dirección: Carrera San Jeronimo 3, 28014 Madrid, España Ubicación: Europa  >  España  >  Comunidad de Madrid  >  Madrid>  > Centro Barrio: Centro Número de teléfono: +34 915 21 22 58¬;¬Bacoa es más que un restaurante. Es una hamburguesería, donde comida rápida es también comida de calidad. Ven a conocernos y prueba nuestras hamburguesas gourmet y nuestras patatas fritas cortadas a mano.¬
¬Restaurante¬;¬Bacoa Sol¬;¬Nachoaz¬;¬Madrid, España¬;¬6¬;¬117¬;¬54¬;¬Nachoaz¡P_Pri¬;¬2¬;¬¡Primero paga! luego ya veremos donde te comes lo que has pagado y vete. No hay postres.¬;¬Primero lo positivo: El personal muy majo. Las hamburguesas son muy normalitas para lo que cobran, es mejor que un FastFood norteamericano, pero... La comida: no es nada del otro mundo, a la ternera gallega le falta fuerza, sabor a carne, hay muchas opciones de salsas, pero vas a comer carne no salsas. Las patatas están bien pero que las... Más  Primero lo positivo: El personal muy majo. Las hamburguesas son muy normalitas para lo que cobran, es mejor que un FastFood norteamericano, pero... La comida: no es nada del otro mundo, a la ternera gallega le falta fuerza, sabor a carne, hay muchas opciones de salsas, pero vas a comer carne no salsas. Las patatas están bien pero que las patatas sean lo mejor de una hamburguesa... Las bebidas: mal, muy mal, fatal y con muy pocas opciones, la Coca Cola está embotellada en Dinamarca (¿No hay Coca Cola Española?) y las cervezas son extranjeras y raras... No hay cervezas nacionales como Mahou, Moritz, Estrella de Galicia, Alhambra... En resumen, no vale lo que pagas.¬;¬2 abril 2016¬;¬Visitado el abril de 2016¬;¬Relación calidad-precio 3;Servicio 5;Comida 2¬;¬¬;¬5 € - 15 €¬;¬Americana, Comida rápida, Internacional, Menús vegetarianos, Opciones veganas¬;¬Comidas, Cenas¬;¬Para llevar, Capacidad, Camareros, Tronas disponibles, Acceso para discapacitados, Sirve alcohol, Vino y cerveza, Acepta Mastercard, Acepta Visa, Wifi gratuito¬;¬Comer barato, Familias con niños, Niños¬;¬domingo 12:30 - 00:00 lunes 12:30 - 00:00 martes 12:30 - 00:00 miércoles 12:30 - 00:00 jueves 12:30 - 00:00 viernes 12:30 - 02:00 sábado 12:30 - 02:00¬;¬Dirección: Carrera San Jeronimo 3, 28014 Madrid, España Ubicación: Europa  >  España  >  Comunidad de Madrid  >  Madrid>  > Centro Barrio: Centro Número de teléfono: +34 915 21 22 58¬;¬Bacoa es más que un restaurante. Es una hamburguesería, donde comida rápida es también comida de calidad. Ven a conocernos y prueba nuestras hamburguesas gourmet y nuestras patatas fritas cortadas a mano.¬
¬Restaurante¬;¬Bacoa Sol¬;¬leticiapss¬;¬Madrid, España¬;¬2¬;¬9¬;¬0¬;¬leticiapssDe_Me¬;¬2¬;¬Decepcionante¬;¬Me hablaron muy bien de este sitio. Ayer fui a comprobar que tal estaba y me llevé una gran decepción. El lugar era pequeño y bastante incómodo. Tiene que pedir si no no puedes coger mesa antes. Uo de los empleados, fue bastante borde y mal educado. Me pedí una hamburguesa de pan brioche clasica con carne de los pirineos... Más  Me hablaron muy bien de este sitio. Ayer fui a comprobar que tal estaba y me llevé una gran decepción. El lugar era pequeño y bastante incómodo. Tiene que pedir si no no puedes coger mesa antes. Uo de los empleados, fue bastante borde y mal educado. Me pedí una hamburguesa de pan brioche clasica con carne de los pirineos y he de decir que cuando me la estaba comiendo pensaba que estaba en un burger king. Decepsionante, la carne para lo que cuesta no es de la calidad que esperaba. Y qué decir de las patatas, 3 euros y pico por 6 patatas contadas y gordas. Otra cosa kepchut dulce? desde cuando?! Para lo que vale, no merece tirar en dinero en este sitio.¬;¬6 marzo 2016¬;¬¬;¬¬;¬¬;¬5 € - 15 €¬;¬Americana, Comida rápida, Internacional, Menús vegetarianos, Opciones veganas¬;¬Comidas, Cenas¬;¬Para llevar, Capacidad, Camareros, Tronas disponibles, Acceso para discapacitados, Sirve alcohol, Vino y cerveza, Acepta Mastercard, Acepta Visa, Wifi gratuito¬;¬Comer barato, Familias con niños, Niños¬;¬domingo 12:30 - 00:00 lunes 12:30 - 00:00 martes 12:30 - 00:00 miércoles 12:30 - 00:00 jueves 12:30 - 00:00 viernes 12:30 - 02:00 sábado 12:30 - 02:00¬;¬Dirección: Carrera San Jeronimo 3, 28014 Madrid, España Ubicación: Europa  >  España  >  Comunidad de Madrid  >  Madrid>  > Centro Barrio: Centro Número de teléfono: +34 915 21 22 58¬;¬Bacoa es más que un restaurante. Es una hamburguesería, donde comida rápida es también comida de calidad. Ven a conocernos y prueba nuestras hamburguesas gourmet y nuestras patatas fritas cortadas a mano.¬
¬Restaurante¬;¬Bacoa Sol¬;¬LCH181¬;¬Greater Manchester, Reino Unido¬;¬3¬;¬13¬;¬1¬;¬LCH181Bu_Le¬;¬2¬;¬Buenas hamburguesas, personal no!¬;¬Le hubiera dado a este restaurante una clasificación, pero el nivel de servicio fue atroz. El servidor que al principio nos recibió estaba preciosa, él fue llamado Cesar, y parecía estar haciendo todo el trabajo! La joven que estaba en el hasta era horrible. Nos llenamos de una hoja simple tick de lo que queríamos, pero sólo recibieron la mitad... Más ¬;¬21 agosto 2016¬;¬¬;¬¬;¬¬;¬5 € - 15 €¬;¬Americana, Comida rápida, Internacional, Menús vegetarianos, Opciones veganas¬;¬Comidas, Cenas¬;¬Para llevar, Capacidad, Camareros, Tronas disponibles, Acceso para discapacitados, Sirve alcohol, Vino y cerveza, Acepta Mastercard, Acepta Visa, Wifi gratuito¬;¬Comer barato, Familias con niños, Niños¬;¬domingo 12:30 - 00:00 lunes 12:30 - 00:00 martes 12:30 - 00:00 miércoles 12:30 - 00:00 jueves 12:30 - 00:00 viernes 12:30 - 02:00 sábado 12:30 - 02:00¬;¬Dirección: Carrera San Jeronimo 3, 28014 Madrid, España Ubicación: Europa  >  España  >  Comunidad de Madrid  >  Madrid>  > Centro Barrio: Centro Número de teléfono: +34 915 21 22 58¬;¬Bacoa es más que un restaurante. Es una hamburguesería, donde comida rápida es también comida de calidad. Ven a conocernos y prueba nuestras hamburguesas gourmet y nuestras patatas fritas cortadas a mano.¬
