Tipo,NombreRestaurante_,NombreUsuario_,LocalizaciónUsario_,NivelUsuario_,OpinionesTotalesUsuario_,VotosUtiles_,IDComentario_,ValoracionComentario_,TituloComentario_,Comentario_,FechaCometario_,FechaVisitaRestaurante_,ValoracionesComentario_,ResumenPuntuacionesRestaurante_,PrecioMedio_,TipoCocina_,Comida_,CaracteristicasDelResaurante_,AconsejablePara_,Horarios_,DireccionCompletaRestaurante_,Descripcion_
¬Restaurante¬;¬Casa Benigna¬;¬carmencaldera1955¬;¬Elche de la Sierra, España¬;¬3¬;¬18¬;¬5¬;¬carmencaldera1955Ar_Pre¬;¬4¬;¬Arroces de rechupete¬;¬Pregunté a unos amigos por un buen arroz en Madrid y me recomendaron esta casa tradicional y fue una muy buena decisión. Arroces de muchos tipos, bien explicados por los camareros, y llegaron a la mesa con una excelente presentación y estaban de ricos como los de Valencia, que para mi son los mejores. Toda la comida perfecta, la única... Más  Pregunté a unos amigos por un buen arroz en Madrid y me recomendaron esta casa tradicional y fue una muy buena decisión. Arroces de muchos tipos, bien explicados por los camareros, y llegaron a la mesa con una excelente presentación y estaban de ricos como los de Valencia, que para mi son los mejores. Toda la comida perfecta, la única pega es que es bastante caro.¬;¬30 enero 2015¬;¬Visitado el diciembre de 2014¬;¬Relación calidad-precio 2;Ambiente 3;Servicio 4;Comida 4¬;¬¬;¬¬;¬Mediterránea, Española¬;¬Comidas, Cenas, Abierto hasta tarde¬;¬Reservas, Capacidad, Camareros, Tronas disponibles, Acceso para discapacitados, Sirve alcohol, Bar completo¬;¬Ocasiones especiales, Cocina local, Reuniones de negocios, Familias con niños, Romántico¬;¬domingo 13:30 - 16:00 lunes 13:30 - 16:00 21:00 - 23:30 martes 13:30 - 16:00 21:00 - 23:30 miércoles 13:30 - 16:00 21:00 - 23:30 jueves 13:30 - 16:00 21:00 - 23:30 viernes 13:30 - 16:00 21:00 - 23:30 sábado 13:30 - 16:00 21:00 - 23:30¬;¬Dirección: Calle Benigno Soto 9, 28002 Madrid, España Ubicación: Europa  >  España  >  Comunidad de Madrid  >  Madrid Número de teléfono: +34 914133356¬;¬Cerrado por vacaciones del 1 al 15 de agosto.¬
¬Restaurante¬;¬Casa Benigna¬;¬luis_soledad¬;¬Madrid, España¬;¬3¬;¬16¬;¬11¬;¬luis_soledadCu_Res¬;¬4¬;¬Curioso, genuino y caro¬;¬Restaurante con una bonita y acogedora decoración mediterránea cerca del auditorio nacional de Madrid. Su especialidad es el arroz en patella, un recipiente casi plano creo que de cobre inventado por el propio dueño del restaurante que tiene la virtud de que al ser muy ancho y poco profundo permite que el arroz se haga por entero en su punto... Más  Restaurante con una bonita y acogedora decoración mediterránea cerca del auditorio nacional de Madrid. Su especialidad es el arroz en patella, un recipiente casi plano creo que de cobre inventado por el propio dueño del restaurante que tiene la virtud de que al ser muy ancho y poco profundo permite que el arroz se haga por entero en su punto y no se pase. La verdad es que los arroces están fantásticos, la comida es muy cuidada, el dueño ha tirado en los últimos años hacia conceptos de sostenibilidad en la comida y cuidado por lo orgánico que se agradecen como aspecto diferenciador frente a otros restaurantes. El sitio es muy pequeño y gusta porque es casi como estar en un salón grande comiendo, y la decoración te acerca agradablemente a la albufera valenciana alejándote de Madrid por un par de horas. Benigna es la matriarca, y de ahí el nombre del sitio, es madre del actual dueño y se acerca por las mesas saludando e interesándose por la comida. A mi particularmente me parece que tiene un punto de esperpento porque la mujer, que está mayor, estará hasta las narices de andar por allí, me imagino, y difícilmente conecta con los comensales, así es que resulta algo incómodo y forzado que vaya preguntando, resulta poco natural, la verdad. Los únicos peros que le pondría al restaurante son el precio y la variedad limitada de platos. En cuanto al tema de la variedad muy bien si vas a comer un arroz pero no tienes mucho si quieres cambiar de opción o vas con alguien poco arrocero. En cuanto al precio creo que se pasan bastante, la relación calidad-precio no se sostiene. El barrio en el que está enclavado es más bien feo, se aparca mal por la zona aunque el restaurante tiene un parking gratuito justo al lado. En resumen, un restaurante de ambiente especial y genuino donde sirven muy buen arroz aunque demasiado caro. Merece la pena por probar el tema del arroz en patella y puede ser una buena opción para sorprender en una comida de trabajo proponiendo un sitio diferente, pero no lo veo como un sitio especialmente reseñable o de cabecera. Yo no repetiría aunque como digo es un muy buen sitio y comimos muy bien.¬;¬2 diciembre 2014¬;¬Visitado el octubre de 2014¬;¬Relación calidad-precio 2;Ambiente 5;Servicio 4;Comida 5¬;¬¬;¬¬;¬Mediterránea, Española¬;¬Comidas, Cenas, Abierto hasta tarde¬;¬Reservas, Capacidad, Camareros, Tronas disponibles, Acceso para discapacitados, Sirve alcohol, Bar completo¬;¬Ocasiones especiales, Cocina local, Reuniones de negocios, Familias con niños, Romántico¬;¬domingo 13:30 - 16:00 lunes 13:30 - 16:00 21:00 - 23:30 martes 13:30 - 16:00 21:00 - 23:30 miércoles 13:30 - 16:00 21:00 - 23:30 jueves 13:30 - 16:00 21:00 - 23:30 viernes 13:30 - 16:00 21:00 - 23:30 sábado 13:30 - 16:00 21:00 - 23:30¬;¬Dirección: Calle Benigno Soto 9, 28002 Madrid, España Ubicación: Europa  >  España  >  Comunidad de Madrid  >  Madrid Número de teléfono: +34 914133356¬;¬Cerrado por vacaciones del 1 al 15 de agosto.¬
¬Restaurante¬;¬Casa Benigna¬;¬Carlos O¬;¬¬;¬2¬;¬9¬;¬6¬;¬Carlos OMu_Me¬;¬4¬;¬Muy recomendado¬;¬Me llevaron unos amigos que ya lo conocían, me encanto, la atención muy buena, a la hora de recomendarte los platos vino una señora mayor que nos ayudo mucho, pedimos unos entrantes, una ensalada de tomate pero tomates de verdad, como ya no se prueban por ahí, y luego el arroz realmente exquisito, un poco caro pero vale la Peña,... Más  Me llevaron unos amigos que ya lo conocían, me encanto, la atención muy buena, a la hora de recomendarte los platos vino una señora mayor que nos ayudo mucho, pedimos unos entrantes, una ensalada de tomate pero tomates de verdad, como ya no se prueban por ahí, y luego el arroz realmente exquisito, un poco caro pero vale la Peña, voy a volver seguro¬;¬1 julio 2014¬;¬¬;¬¬;¬¬;¬¬;¬Mediterránea, Española¬;¬Comidas, Cenas, Abierto hasta tarde¬;¬Reservas, Capacidad, Camareros, Tronas disponibles, Acceso para discapacitados, Sirve alcohol, Bar completo¬;¬Ocasiones especiales, Cocina local, Reuniones de negocios, Familias con niños, Romántico¬;¬domingo 13:30 - 16:00 lunes 13:30 - 16:00 21:00 - 23:30 martes 13:30 - 16:00 21:00 - 23:30 miércoles 13:30 - 16:00 21:00 - 23:30 jueves 13:30 - 16:00 21:00 - 23:30 viernes 13:30 - 16:00 21:00 - 23:30 sábado 13:30 - 16:00 21:00 - 23:30¬;¬Dirección: Calle Benigno Soto 9, 28002 Madrid, España Ubicación: Europa  >  España  >  Comunidad de Madrid  >  Madrid Número de teléfono: +34 914133356¬;¬Cerrado por vacaciones del 1 al 15 de agosto.¬
¬Restaurante¬;¬Casa Benigna¬;¬Marta S¬;¬Madrid, España¬;¬2¬;¬7¬;¬20¬;¬Marta SUn_Fui¬;¬4¬;¬Un arroz increíble¬;¬Fui con un grupo de amigas, la gran mayoría de ellas extranjeras que querían degustar buena comida mediterránea. Una de las cosas que más destacan de España es el arroz, la paella... así que después de una larga investigación en Internet decidimos ir a Casa Benigna. Llevo unos cuantos años en España, he estado en Valencia veraneando y puedo decir... Más  Fui con un grupo de amigas, la gran mayoría de ellas extranjeras que querían degustar buena comida mediterránea. Una de las cosas que más destacan de España es el arroz, la paella... así que después de una larga investigación en Internet decidimos ir a Casa Benigna. Llevo unos cuantos años en España, he estado en Valencia veraneando y puedo decir que es uno de los mejores arroces que he probado nunca. Una paella con marisco acompañada de un vino, ambos excelentes. ¡Riquíssimo!¬;¬16 mayo 2014¬;¬¬;¬¬;¬¬;¬¬;¬Mediterránea, Española¬;¬Comidas, Cenas, Abierto hasta tarde¬;¬Reservas, Capacidad, Camareros, Tronas disponibles, Acceso para discapacitados, Sirve alcohol, Bar completo¬;¬Ocasiones especiales, Cocina local, Reuniones de negocios, Familias con niños, Romántico¬;¬domingo 13:30 - 16:00 lunes 13:30 - 16:00 21:00 - 23:30 martes 13:30 - 16:00 21:00 - 23:30 miércoles 13:30 - 16:00 21:00 - 23:30 jueves 13:30 - 16:00 21:00 - 23:30 viernes 13:30 - 16:00 21:00 - 23:30 sábado 13:30 - 16:00 21:00 - 23:30¬;¬Dirección: Calle Benigno Soto 9, 28002 Madrid, España Ubicación: Europa  >  España  >  Comunidad de Madrid  >  Madrid Número de teléfono: +34 914133356¬;¬Cerrado por vacaciones del 1 al 15 de agosto.¬
¬Restaurante¬;¬Casa Benigna¬;¬Gustavo B¬;¬¬;¬4¬;¬31¬;¬3¬;¬Gustavo BMe_El¬;¬4¬;¬Mejor arroz¬;¬El arroz a la patrulla es una invención de Casa Benigna, atención personalizada y amable por su dueño. Un sitio pequeño , pero vale mucho la pena. Un indispensable en Madrid. Buenísimo El arroz a la patrulla es una invención de Casa Benigna, atención personalizada y amable por su dueño. Un sitio pequeño , pero vale mucho la pena. Un indispensable en Madrid. Buenísimo¬;¬2 mayo 2014¬;¬¬;¬¬;¬¬;¬¬;¬Mediterránea, Española¬;¬Comidas, Cenas, Abierto hasta tarde¬;¬Reservas, Capacidad, Camareros, Tronas disponibles, Acceso para discapacitados, Sirve alcohol, Bar completo¬;¬Ocasiones especiales, Cocina local, Reuniones de negocios, Familias con niños, Romántico¬;¬domingo 13:30 - 16:00 lunes 13:30 - 16:00 21:00 - 23:30 martes 13:30 - 16:00 21:00 - 23:30 miércoles 13:30 - 16:00 21:00 - 23:30 jueves 13:30 - 16:00 21:00 - 23:30 viernes 13:30 - 16:00 21:00 - 23:30 sábado 13:30 - 16:00 21:00 - 23:30¬;¬Dirección: Calle Benigno Soto 9, 28002 Madrid, España Ubicación: Europa  >  España  >  Comunidad de Madrid  >  Madrid Número de teléfono: +34 914133356¬;¬Cerrado por vacaciones del 1 al 15 de agosto.¬
¬Restaurante¬;¬Casa Benigna¬;¬perelo¬;¬Las Palmas de Gran Canaria, España¬;¬5¬;¬49¬;¬53¬;¬pereloor_Nos¬;¬4¬;¬original¬;¬Nos llevó un amigo al que le había gustado. Éramos cuatro. La decoración genial, y el servicio también. Los aperitivos de la casa, muy acertados y ricos. Después pedimos el menú degustación y probamos muchos platos. Lo mejor los arroces, que estaban estupendos. Nos llevó un amigo al que le había gustado. Éramos cuatro. La decoración genial, y el servicio también. Los aperitivos de la casa, muy acertados y ricos. Después pedimos el menú degustación y probamos muchos platos. Lo mejor los arroces, que estaban estupendos.¬;¬24 febrero 2014¬;¬¬;¬¬;¬¬;¬¬;¬Mediterránea, Española¬;¬Comidas, Cenas, Abierto hasta tarde¬;¬Reservas, Capacidad, Camareros, Tronas disponibles, Acceso para discapacitados, Sirve alcohol, Bar completo¬;¬Ocasiones especiales, Cocina local, Reuniones de negocios, Familias con niños, Romántico¬;¬domingo 13:30 - 16:00 lunes 13:30 - 16:00 21:00 - 23:30 martes 13:30 - 16:00 21:00 - 23:30 miércoles 13:30 - 16:00 21:00 - 23:30 jueves 13:30 - 16:00 21:00 - 23:30 viernes 13:30 - 16:00 21:00 - 23:30 sábado 13:30 - 16:00 21:00 - 23:30¬;¬Dirección: Calle Benigno Soto 9, 28002 Madrid, España Ubicación: Europa  >  España  >  Comunidad de Madrid  >  Madrid Número de teléfono: +34 914133356¬;¬Cerrado por vacaciones del 1 al 15 de agosto.¬
¬Restaurante¬;¬Casa Benigna¬;¬Carlos M¬;¬¬;¬5¬;¬50¬;¬44¬;¬Carlos MO _Oe¬;¬4¬;¬O lo sabes apreciar o sigue buscando¬;¬O eres capaz de apreciar tantos detalles o vete a comer la paella de tu abuela de Alicante. El saber de Norberto, el servicio filipino, la madre de Norberto que no puede tener más clase, el entorno de un restaurante que cualquiera quisiera tener como suyo y un arroz maravilloso. Y encima quieres que sea barato!!!! VENGA !!! O eres capaz de apreciar tantos detalles o vete a comer la paella de tu abuela de Alicante. El saber de Norberto, el servicio filipino, la madre de Norberto que no puede tener más clase, el entorno de un restaurante que cualquiera quisiera tener como suyo y un arroz maravilloso. Y encima quieres que sea barato!!!! VENGA !!!¬;¬11 septiembre 2013¬;¬¬;¬¬;¬¬;¬¬;¬Mediterránea, Española¬;¬Comidas, Cenas, Abierto hasta tarde¬;¬Reservas, Capacidad, Camareros, Tronas disponibles, Acceso para discapacitados, Sirve alcohol, Bar completo¬;¬Ocasiones especiales, Cocina local, Reuniones de negocios, Familias con niños, Romántico¬;¬domingo 13:30 - 16:00 lunes 13:30 - 16:00 21:00 - 23:30 martes 13:30 - 16:00 21:00 - 23:30 miércoles 13:30 - 16:00 21:00 - 23:30 jueves 13:30 - 16:00 21:00 - 23:30 viernes 13:30 - 16:00 21:00 - 23:30 sábado 13:30 - 16:00 21:00 - 23:30¬;¬Dirección: Calle Benigno Soto 9, 28002 Madrid, España Ubicación: Europa  >  España  >  Comunidad de Madrid  >  Madrid Número de teléfono: +34 914133356¬;¬Cerrado por vacaciones del 1 al 15 de agosto.¬
¬Restaurante¬;¬Casa Benigna¬;¬Clodinet¬;¬Madrid, España¬;¬2¬;¬6¬;¬1¬;¬ClodinetAr_Tie¬;¬4¬;¬Arroces muy buenos y originales¬;¬Tienen la curiosisad de la ""patella"", recipiente similar al de la paella, en el que preparan y te sirven unos arroces riquisimos!!! Buenos entremeses antes de la comida, incuida la degustacion de aceites. Lo que mas me gusta ademas del arroz es el sitio y la calidez, la decoracion muy mediterranea y la atencion muy amable y familiar. Lo unico... Más  Tienen la curiosisad de la ""patella"", recipiente similar al de la paella, en el que preparan y te sirven unos arroces riquisimos!!! Buenos entremeses antes de la comida, incuida la degustacion de aceites. Lo que mas me gusta ademas del arroz es el sitio y la calidez, la decoracion muy mediterranea y la atencion muy amable y familiar. Lo unico quizas es que un poco caro, pero vale la pena!!!! Una joyita en el barrio de chamartin!!¬;¬7 septiembre 2013¬;¬Visitado el octubre de 2012¬;¬Relación calidad-precio 3;Ambiente 5;Servicio 5;Comida 4¬;¬¬;¬¬;¬Mediterránea, Española¬;¬Comidas, Cenas, Abierto hasta tarde¬;¬Reservas, Capacidad, Camareros, Tronas disponibles, Acceso para discapacitados, Sirve alcohol, Bar completo¬;¬Ocasiones especiales, Cocina local, Reuniones de negocios, Familias con niños, Romántico¬;¬domingo 13:30 - 16:00 lunes 13:30 - 16:00 21:00 - 23:30 martes 13:30 - 16:00 21:00 - 23:30 miércoles 13:30 - 16:00 21:00 - 23:30 jueves 13:30 - 16:00 21:00 - 23:30 viernes 13:30 - 16:00 21:00 - 23:30 sábado 13:30 - 16:00 21:00 - 23:30¬;¬Dirección: Calle Benigno Soto 9, 28002 Madrid, España Ubicación: Europa  >  España  >  Comunidad de Madrid  >  Madrid Número de teléfono: +34 914133356¬;¬Cerrado por vacaciones del 1 al 15 de agosto.¬
¬Restaurante¬;¬Casa Benigna¬;¬nuvolarino¬;¬¬;¬1¬;¬4¬;¬1¬;¬nuvolarinoTa_Día¬;¬4¬;¬Tanto si te gusta, como si no te gusta el Arroz.¬;¬Día de la madre del 2013. Sinceramente espectacular. Los entrenes son prescindibles, no están mal pero me parecieron caros. Los Arroces con A mayúscula. Si el de mar me encantó, el de huerta fue una de las más gratas sorpresas que me he llevado últimamente. Hay que saborearlos para entenderlo. Este sitio es de visita obligada tanto su te gusta... Más  Día de la madre del 2013. Sinceramente espectacular. Los entrenes son prescindibles, no están mal pero me parecieron caros. Los Arroces con A mayúscula. Si el de mar me encantó, el de huerta fue una de las más gratas sorpresas que me he llevado últimamente. Hay que saborearlos para entenderlo. Este sitio es de visita obligada tanto su te gusta el arroz como si no; te hará cambiar de opinión. Todo un detalle que el chef te de la bienvenida y te haga sentir importante. También es un gran detalle que te preparen el arroz sobrante sin necesidad de solicitarlo. Dignifica los alimentos. Volveré, a pesar del precio, merece la pena.¬;¬5 mayo 2013¬;¬Visitado el mayo de 2013¬;¬Relación calidad-precio 4;Ambiente 4;Servicio 5;Comida 5¬;¬¬;¬¬;¬Mediterránea, Española¬;¬Comidas, Cenas, Abierto hasta tarde¬;¬Reservas, Capacidad, Camareros, Tronas disponibles, Acceso para discapacitados, Sirve alcohol, Bar completo¬;¬Ocasiones especiales, Cocina local, Reuniones de negocios, Familias con niños, Romántico¬;¬domingo 13:30 - 16:00 lunes 13:30 - 16:00 21:00 - 23:30 martes 13:30 - 16:00 21:00 - 23:30 miércoles 13:30 - 16:00 21:00 - 23:30 jueves 13:30 - 16:00 21:00 - 23:30 viernes 13:30 - 16:00 21:00 - 23:30 sábado 13:30 - 16:00 21:00 - 23:30¬;¬Dirección: Calle Benigno Soto 9, 28002 Madrid, España Ubicación: Europa  >  España  >  Comunidad de Madrid  >  Madrid Número de teléfono: +34 914133356¬;¬Cerrado por vacaciones del 1 al 15 de agosto.¬
¬Restaurante¬;¬Casa Benigna¬;¬stefan0ski¬;¬Madrid, España¬;¬5¬;¬90¬;¬46¬;¬stefan0skiAr_Est¬;¬4¬;¬Arroceria de primer nivel pero bastante cara¬;¬Estuve cenando un par de veces en este rinconcito dedicado al arroz. La verdad que la competencia del dueño sobre el arroz es total. La atención tambien es de primera calidad. Los platos están esquisitos pero el precio es demasiado alto. Estuve cenando un par de veces en este rinconcito dedicado al arroz. La verdad que la competencia del dueño sobre el arroz es total. La atención tambien es de primera calidad. Los platos están esquisitos pero el precio es demasiado alto.¬;¬24 abril 2013¬;¬Visitado el mayo de 2012¬;¬Relación calidad-precio 2;Ambiente 4;Servicio 5;Comida 4¬;¬¬;¬¬;¬Mediterránea, Española¬;¬Comidas, Cenas, Abierto hasta tarde¬;¬Reservas, Capacidad, Camareros, Tronas disponibles, Acceso para discapacitados, Sirve alcohol, Bar completo¬;¬Ocasiones especiales, Cocina local, Reuniones de negocios, Familias con niños, Romántico¬;¬domingo 13:30 - 16:00 lunes 13:30 - 16:00 21:00 - 23:30 martes 13:30 - 16:00 21:00 - 23:30 miércoles 13:30 - 16:00 21:00 - 23:30 jueves 13:30 - 16:00 21:00 - 23:30 viernes 13:30 - 16:00 21:00 - 23:30 sábado 13:30 - 16:00 21:00 - 23:30¬;¬Dirección: Calle Benigno Soto 9, 28002 Madrid, España Ubicación: Europa  >  España  >  Comunidad de Madrid  >  Madrid Número de teléfono: +34 914133356¬;¬Cerrado por vacaciones del 1 al 15 de agosto.¬
