Tipo,NombreRestaurante_,NombreUsuario_,LocalizaciónUsario_,NivelUsuario_,OpinionesTotalesUsuario_,VotosUtiles_,IDComentario_,ValoracionComentario_,TituloComentario_,Comentario_,FechaCometario_,FechaVisitaRestaurante_,ValoracionesComentario_,ResumenPuntuacionesRestaurante_,PrecioMedio_,TipoCocina_,Comida_,CaracteristicasDelResaurante_,AconsejablePara_,Horarios_,DireccionCompletaRestaurante_,Descripcion_
¬Restaurante¬;¬Museo del Jamon¬;¬CLARA B¬;¬Comunidad Valenciana, España¬;¬3¬;¬15¬;¬1¬;¬CLARA BUn_Si¬;¬4¬;¬Un tentenpié en un sitio emblemático¬;¬Si pasas por Madrid tienes que hacer un alto en e camino en algún museo del Jamón. Puedes encontrar varios por Madrid, yo lo conocí hace tiempo y este puente pasamos a tomar unas cervecitas y un buen bocata de jamón. Aunque estás de pie, vale la pena por el ambiente y la calidad del producto a precios muy asequibles.... Más  Si pasas por Madrid tienes que hacer un alto en e camino en algún museo del Jamón. Puedes encontrar varios por Madrid, yo lo conocí hace tiempo y este puente pasamos a tomar unas cervecitas y un buen bocata de jamón. Aunque estás de pie, vale la pena por el ambiente y la calidad del producto a precios muy asequibles. Volveré.¬;¬2 noviembre 2016¬;¬¬;¬¬;¬¬;¬¬;¬Bar, Mediterránea, Europea, Española¬;¬Brunch, Desayuno, Comidas, Cenas, Abierto hasta tarde, Bebidas¬;¬Para llevar, Capacidad, Camareros, Acceso para discapacitados, Sirve alcohol, Bar completo, Buffet¬;¬Niños, Grupos grandes, Familias con niños, Cocina local, Comer barato¬;¬domingo 09:00 - 00:00 lunes 09:00 - 00:00 martes 09:00 - 00:00 miércoles 09:00 - 00:00 jueves 09:00 - 00:00 viernes 09:00 - 00:00 sábado 09:00 - 00:00¬;¬Dirección: C/ Gran vía 72, 28015 Madrid, España Ubicación: Europa  >  España  >  Comunidad de Madrid  >  Madrid>  > Malasaña Barrio: Malasaña Número de teléfono: 91 531 45 50¬;¬Dirección: C/ Gran vía 72, 28015 Madrid, España Ubicación: Europa  >  España  >  Comunidad de Madrid  >  Madrid>  > Malasaña Barrio: Malasaña Número de teléfono: 91 531 45 50¬
¬Restaurante¬;¬Museo del Jamon¬;¬cristiCaba¬;¬CABA¬;¬4¬;¬29¬;¬6¬;¬cristiCabaAL_Muy¬;¬4¬;¬AL ALCANCE DE TODOS¬;¬Muy ricos sandwiches de jamon, este es especial, riquisimo, combinado con varios ingredientes, es barato ya que hay una tabla de menues con bebidas incluidas. lo recomiendo para un almuerzo de paso o una cena. Muy ricos sandwiches de jamon, este es especial, riquisimo, combinado con varios ingredientes, es barato ya que hay una tabla de menues con bebidas incluidas. lo recomiendo para un almuerzo de paso o una cena.¬;¬2 noviembre 2016¬;¬Visitado el octubre de 2016¬;¬Relación calidad-precio 5;Servicio 4;Comida 4¬;¬¬;¬¬;¬Bar, Mediterránea, Europea, Española¬;¬Brunch, Desayuno, Comidas, Cenas, Abierto hasta tarde, Bebidas¬;¬Para llevar, Capacidad, Camareros, Acceso para discapacitados, Sirve alcohol, Bar completo, Buffet¬;¬Niños, Grupos grandes, Familias con niños, Cocina local, Comer barato¬;¬domingo 09:00 - 00:00 lunes 09:00 - 00:00 martes 09:00 - 00:00 miércoles 09:00 - 00:00 jueves 09:00 - 00:00 viernes 09:00 - 00:00 sábado 09:00 - 00:00¬;¬Dirección: C/ Gran vía 72, 28015 Madrid, España Ubicación: Europa  >  España  >  Comunidad de Madrid  >  Madrid>  > Malasaña Barrio: Malasaña Número de teléfono: 91 531 45 50¬;¬Dirección: C/ Gran vía 72, 28015 Madrid, España Ubicación: Europa  >  España  >  Comunidad de Madrid  >  Madrid>  > Malasaña Barrio: Malasaña Número de teléfono: 91 531 45 50¬
¬Restaurante¬;¬Museo del Jamon¬;¬lportillodiaz¬;¬Chihuahua, México¬;¬4¬;¬35¬;¬0¬;¬lportillodiazBu_Est¬;¬4¬;¬Buen Lugar¬;¬Establecimiento comercial dónde puedes degustar y observar todo tipo y gran variedad de jamones de piernas de cerdos. Establecimiento comercial dónde puedes degustar y observar todo tipo y gran variedad de jamones de piernas de cerdos.¬;¬1 noviembre 2016¬;¬¬;¬¬;¬¬;¬¬;¬Bar, Mediterránea, Europea, Española¬;¬Brunch, Desayuno, Comidas, Cenas, Abierto hasta tarde, Bebidas¬;¬Para llevar, Capacidad, Camareros, Acceso para discapacitados, Sirve alcohol, Bar completo, Buffet¬;¬Niños, Grupos grandes, Familias con niños, Cocina local, Comer barato¬;¬domingo 09:00 - 00:00 lunes 09:00 - 00:00 martes 09:00 - 00:00 miércoles 09:00 - 00:00 jueves 09:00 - 00:00 viernes 09:00 - 00:00 sábado 09:00 - 00:00¬;¬Dirección: C/ Gran vía 72, 28015 Madrid, España Ubicación: Europa  >  España  >  Comunidad de Madrid  >  Madrid>  > Malasaña Barrio: Malasaña Número de teléfono: 91 531 45 50¬;¬Dirección: C/ Gran vía 72, 28015 Madrid, España Ubicación: Europa  >  España  >  Comunidad de Madrid  >  Madrid>  > Malasaña Barrio: Malasaña Número de teléfono: 91 531 45 50¬
¬Restaurante¬;¬Museo del Jamon¬;¬Susana C¬;¬¬;¬3¬;¬5¬;¬0¬;¬Susana CTo_Típ¬;¬4¬;¬Todo muy fresco¬;¬Típica comida española . Muy buen menú turístico. El trato es amable y el precio acorde. Te sirven muy rápido . Típica comida española . Muy buen menú turístico. El trato es amable y el precio acorde. Te sirven muy rápido .¬;¬1 noviembre 2016¬;¬Visitado el julio de 2016¬;¬Relación calidad-precio 3;Servicio 4;Comida 4¬;¬¬;¬¬;¬Bar, Mediterránea, Europea, Española¬;¬Brunch, Desayuno, Comidas, Cenas, Abierto hasta tarde, Bebidas¬;¬Para llevar, Capacidad, Camareros, Acceso para discapacitados, Sirve alcohol, Bar completo, Buffet¬;¬Niños, Grupos grandes, Familias con niños, Cocina local, Comer barato¬;¬domingo 09:00 - 00:00 lunes 09:00 - 00:00 martes 09:00 - 00:00 miércoles 09:00 - 00:00 jueves 09:00 - 00:00 viernes 09:00 - 00:00 sábado 09:00 - 00:00¬;¬Dirección: C/ Gran vía 72, 28015 Madrid, España Ubicación: Europa  >  España  >  Comunidad de Madrid  >  Madrid>  > Malasaña Barrio: Malasaña Número de teléfono: 91 531 45 50¬;¬Dirección: C/ Gran vía 72, 28015 Madrid, España Ubicación: Europa  >  España  >  Comunidad de Madrid  >  Madrid>  > Malasaña Barrio: Malasaña Número de teléfono: 91 531 45 50¬
¬Restaurante¬;¬Museo del Jamon¬;¬jaimeprieto¬;¬Madrid, España¬;¬4¬;¬38¬;¬8¬;¬jaimeprietoUn_Han¬;¬4¬;¬Una forma especial de hacer las cosas¬;¬Han sabido conjugar un más que aceptable producto con un precio para todos los bolsillos, toda una institución digna de respeto. Imperdonable no pasar por alguno de sus locales al visitar Madrid. Han sabido conjugar un más que aceptable producto con un precio para todos los bolsillos, toda una institución digna de respeto. Imperdonable no pasar por alguno de sus locales al visitar Madrid.¬;¬1 noviembre 2016¬;¬¬;¬¬;¬¬;¬¬;¬Bar, Mediterránea, Europea, Española¬;¬Brunch, Desayuno, Comidas, Cenas, Abierto hasta tarde, Bebidas¬;¬Para llevar, Capacidad, Camareros, Acceso para discapacitados, Sirve alcohol, Bar completo, Buffet¬;¬Niños, Grupos grandes, Familias con niños, Cocina local, Comer barato¬;¬domingo 09:00 - 00:00 lunes 09:00 - 00:00 martes 09:00 - 00:00 miércoles 09:00 - 00:00 jueves 09:00 - 00:00 viernes 09:00 - 00:00 sábado 09:00 - 00:00¬;¬Dirección: C/ Gran vía 72, 28015 Madrid, España Ubicación: Europa  >  España  >  Comunidad de Madrid  >  Madrid>  > Malasaña Barrio: Malasaña Número de teléfono: 91 531 45 50¬;¬Dirección: C/ Gran vía 72, 28015 Madrid, España Ubicación: Europa  >  España  >  Comunidad de Madrid  >  Madrid>  > Malasaña Barrio: Malasaña Número de teléfono: 91 531 45 50¬
¬Restaurante¬;¬Museo del Jamon¬;¬Lucas M¬;¬¬;¬3¬;¬22¬;¬0¬;¬Lucas MPa_El¬;¬4¬;¬Para comer bien y gastar poco¬;¬El Museo del Jamón es ideal si no se quiere gastar mucho a la hora de comer, sobre todo de noche que una cena en Madrid ronda los 20/25€. La comida es muy sabrosa, los platos abundantes. Recomiendo sobre todo cenar en el que está ubicado en Plaza Mayor. El Museo del Jamón es ideal si no se quiere gastar mucho a la hora de comer, sobre todo de noche que una cena en Madrid ronda los 20/25€. La comida es muy sabrosa, los platos abundantes. Recomiendo sobre todo cenar en el que está ubicado en Plaza Mayor.¬;¬29 octubre 2016¬;¬¬;¬¬;¬¬;¬¬;¬Bar, Mediterránea, Europea, Española¬;¬Brunch, Desayuno, Comidas, Cenas, Abierto hasta tarde, Bebidas¬;¬Para llevar, Capacidad, Camareros, Acceso para discapacitados, Sirve alcohol, Bar completo, Buffet¬;¬Niños, Grupos grandes, Familias con niños, Cocina local, Comer barato¬;¬domingo 09:00 - 00:00 lunes 09:00 - 00:00 martes 09:00 - 00:00 miércoles 09:00 - 00:00 jueves 09:00 - 00:00 viernes 09:00 - 00:00 sábado 09:00 - 00:00¬;¬Dirección: C/ Gran vía 72, 28015 Madrid, España Ubicación: Europa  >  España  >  Comunidad de Madrid  >  Madrid>  > Malasaña Barrio: Malasaña Número de teléfono: 91 531 45 50¬;¬Dirección: C/ Gran vía 72, 28015 Madrid, España Ubicación: Europa  >  España  >  Comunidad de Madrid  >  Madrid>  > Malasaña Barrio: Malasaña Número de teléfono: 91 531 45 50¬
¬Restaurante¬;¬Museo del Jamon¬;¬tomasasenjo¬;¬Madrid, España¬;¬4¬;¬46¬;¬1¬;¬tomasasenjoPA_Fra¬;¬4¬;¬PARA COMER BOCADILLO RÁPIDAMENTE¬;¬Franquicias por todo Madrid del ""Museo del Jamón"". Demasiado ajetero pero, si tu fin es comer un bocadillo rápido para seguir disfrutando de la ciudad, merece la pena porque sus precios son económicos y, la atención y el servicio, rápida (salvo rara excepción). Franquicias por todo Madrid del ""Museo del Jamón"". Demasiado ajetero pero, si tu fin es comer un bocadillo rápido para seguir disfrutando de la ciudad, merece la pena porque sus precios son económicos y, la atención y el servicio, rápida (salvo rara excepción).¬;¬28 octubre 2016¬;¬Visitado el agosto de 2016¬;¬Relación calidad-precio 4;Servicio 5;Comida 3¬;¬¬;¬¬;¬Bar, Mediterránea, Europea, Española¬;¬Brunch, Desayuno, Comidas, Cenas, Abierto hasta tarde, Bebidas¬;¬Para llevar, Capacidad, Camareros, Acceso para discapacitados, Sirve alcohol, Bar completo, Buffet¬;¬Niños, Grupos grandes, Familias con niños, Cocina local, Comer barato¬;¬domingo 09:00 - 00:00 lunes 09:00 - 00:00 martes 09:00 - 00:00 miércoles 09:00 - 00:00 jueves 09:00 - 00:00 viernes 09:00 - 00:00 sábado 09:00 - 00:00¬;¬Dirección: C/ Gran vía 72, 28015 Madrid, España Ubicación: Europa  >  España  >  Comunidad de Madrid  >  Madrid>  > Malasaña Barrio: Malasaña Número de teléfono: 91 531 45 50¬;¬Dirección: C/ Gran vía 72, 28015 Madrid, España Ubicación: Europa  >  España  >  Comunidad de Madrid  >  Madrid>  > Malasaña Barrio: Malasaña Número de teléfono: 91 531 45 50¬
¬Restaurante¬;¬Museo del Jamon¬;¬raimon50¬;¬¬;¬3¬;¬10¬;¬0¬;¬raimon50Co_Est¬;¬4¬;¬Comer con mi esposa¬;¬Estuve comiendo en el Museo del jamón en c/ Atocha 54,buen servicio y el menú por 9 € precio - calidad muy bueno,acompañado de una generosa ración de jamón por 3 €,visitamos también el de c/Gran Vía,72 bocata de jamón más caña de cerveza 2 € Estuve comiendo en el Museo del jamón en c/ Atocha 54,buen servicio y el menú por 9 € precio - calidad muy bueno,acompañado de una generosa ración de jamón por 3 €,visitamos también el de c/Gran Vía,72 bocata de jamón más caña de cerveza 2 €¬;¬26 octubre 2016¬;¬¬;¬¬;¬¬;¬¬;¬Bar, Mediterránea, Europea, Española¬;¬Brunch, Desayuno, Comidas, Cenas, Abierto hasta tarde, Bebidas¬;¬Para llevar, Capacidad, Camareros, Acceso para discapacitados, Sirve alcohol, Bar completo, Buffet¬;¬Niños, Grupos grandes, Familias con niños, Cocina local, Comer barato¬;¬domingo 09:00 - 00:00 lunes 09:00 - 00:00 martes 09:00 - 00:00 miércoles 09:00 - 00:00 jueves 09:00 - 00:00 viernes 09:00 - 00:00 sábado 09:00 - 00:00¬;¬Dirección: C/ Gran vía 72, 28015 Madrid, España Ubicación: Europa  >  España  >  Comunidad de Madrid  >  Madrid>  > Malasaña Barrio: Malasaña Número de teléfono: 91 531 45 50¬;¬Dirección: C/ Gran vía 72, 28015 Madrid, España Ubicación: Europa  >  España  >  Comunidad de Madrid  >  Madrid>  > Malasaña Barrio: Malasaña Número de teléfono: 91 531 45 50¬
¬Restaurante¬;¬Museo del Jamon¬;¬MarcosCarlosS¬;¬San Telmo, Distrito Federal, Argentina¬;¬6¬;¬194¬;¬67¬;¬MarcosCarlosSbu_opc¬;¬4¬;¬buena opción economica¬;¬opción economica con buena comida española, hay carta de menu por 10 euros x persona con bebida y postre, la calidad es aceptable y abundante, el ambiente es muy ameno con buen servicio, muy recomendable para familias. opción economica con buena comida española, hay carta de menu por 10 euros x persona con bebida y postre, la calidad es aceptable y abundante, el ambiente es muy ameno con buen servicio, muy recomendable para familias.¬;¬25 octubre 2016¬;¬Visitado el octubre de 2016¬;¬Relación calidad-precio 5;Servicio 4;Comida 4¬;¬¬;¬¬;¬Bar, Mediterránea, Europea, Española¬;¬Brunch, Desayuno, Comidas, Cenas, Abierto hasta tarde, Bebidas¬;¬Para llevar, Capacidad, Camareros, Acceso para discapacitados, Sirve alcohol, Bar completo, Buffet¬;¬Niños, Grupos grandes, Familias con niños, Cocina local, Comer barato¬;¬domingo 09:00 - 00:00 lunes 09:00 - 00:00 martes 09:00 - 00:00 miércoles 09:00 - 00:00 jueves 09:00 - 00:00 viernes 09:00 - 00:00 sábado 09:00 - 00:00¬;¬Dirección: C/ Gran vía 72, 28015 Madrid, España Ubicación: Europa  >  España  >  Comunidad de Madrid  >  Madrid>  > Malasaña Barrio: Malasaña Número de teléfono: 91 531 45 50¬;¬Dirección: C/ Gran vía 72, 28015 Madrid, España Ubicación: Europa  >  España  >  Comunidad de Madrid  >  Madrid>  > Malasaña Barrio: Malasaña Número de teléfono: 91 531 45 50¬
¬Restaurante¬;¬Museo del Jamon¬;¬MonicaL25¬;¬Buenos Aires, Argentina¬;¬5¬;¬25¬;¬4¬;¬MonicaL25UN_El¬;¬4¬;¬UN CLASICO¬;¬El Museo del Jamón es un clásico en España, nunca nada puede ser malo, sus tortillas, omelettes y platos clásicos, no fallan. A mi me encantan los sadwiches de jamón ibérico que ellos ofrecen, muy ricos!!! El Museo del Jamón es un clásico en España, nunca nada puede ser malo, sus tortillas, omelettes y platos clásicos, no fallan. A mi me encantan los sadwiches de jamón ibérico que ellos ofrecen, muy ricos!!!¬;¬24 octubre 2016¬;¬Visitado el junio de 2016¬;¬Relación calidad-precio 4;Servicio 4;Comida 4¬;¬¬;¬¬;¬Bar, Mediterránea, Europea, Española¬;¬Brunch, Desayuno, Comidas, Cenas, Abierto hasta tarde, Bebidas¬;¬Para llevar, Capacidad, Camareros, Acceso para discapacitados, Sirve alcohol, Bar completo, Buffet¬;¬Niños, Grupos grandes, Familias con niños, Cocina local, Comer barato¬;¬domingo 09:00 - 00:00 lunes 09:00 - 00:00 martes 09:00 - 00:00 miércoles 09:00 - 00:00 jueves 09:00 - 00:00 viernes 09:00 - 00:00 sábado 09:00 - 00:00¬;¬Dirección: C/ Gran vía 72, 28015 Madrid, España Ubicación: Europa  >  España  >  Comunidad de Madrid  >  Madrid>  > Malasaña Barrio: Malasaña Número de teléfono: 91 531 45 50¬;¬Dirección: C/ Gran vía 72, 28015 Madrid, España Ubicación: Europa  >  España  >  Comunidad de Madrid  >  Madrid>  > Malasaña Barrio: Malasaña Número de teléfono: 91 531 45 50¬
