Tipo,NombreRestaurante_,NombreUsuario_,LocalizaciónUsario_,NivelUsuario_,OpinionesTotalesUsuario_,VotosUtiles_,IDComentario_,ValoracionComentario_,TituloComentario_,Comentario_,FechaCometario_,FechaVisitaRestaurante_,ValoracionesComentario_,ResumenPuntuacionesRestaurante_,PrecioMedio_,TipoCocina_,Comida_,CaracteristicasDelResaurante_,AconsejablePara_,Horarios_,DireccionCompletaRestaurante_,Descripcion_
¬Restaurante¬;¬La Candela Restò¬;¬Estrepeiro¬;¬Madrid, Madrid, Spain¬;¬6¬;¬120¬;¬35¬;¬EstrepeiroUn_Cal¬;¬5¬;¬Un 5/5 de TripAdvisor como una casa¬;¬Calidad y cantidad por lo que se paga es insuperable. El despliegue de creatividad del chef es espectacular, al nivel de otros que tienen 1 o más estrellas michelín. La combinación de sabores, las presentaciones, algunas texturas son de gran gran restaurante. El salmón, el usuzukuri de corvina, las dos interpretaciones del pichón, la panceta, el chipirón asustado..., muchos sabores... Más  Calidad y cantidad por lo que se paga es insuperable. El despliegue de creatividad del chef es espectacular, al nivel de otros que tienen 1 o más estrellas michelín. La combinación de sabores, las presentaciones, algunas texturas son de gran gran restaurante. El salmón, el usuzukuri de corvina, las dos interpretaciones del pichón, la panceta, el chipirón asustado..., muchos sabores que desfilan dentro de la no-carta, menú cerrado y predeterminado por el chef. Buen maridaje de vinos y licores. Solo un pero, hay una cierta repetición de caldos concentrados, reducciones azucaradas, teriyakis. .. qué en un momento determinado aplanan lo que es una gran montaña rusa. Servicio impecable y conocedor. Para volver.¬;¬13 julio 2016¬;¬¬;¬¬;¬¬;¬35 € - 60 €¬;¬Española, Fusión¬;¬Comidas, Cenas, Abierto hasta tarde¬;¬Reservas, Capacidad, Camareros, Acceso para discapacitados, Sirve alcohol¬;¬Ocasiones especiales¬;¬domingo 13:30 - 15:30 martes 20:30 - 22:30 miércoles 20:30 - 22:30 13:30 - 15:30 jueves 20:30 - 22:30 13:30 - 15:30 viernes 20:30 - 22:30 13:30 - 15:30 sábado 20:30 - 22:30 13:30 - 15:30¬;¬Dirección: Calle Amnistia, 10, 28013 Madrid, España Ubicación: Europa  >  España  >  Comunidad de Madrid  >  Madrid>  > Centro Barrio: Centro Número de teléfono: +34 911 73 98 88¬;¬La Candela es un espacio de libertad gastronómica, en el que queremos ofrecer una experiencia sensorial lleno de imaginación. Tenemos dos menús de degustación, el corto y el largo. Así de fácil y así de difícil.¬
¬Restaurante¬;¬La Candela Restò¬;¬LuisB¬;¬Madrid, España¬;¬6¬;¬312¬;¬133¬;¬LuisBSe_El¬;¬5¬;¬Se atreven con todo.¬;¬El restaurante es pequeño, tendra unas 10 mesas asi que la atencion que se da al cliente es calida y excelente. Escogimos el menu intermedio de 9 platos, para cenar resulta mas que suficiente. Los ""platos"" como soporte/recipiente de la comida sorprenden por su originalidad y la comida en ellos presentada tambien lo hace. Atrevidos contrastes de sabores van saliendo... Más  El restaurante es pequeño, tendra unas 10 mesas asi que la atencion que se da al cliente es calida y excelente. Escogimos el menu intermedio de 9 platos, para cenar resulta mas que suficiente. Los ""platos"" como soporte/recipiente de la comida sorprenden por su originalidad y la comida en ellos presentada tambien lo hace. Atrevidos contrastes de sabores van saliendo con la justa cadencia para ser disfrutados, perfectamente explicados sin añadidos superfluos tan corrientes en otros lugares. Para mi gusto hay demasiadas ""esfericaciones"" en ellos, unas sorprendentes en boca y otras no pasan de ser un elemento decorativo en el plato que lo satura un poco. Los vinos muy buenos y el precio ya no tanto, algo elevado para la media en este tipo de cocina en Madrid donde salta o supera el nvel de los ""estrellados"" .¬;¬10 julio 2016¬;¬Visitado el julio de 2016¬;¬Relación calidad-precio 3;Servicio 5;Comida 5¬;¬¬;¬35 € - 60 €¬;¬Española, Fusión¬;¬Comidas, Cenas, Abierto hasta tarde¬;¬Reservas, Capacidad, Camareros, Acceso para discapacitados, Sirve alcohol¬;¬Ocasiones especiales¬;¬domingo 13:30 - 15:30 martes 20:30 - 22:30 miércoles 20:30 - 22:30 13:30 - 15:30 jueves 20:30 - 22:30 13:30 - 15:30 viernes 20:30 - 22:30 13:30 - 15:30 sábado 20:30 - 22:30 13:30 - 15:30¬;¬Dirección: Calle Amnistia, 10, 28013 Madrid, España Ubicación: Europa  >  España  >  Comunidad de Madrid  >  Madrid>  > Centro Barrio: Centro Número de teléfono: +34 911 73 98 88¬;¬La Candela es un espacio de libertad gastronómica, en el que queremos ofrecer una experiencia sensorial lleno de imaginación. Tenemos dos menús de degustación, el corto y el largo. Así de fácil y así de difícil.¬
¬Restaurante¬;¬La Candela Restò¬;¬RaquelGL¬;¬Madrid, España¬;¬6¬;¬187¬;¬126¬;¬RaquelGLSi_Exc¬;¬5¬;¬Sin palabras, una experiencia para el paladar¬;¬Excelente restaurante con platos imaginativos y ricos. El servicio y atención por parte de los camareros fue excelente. Optamos por el menú largo, con dos platos más veraniegos y por el menú con maridaje, una elección totalmente acertada. En total 3 horas de comida en la que disfrutamos con cada plato que nos ponían en la mesa. Sin ninguna duda... Más  Excelente restaurante con platos imaginativos y ricos. El servicio y atención por parte de los camareros fue excelente. Optamos por el menú largo, con dos platos más veraniegos y por el menú con maridaje, una elección totalmente acertada. En total 3 horas de comida en la que disfrutamos con cada plato que nos ponían en la mesa. Sin ninguna duda lo recomiendo, es una experiencia total, increíble que aún no cuente con una estrella Michelín. La única pega es que era el cumple de mi marido y a pesar de que recordé que había llamado para pedirles el favor de que le pusieran una velita en los pastelitos del postre (a lo que me dijeron que si en ambas ocasiones), al final no lo hicieron, y eso que solo estábamos nosotros en el restaurante porque nos quedamos rezagados por el menú que elegimos. Volveremos el año que viene¬;¬8 julio 2016¬;¬Visitado el julio de 2016¬;¬Relación calidad-precio 5;Servicio 5;Comida 5¬;¬¬;¬35 € - 60 €¬;¬Española, Fusión¬;¬Comidas, Cenas, Abierto hasta tarde¬;¬Reservas, Capacidad, Camareros, Acceso para discapacitados, Sirve alcohol¬;¬Ocasiones especiales¬;¬domingo 13:30 - 15:30 martes 20:30 - 22:30 miércoles 20:30 - 22:30 13:30 - 15:30 jueves 20:30 - 22:30 13:30 - 15:30 viernes 20:30 - 22:30 13:30 - 15:30 sábado 20:30 - 22:30 13:30 - 15:30¬;¬Dirección: Calle Amnistia, 10, 28013 Madrid, España Ubicación: Europa  >  España  >  Comunidad de Madrid  >  Madrid>  > Centro Barrio: Centro Número de teléfono: +34 911 73 98 88¬;¬La Candela es un espacio de libertad gastronómica, en el que queremos ofrecer una experiencia sensorial lleno de imaginación. Tenemos dos menús de degustación, el corto y el largo. Así de fácil y así de difícil.¬
¬Restaurante¬;¬La Candela Restò¬;¬Jose N¬;¬¬;¬3¬;¬10¬;¬2¬;¬Jose NUn_fui¬;¬5¬;¬Una sorpresa fantástica¬;¬fuimos por recomendacion de compañeros de trabajo. Fue una cena perfecta de principio a fin. la atencion cercana y agradable. escogimos un menu degustacion para todos y a pesar de la variedad de productos que tenía, no hubo ningun plato que nos defraudara o no gustase. Las admiraciones de placer por lo que comiamos eran continuas. Y los postres fantasticos fuimos por recomendacion de compañeros de trabajo. Fue una cena perfecta de principio a fin. la atencion cercana y agradable. escogimos un menu degustacion para todos y a pesar de la variedad de productos que tenía, no hubo ningun plato que nos defraudara o no gustase. Las admiraciones de placer por lo que comiamos eran continuas. Y los postres fantasticos¬;¬8 julio 2016¬;¬Visitado el marzo de 2016¬;¬Relación calidad-precio 5;Servicio 5;Comida 5¬;¬¬;¬35 € - 60 €¬;¬Española, Fusión¬;¬Comidas, Cenas, Abierto hasta tarde¬;¬Reservas, Capacidad, Camareros, Acceso para discapacitados, Sirve alcohol¬;¬Ocasiones especiales¬;¬domingo 13:30 - 15:30 martes 20:30 - 22:30 miércoles 20:30 - 22:30 13:30 - 15:30 jueves 20:30 - 22:30 13:30 - 15:30 viernes 20:30 - 22:30 13:30 - 15:30 sábado 20:30 - 22:30 13:30 - 15:30¬;¬Dirección: Calle Amnistia, 10, 28013 Madrid, España Ubicación: Europa  >  España  >  Comunidad de Madrid  >  Madrid>  > Centro Barrio: Centro Número de teléfono: +34 911 73 98 88¬;¬La Candela es un espacio de libertad gastronómica, en el que queremos ofrecer una experiencia sensorial lleno de imaginación. Tenemos dos menús de degustación, el corto y el largo. Así de fácil y así de difícil.¬
¬Restaurante¬;¬La Candela Restò¬;¬toni s¬;¬Madrid, España¬;¬6¬;¬129¬;¬94¬;¬toni sUn_Ant¬;¬5¬;¬Un deleite de sabores¬;¬Antes de entrar, no sabía muy bien lo que esperaba, ni siquiera ya sentado en el restaurante, ya que no me trajeron la carta tradicional, solo nos preguntaron de cuantos platos queríamos el menú y si existía alguna intolerancia alimentaria. Todo lo demás fue una sucesión de platos, muy elaborados, con sabores muy bien combinados, todo un reto para el... Más  Antes de entrar, no sabía muy bien lo que esperaba, ni siquiera ya sentado en el restaurante, ya que no me trajeron la carta tradicional, solo nos preguntaron de cuantos platos queríamos el menú y si existía alguna intolerancia alimentaria. Todo lo demás fue una sucesión de platos, muy elaborados, con sabores muy bien combinados, todo un reto para el paladar.¬;¬4 julio 2016¬;¬Visitado el julio de 2016¬;¬Relación calidad-precio 5;Servicio 5;Comida 5¬;¬¬;¬35 € - 60 €¬;¬Española, Fusión¬;¬Comidas, Cenas, Abierto hasta tarde¬;¬Reservas, Capacidad, Camareros, Acceso para discapacitados, Sirve alcohol¬;¬Ocasiones especiales¬;¬domingo 13:30 - 15:30 martes 20:30 - 22:30 miércoles 20:30 - 22:30 13:30 - 15:30 jueves 20:30 - 22:30 13:30 - 15:30 viernes 20:30 - 22:30 13:30 - 15:30 sábado 20:30 - 22:30 13:30 - 15:30¬;¬Dirección: Calle Amnistia, 10, 28013 Madrid, España Ubicación: Europa  >  España  >  Comunidad de Madrid  >  Madrid>  > Centro Barrio: Centro Número de teléfono: +34 911 73 98 88¬;¬La Candela es un espacio de libertad gastronómica, en el que queremos ofrecer una experiencia sensorial lleno de imaginación. Tenemos dos menús de degustación, el corto y el largo. Así de fácil y así de difícil.¬
¬Restaurante¬;¬La Candela Restò¬;¬Moskitto¬;¬Madrid¬;¬6¬;¬183¬;¬168¬;¬MoskittoAt_La¬;¬5¬;¬Atrevido¬;¬La verdad es que sabia a lo que venia y asi fue. Menú degustación largo con 11 platos de los cuales me sacaron del restaurante rodando a golpe de palo. El local en general me gusto, cocina abierta a la vista como debe ser, hay que estar orgulloso de como esta y como se trabaja dentro de ella y es... Más  La verdad es que sabia a lo que venia y asi fue. Menú degustación largo con 11 platos de los cuales me sacaron del restaurante rodando a golpe de palo. El local en general me gusto, cocina abierta a la vista como debe ser, hay que estar orgulloso de como esta y como se trabaja dentro de ella y es lo primero que recibe al comensal. El servicio me pareció encantador, atento y muy eficaz. Especialmente había un camarero que explicaba con tal entusiasmo los platos que parecía que los había creado conceptualmente el mismo. Antes de empezar a valorar la comida si hay una cosa que no me gusto pero evidentemente va por gustos. El vaso del agua a medio camino entre vaso de cuéntame, jarrón de flores de mi abuela me pareció que sacrificaba su rendimiento y comodidad por estética (la cual tampoco me gusta). La estética vintage general del local considero que se puede romper al igual que lo hace la comida con un vaso moderno y sobretodo con el cristal fino, que beber agua también se disfruta. El menú fue largo e intenso, voy a comentar lo que mas me llamo la antencion para bien y para mal pero en líneas generales lo que me parecio es una cocina muy creativa, arriesgada por momentos extrema que esta en el filo de la navaja a veces sorprende victoriosa otras estrepitosa. Me encanto el segundo snack que se presentaba en una rama, la albóndiga de rabo de toro al nivel de la del Bacira, la esferificacion de ceviche, la brandada... Espectacular. El salmon buenísimo con la piel crujiente y la salsa tipo teriyaki que acompañaba perfecto, no recuerdo la técnica de cocción pero estaba buenísimo quedando un poco crudo. Me llamo la atención la cuidada selección de hierbas y flores para acompañar los platos. El taquito de panceta se me caian lo lagrimones con cada vuelta que le daba en la boca, espero que en la siguiente vida tengan de esto porque sino lo voy a echar de menos. En este plato el acompañamiento era ""patata suflada"" con lo que espero pommes soufflés y en la foto se puede apreciar lo que parecen ruedas de patata de bolsa (por cierto de mis snacks favoritos) que estaban buenisismos pero me hizo gracia, no llegue a confirmarlo pero me parece perfecto. La pechuga de pichon ahumada además del espectáculo estaba impresionante. La anguila me parecio probablemente el ganador de los salados y por algo era el que cerraba el mundo salado. En la transición un caramelo con Ginebra Seagrams y una pimienta 8creo que sechuan) que adormece la boca y hace salivar. En los postres el de transición, el helado de remolacha estaba perfecto pero te tiene que gustar mucho la remolacha ya que es un sabor a tierra intenso, quizás bajaría un poco la cantidad uniéndolo con un helado de otro sabor que combine. Los últimos dos postres simplemente espectaculares poniendo boletus, shitake, estragon anisado en uno y curri dulce en otro en una especie de mochi... Me dejaron boqui abierto. Para finalizar unos petit fours en los cuales pusieron una vela ya que era el cumple de mi acompañante (bonito detalle, muy atento el camarero ya que lo comentamos de pasada). Increíble una esfera que tenia albahaca lima... Una vez mas sorprendente. Los platos que no me gustaron que fueron los menos fueron sobretodo el mole mejicano que me parecio que tenia un sabor demasiado agresivo al cual si bien es cierto que te vas acostumbrando a medida que lo comes pero era imprescindible coger a cada bocado algo del platano frito de guarnicion. No me llego a convencer el chipi hecho al vapor... Y eso que lo he comido crudo pero en este caso quedo ligeramente chicloso y no llegue a disfrutarlo. El helado de hígado de pichon fue una mezcla un poco extraña también, juntar foie con chocolate siempre me ha parecido bien, pero la textura de mousse se me hizo rara unido a que estaba frio... no se un poco extraño. La experiencia glocal fue increíble, tomamos cerveza la Virgen que es la que tienen allí y es espectacular aunque no llegue a ver si era de grifo o la tiraban de botellines. Os recomiendo que probéis la ""Jamonera"" es tipo IPA hecha en Madrid, un pepino de cerveza. Si te apetece experimentar en una mesa con tu paladar a un precio muy razonable y que te traten bien este es un muy buen sitio. Lo recomiendo con los ojos cerrados.¬;¬1 julio 2016¬;¬Visitado el junio de 2016¬;¬Relación calidad-precio 4;Servicio 5;Comida 5¬;¬¬;¬35 € - 60 €¬;¬Española, Fusión¬;¬Comidas, Cenas, Abierto hasta tarde¬;¬Reservas, Capacidad, Camareros, Acceso para discapacitados, Sirve alcohol¬;¬Ocasiones especiales¬;¬domingo 13:30 - 15:30 martes 20:30 - 22:30 miércoles 20:30 - 22:30 13:30 - 15:30 jueves 20:30 - 22:30 13:30 - 15:30 viernes 20:30 - 22:30 13:30 - 15:30 sábado 20:30 - 22:30 13:30 - 15:30¬;¬Dirección: Calle Amnistia, 10, 28013 Madrid, España Ubicación: Europa  >  España  >  Comunidad de Madrid  >  Madrid>  > Centro Barrio: Centro Número de teléfono: +34 911 73 98 88¬;¬La Candela es un espacio de libertad gastronómica, en el que queremos ofrecer una experiencia sensorial lleno de imaginación. Tenemos dos menús de degustación, el corto y el largo. Así de fácil y así de difícil.¬
¬Restaurante¬;¬La Candela Restò¬;¬jbravoca¬;¬Linares, España¬;¬2¬;¬5¬;¬1¬;¬jbravocaIn_Fui¬;¬5¬;¬Increible que no tenga una estrella michelín¬;¬Fuimos a conocerlo por las opiniones leídas en tripadvisor. Realmente fue una gratísima y no esperada experiencia, salimos realmente encantados... el servicio muy amable y correcto, los platos una maravilla gastronómica uno tras otro. Por poner alguna objeción, en algún plato el picante puede parecer excesivo a alguna persona. Los vinos poco conocidos para nosotros, pero estupendos (y a un... Más  Fuimos a conocerlo por las opiniones leídas en tripadvisor. Realmente fue una gratísima y no esperada experiencia, salimos realmente encantados... el servicio muy amable y correcto, los platos una maravilla gastronómica uno tras otro. Por poner alguna objeción, en algún plato el picante puede parecer excesivo a alguna persona. Los vinos poco conocidos para nosotros, pero estupendos (y a un precio bastante menor que el habitual). Un par de meses antes comimos en un restaurante con una estrella michelín (Sergi Arola) y es bastante inferior, en todo, que La Candela Restó. Volveremos¬;¬29 junio 2016¬;¬Visitado el abril de 2016¬;¬Relación calidad-precio 5;Servicio 4;Comida 5¬;¬¬;¬35 € - 60 €¬;¬Española, Fusión¬;¬Comidas, Cenas, Abierto hasta tarde¬;¬Reservas, Capacidad, Camareros, Acceso para discapacitados, Sirve alcohol¬;¬Ocasiones especiales¬;¬domingo 13:30 - 15:30 martes 20:30 - 22:30 miércoles 20:30 - 22:30 13:30 - 15:30 jueves 20:30 - 22:30 13:30 - 15:30 viernes 20:30 - 22:30 13:30 - 15:30 sábado 20:30 - 22:30 13:30 - 15:30¬;¬Dirección: Calle Amnistia, 10, 28013 Madrid, España Ubicación: Europa  >  España  >  Comunidad de Madrid  >  Madrid>  > Centro Barrio: Centro Número de teléfono: +34 911 73 98 88¬;¬La Candela es un espacio de libertad gastronómica, en el que queremos ofrecer una experiencia sensorial lleno de imaginación. Tenemos dos menús de degustación, el corto y el largo. Así de fácil y así de difícil.¬
¬Restaurante¬;¬La Candela Restò¬;¬julianmolina¬;¬Madrid, España¬;¬2¬;¬5¬;¬3¬;¬julianmolinaMe_Mag¬;¬5¬;¬Mejor que muchos con estrellas¬;¬Magnífico restaurante con una comida que nada tiene que envidiar a la de los mejores de Madrid. Todo exquisito y sorprendente. Quizás el tamaño del local le impida tener estrellas Michelin pero las merecería. Magnífico restaurante con una comida que nada tiene que envidiar a la de los mejores de Madrid. Todo exquisito y sorprendente. Quizás el tamaño del local le impida tener estrellas Michelin pero las merecería.¬;¬28 junio 2016¬;¬¬;¬¬;¬¬;¬35 € - 60 €¬;¬Española, Fusión¬;¬Comidas, Cenas, Abierto hasta tarde¬;¬Reservas, Capacidad, Camareros, Acceso para discapacitados, Sirve alcohol¬;¬Ocasiones especiales¬;¬domingo 13:30 - 15:30 martes 20:30 - 22:30 miércoles 20:30 - 22:30 13:30 - 15:30 jueves 20:30 - 22:30 13:30 - 15:30 viernes 20:30 - 22:30 13:30 - 15:30 sábado 20:30 - 22:30 13:30 - 15:30¬;¬Dirección: Calle Amnistia, 10, 28013 Madrid, España Ubicación: Europa  >  España  >  Comunidad de Madrid  >  Madrid>  > Centro Barrio: Centro Número de teléfono: +34 911 73 98 88¬;¬La Candela es un espacio de libertad gastronómica, en el que queremos ofrecer una experiencia sensorial lleno de imaginación. Tenemos dos menús de degustación, el corto y el largo. Así de fácil y así de difícil.¬
¬Restaurante¬;¬La Candela Restò¬;¬Daniel G¬;¬Madrid, España¬;¬6¬;¬109¬;¬57¬;¬Daniel GCo_La¬;¬5¬;¬Cocina creativa de calidad (precio alto)¬;¬La expectativa era alta, pero en absoluto defraudó la experiencia gastronómica, que así puede calificarse cenar en La candela. Hay 3 menús a elegir de 7-9-12 platos, elegimos el de 9 que es muy completo e interesante. El precio es alto (85€ aprox.) pero como experiencia especial merece la pena probarlo una vez al menos. La expectativa era alta, pero en absoluto defraudó la experiencia gastronómica, que así puede calificarse cenar en La candela. Hay 3 menús a elegir de 7-9-12 platos, elegimos el de 9 que es muy completo e interesante. El precio es alto (85€ aprox.) pero como experiencia especial merece la pena probarlo una vez al menos.¬;¬28 junio 2016¬;¬Visitado el abril de 2016¬;¬Relación calidad-precio 4;Servicio 5;Comida 5¬;¬¬;¬35 € - 60 €¬;¬Española, Fusión¬;¬Comidas, Cenas, Abierto hasta tarde¬;¬Reservas, Capacidad, Camareros, Acceso para discapacitados, Sirve alcohol¬;¬Ocasiones especiales¬;¬domingo 13:30 - 15:30 martes 20:30 - 22:30 miércoles 20:30 - 22:30 13:30 - 15:30 jueves 20:30 - 22:30 13:30 - 15:30 viernes 20:30 - 22:30 13:30 - 15:30 sábado 20:30 - 22:30 13:30 - 15:30¬;¬Dirección: Calle Amnistia, 10, 28013 Madrid, España Ubicación: Europa  >  España  >  Comunidad de Madrid  >  Madrid>  > Centro Barrio: Centro Número de teléfono: +34 911 73 98 88¬;¬La Candela es un espacio de libertad gastronómica, en el que queremos ofrecer una experiencia sensorial lleno de imaginación. Tenemos dos menús de degustación, el corto y el largo. Así de fácil y así de difícil.¬
¬Restaurante¬;¬La Candela Restò¬;¬JADCS¬;¬¬;¬3¬;¬16¬;¬7¬;¬JADCSSo_Pre¬;¬5¬;¬Sorprendente¬;¬Presentación muy cuidada de los platos, cocina creativa sin ridiculeces, raciones suficientes Te dan a elegir varios tipos de menú más cortos o más largos. Todos los platos mezclan una presentación sorprendente y muy cuidada y una mezcla de sabores novedosa y deliciosa Muy recomendable para ir en pareja en ocasiones especiales (no es barato, pero más asequible que otros... Más  Presentación muy cuidada de los platos, cocina creativa sin ridiculeces, raciones suficientes Te dan a elegir varios tipos de menú más cortos o más largos. Todos los platos mezclan una presentación sorprendente y muy cuidada y una mezcla de sabores novedosa y deliciosa Muy recomendable para ir en pareja en ocasiones especiales (no es barato, pero más asequible que otros del mismo tipo....) aunque tienen a mediodía un menú muy asequible¬;¬28 junio 2016¬;¬¬;¬¬;¬¬;¬35 € - 60 €¬;¬Española, Fusión¬;¬Comidas, Cenas, Abierto hasta tarde¬;¬Reservas, Capacidad, Camareros, Acceso para discapacitados, Sirve alcohol¬;¬Ocasiones especiales¬;¬domingo 13:30 - 15:30 martes 20:30 - 22:30 miércoles 20:30 - 22:30 13:30 - 15:30 jueves 20:30 - 22:30 13:30 - 15:30 viernes 20:30 - 22:30 13:30 - 15:30 sábado 20:30 - 22:30 13:30 - 15:30¬;¬Dirección: Calle Amnistia, 10, 28013 Madrid, España Ubicación: Europa  >  España  >  Comunidad de Madrid  >  Madrid>  > Centro Barrio: Centro Número de teléfono: +34 911 73 98 88¬;¬La Candela es un espacio de libertad gastronómica, en el que queremos ofrecer una experiencia sensorial lleno de imaginación. Tenemos dos menús de degustación, el corto y el largo. Así de fácil y así de difícil.¬
