Tipo,NombreRestaurante_,NombreUsuario_,LocalizaciónUsario_,NivelUsuario_,OpinionesTotalesUsuario_,VotosUtiles_,IDComentario_,ValoracionComentario_,TituloComentario_,Comentario_,FechaCometario_,FechaVisitaRestaurante_,ValoracionesComentario_,ResumenPuntuacionesRestaurante_,PrecioMedio_,TipoCocina_,Comida_,CaracteristicasDelResaurante_,AconsejablePara_,Horarios_,DireccionCompletaRestaurante_,Descripcion_
¬Restaurante¬;¬BARCELONA 8. tras puerta del sol¬;¬oscarelizalde¬;¬¬;¬0¬;¬2¬;¬0¬;¬oscarelizaldePu_No¬;¬3¬;¬Pues nos nada de otro mundo¬;¬No está mal. Pero no como en lo alto que esta valorado en el TripAdvisor. Ojo. Al lado hay muchos mas que están al menos en el mismo nivel. Yo iría a mirar y me metería al que mejor me parece. Lo mejor la atención y el solomillo con manzana.¬;¬30 octubre 2016¬;¬¬;¬¬;¬¬;¬7 € - 13 €¬;¬Internacional, Mediterránea, Española, Europea¬;¬Comidas, Cenas, Brunch, Abierto hasta tarde, Bebidas¬;¬Reservas, Terraza exterior, Camareros, Acceso para discapacitados, Sirve alcohol, Vino y cerveza, Acepta Mastercard, Acepta Visa, Solo efectivo, Wifi gratuito, Capacidad, Televisión, Tronas disponibles, Bar completo¬;¬Ocasiones especiales, Grupos grandes, Familias con niños, Cocina local, Ambiente de bar, Comer barato¬;¬¬;¬Dirección: Calle Barcelona 8, 28012 Madrid, España Ubicación: Europa  >  España  >  Comunidad de Madrid  >  Madrid>  > Centro Barrio: Centro Número de teléfono: +34 810 521 013¬;¬Dirección: Calle Barcelona 8, 28012 Madrid, España Ubicación: Europa  >  España  >  Comunidad de Madrid  >  Madrid>  > Centro Barrio: Centro Número de teléfono: +34 810 521 013¬
¬Restaurante¬;¬BARCELONA 8. tras puerta del sol¬;¬German T¬;¬¬;¬2¬;¬6¬;¬0¬;¬German TMu_El¬;¬3¬;¬Muy buena impresión aunque nos quedamos con ganas de más¬;¬El sitio muy bonito, y los empleados muy amables. Quedamos encantados con estas dos cosas. Como única cosa para mejorar diría que el tamaño de las medias raciones de tostas es un poco pequeño, aunque muy ricas! Resumiendo, un buen sitio en el que tomar algo.¬;¬23 octubre 2016¬;¬¬;¬¬;¬¬;¬7 € - 13 €¬;¬Internacional, Mediterránea, Española, Europea¬;¬Comidas, Cenas, Brunch, Abierto hasta tarde, Bebidas¬;¬Reservas, Terraza exterior, Camareros, Acceso para discapacitados, Sirve alcohol, Vino y cerveza, Acepta Mastercard, Acepta Visa, Solo efectivo, Wifi gratuito, Capacidad, Televisión, Tronas disponibles, Bar completo¬;¬Ocasiones especiales, Grupos grandes, Familias con niños, Cocina local, Ambiente de bar, Comer barato¬;¬¬;¬Dirección: Calle Barcelona 8, 28012 Madrid, España Ubicación: Europa  >  España  >  Comunidad de Madrid  >  Madrid>  > Centro Barrio: Centro Número de teléfono: +34 810 521 013¬;¬Dirección: Calle Barcelona 8, 28012 Madrid, España Ubicación: Europa  >  España  >  Comunidad de Madrid  >  Madrid>  > Centro Barrio: Centro Número de teléfono: +34 810 521 013¬
¬Restaurante¬;¬BARCELONA 8. tras puerta del sol¬;¬fmunozse¬;¬Madrid, Spain¬;¬2¬;¬6¬;¬1¬;¬fmunozseNi_El¬;¬3¬;¬Ni fu ni fa¬;¬El ambiente y la localización muy bueno. Los camareros muy amables (quizás demasiado, esto va en gusto) Cenamos en plan raciones y la verdad es que nos esperábamos más, era todo regular. Lo mejor el precio, barato para la zona¬;¬2 octubre 2016¬;¬¬;¬¬;¬¬;¬7 € - 13 €¬;¬Internacional, Mediterránea, Española, Europea¬;¬Comidas, Cenas, Brunch, Abierto hasta tarde, Bebidas¬;¬Reservas, Terraza exterior, Camareros, Acceso para discapacitados, Sirve alcohol, Vino y cerveza, Acepta Mastercard, Acepta Visa, Solo efectivo, Wifi gratuito, Capacidad, Televisión, Tronas disponibles, Bar completo¬;¬Ocasiones especiales, Grupos grandes, Familias con niños, Cocina local, Ambiente de bar, Comer barato¬;¬¬;¬Dirección: Calle Barcelona 8, 28012 Madrid, España Ubicación: Europa  >  España  >  Comunidad de Madrid  >  Madrid>  > Centro Barrio: Centro Número de teléfono: +34 810 521 013¬;¬Dirección: Calle Barcelona 8, 28012 Madrid, España Ubicación: Europa  >  España  >  Comunidad de Madrid  >  Madrid>  > Centro Barrio: Centro Número de teléfono: +34 810 521 013¬
¬Restaurante¬;¬BARCELONA 8. tras puerta del sol¬;¬Javier C¬;¬¬;¬0¬;¬1¬;¬1¬;¬Javier CCo_Muy¬;¬3¬;¬Comida de sabado¬;¬Muy satisfechos. La relación calidad precio fenomenal. Y sobre todo se agradece mucho en esa zona un servicio con personas q de verdad intentan agradar y q te sientas agusto. Repetiremos y recomendaremos.¬;¬2 octubre 2016¬;¬¬;¬¬;¬¬;¬7 € - 13 €¬;¬Internacional, Mediterránea, Española, Europea¬;¬Comidas, Cenas, Brunch, Abierto hasta tarde, Bebidas¬;¬Reservas, Terraza exterior, Camareros, Acceso para discapacitados, Sirve alcohol, Vino y cerveza, Acepta Mastercard, Acepta Visa, Solo efectivo, Wifi gratuito, Capacidad, Televisión, Tronas disponibles, Bar completo¬;¬Ocasiones especiales, Grupos grandes, Familias con niños, Cocina local, Ambiente de bar, Comer barato¬;¬¬;¬Dirección: Calle Barcelona 8, 28012 Madrid, España Ubicación: Europa  >  España  >  Comunidad de Madrid  >  Madrid>  > Centro Barrio: Centro Número de teléfono: +34 810 521 013¬;¬Dirección: Calle Barcelona 8, 28012 Madrid, España Ubicación: Europa  >  España  >  Comunidad de Madrid  >  Madrid>  > Centro Barrio: Centro Número de teléfono: +34 810 521 013¬
¬Restaurante¬;¬BARCELONA 8. tras puerta del sol¬;¬Marxial¬;¬¬;¬4¬;¬40¬;¬39¬;¬MarxialRe_Fui¬;¬3¬;¬Relación Calidad-Precio¬;¬Fuimos animados por los buenos comentarios. La verdad que la comida nos decepcionó, esperábamos bastante más para un local que está entre los 20 primeros de trypadvisor en la fecha en la que fuimos. No es que la comida sea mala, es ""normal"" sin más. Lo mejor la relación calidad-precio para la zona en la que está y que el... Más  Fuimos animados por los buenos comentarios. La verdad que la comida nos decepcionó, esperábamos bastante más para un local que está entre los 20 primeros de trypadvisor en la fecha en la que fuimos. No es que la comida sea mala, es ""normal"" sin más. Lo mejor la relación calidad-precio para la zona en la que está y que el trato es muy amable, pero ls comida es normailla del todo. Por ej, pedimos la hamburguesa que es muy mediocre, con una carne de segunda categoría (siendo generosos).¬;¬1 octubre 2016¬;¬¬;¬¬;¬¬;¬7 € - 13 €¬;¬Internacional, Mediterránea, Española, Europea¬;¬Comidas, Cenas, Brunch, Abierto hasta tarde, Bebidas¬;¬Reservas, Terraza exterior, Camareros, Acceso para discapacitados, Sirve alcohol, Vino y cerveza, Acepta Mastercard, Acepta Visa, Solo efectivo, Wifi gratuito, Capacidad, Televisión, Tronas disponibles, Bar completo¬;¬Ocasiones especiales, Grupos grandes, Familias con niños, Cocina local, Ambiente de bar, Comer barato¬;¬¬;¬Dirección: Calle Barcelona 8, 28012 Madrid, España Ubicación: Europa  >  España  >  Comunidad de Madrid  >  Madrid>  > Centro Barrio: Centro Número de teléfono: +34 810 521 013¬;¬Dirección: Calle Barcelona 8, 28012 Madrid, España Ubicación: Europa  >  España  >  Comunidad de Madrid  >  Madrid>  > Centro Barrio: Centro Número de teléfono: +34 810 521 013¬
¬Restaurante¬;¬BARCELONA 8. tras puerta del sol¬;¬Julie M¬;¬Southampton, England, United Kingdom¬;¬3¬;¬10¬;¬8¬;¬Julie MDe_Vis¬;¬3¬;¬Decepcionado¬;¬Visitamos Barcelona 8 en un viernes y estaba demasiado lleno. Pedimos reservar para el sábado y nos dijeron que no era posible, pero encontrar una mesa si mencionamos el nombre de alex. Nos volvimos y debidamente esperamos 40 minutos para nuestra mesa. Queríamos una bebida, pero tuvimos que esperar más de 20 minutos. Finalmente nos sentamos y nuestras comidas traídas... Más ¬;¬17 septiembre 2016¬;¬¬;¬¬;¬¬;¬7 € - 13 €¬;¬Internacional, Mediterránea, Española, Europea¬;¬Comidas, Cenas, Brunch, Abierto hasta tarde, Bebidas¬;¬Reservas, Terraza exterior, Camareros, Acceso para discapacitados, Sirve alcohol, Vino y cerveza, Acepta Mastercard, Acepta Visa, Solo efectivo, Wifi gratuito, Capacidad, Televisión, Tronas disponibles, Bar completo¬;¬Ocasiones especiales, Grupos grandes, Familias con niños, Cocina local, Ambiente de bar, Comer barato¬;¬¬;¬Dirección: Calle Barcelona 8, 28012 Madrid, España Ubicación: Europa  >  España  >  Comunidad de Madrid  >  Madrid>  > Centro Barrio: Centro Número de teléfono: +34 810 521 013¬;¬Dirección: Calle Barcelona 8, 28012 Madrid, España Ubicación: Europa  >  España  >  Comunidad de Madrid  >  Madrid>  > Centro Barrio: Centro Número de teléfono: +34 810 521 013¬
¬Restaurante¬;¬BARCELONA 8. tras puerta del sol¬;¬Nik H¬;¬¬;¬0¬;¬2¬;¬0¬;¬Nik HEl_Yo¬;¬3¬;¬Elección equivocada¬;¬Yo y mi chica eran en el hizzy esta noche. El camarero era aight aight, la cerveza también. Mojito no era estupendo y el cuadro 25 inflación de queso era caro, pero la comida de otras personas ordenados parecía tiptop y el ambiente donde está la acción. Volvería a ir de nuevo, pero para la comida que pedimos y el... Más ¬;¬16 agosto 2016¬;¬¬;¬¬;¬¬;¬7 € - 13 €¬;¬Internacional, Mediterránea, Española, Europea¬;¬Comidas, Cenas, Brunch, Abierto hasta tarde, Bebidas¬;¬Reservas, Terraza exterior, Camareros, Acceso para discapacitados, Sirve alcohol, Vino y cerveza, Acepta Mastercard, Acepta Visa, Solo efectivo, Wifi gratuito, Capacidad, Televisión, Tronas disponibles, Bar completo¬;¬Ocasiones especiales, Grupos grandes, Familias con niños, Cocina local, Ambiente de bar, Comer barato¬;¬¬;¬Dirección: Calle Barcelona 8, 28012 Madrid, España Ubicación: Europa  >  España  >  Comunidad de Madrid  >  Madrid>  > Centro Barrio: Centro Número de teléfono: +34 810 521 013¬;¬Dirección: Calle Barcelona 8, 28012 Madrid, España Ubicación: Europa  >  España  >  Comunidad de Madrid  >  Madrid>  > Centro Barrio: Centro Número de teléfono: +34 810 521 013¬
¬Restaurante¬;¬BARCELONA 8. tras puerta del sol¬;¬Kat3X¬;¬Perth, Australia¬;¬5¬;¬67¬;¬37¬;¬Kat3XSó_Fui¬;¬3¬;¬Sólo promedio¬;¬Fuimos aquí esta noche, ya que estaba a la vuelta de la esquina de nuestro apartamento. El restaurante es bonito y está limpio, nos dieron una sonrisa de las camareras a su llegada. Ellos no hablan inglés, lo cual está bien, especialmente porque hay un menú en inglés. Decidimos dividir una ensalada, algunas empanadas y una paella. Las empanadas eran... Más ¬;¬16 mayo 2016¬;¬¬;¬¬;¬¬;¬7 € - 13 €¬;¬Internacional, Mediterránea, Española, Europea¬;¬Comidas, Cenas, Brunch, Abierto hasta tarde, Bebidas¬;¬Reservas, Terraza exterior, Camareros, Acceso para discapacitados, Sirve alcohol, Vino y cerveza, Acepta Mastercard, Acepta Visa, Solo efectivo, Wifi gratuito, Capacidad, Televisión, Tronas disponibles, Bar completo¬;¬Ocasiones especiales, Grupos grandes, Familias con niños, Cocina local, Ambiente de bar, Comer barato¬;¬¬;¬Dirección: Calle Barcelona 8, 28012 Madrid, España Ubicación: Europa  >  España  >  Comunidad de Madrid  >  Madrid>  > Centro Barrio: Centro Número de teléfono: +34 810 521 013¬;¬Dirección: Calle Barcelona 8, 28012 Madrid, España Ubicación: Europa  >  España  >  Comunidad de Madrid  >  Madrid>  > Centro Barrio: Centro Número de teléfono: +34 810 521 013¬
