Tipo,NombreRestaurante_,NombreUsuario_,LocalizaciónUsario_,NivelUsuario_,OpinionesTotalesUsuario_,VotosUtiles_,IDComentario_,ValoracionComentario_,TituloComentario_,Comentario_,FechaCometario_,FechaVisitaRestaurante_,ValoracionesComentario_,ResumenPuntuacionesRestaurante_,PrecioMedio_,TipoCocina_,Comida_,CaracteristicasDelResaurante_,AconsejablePara_,Horarios_,DireccionCompletaRestaurante_,Descripcion_
¬Restaurante¬;¬Tandoori Station¬;¬Jamfry¬;¬Madrid, España¬;¬2¬;¬8¬;¬16¬;¬JamfryGr_Est¬;¬2¬;¬Gran decepción¬;¬Este jueves fuimos a cenar al Tandoori, desde hace mucho tiempo tenía ganas de conocerlo pues me encanta la comida india y según leíamos lo catalogaban como el mejor indio deMadrid... En nuestras opinión muy lejos de la realidad. La comida estaba rica, bien cocinada pero la cantidad era escasísima teniendo en cuenta el precio (14 euros), cuando los ingredientes... Más  Este jueves fuimos a cenar al Tandoori, desde hace mucho tiempo tenía ganas de conocerlo pues me encanta la comida india y según leíamos lo catalogaban como el mejor indio deMadrid... En nuestras opinión muy lejos de la realidad. La comida estaba rica, bien cocinada pero la cantidad era escasísima teniendo en cuenta el precio (14 euros), cuando los ingredientes son vegetales y legumbres. Rico pero nada que no puedas encontrar en otros muchos indios de os capital. El lugar no mos convencio nada, estaba mega explotado e espacio, practicamente te enterabas de la coversacion de la mesa vecina...bastante agobiante. El servicio muy lento, comenzamos a las 21.30 y salimos de allí a las 00. Lento en tomar nota de las bebidas, luegos los platos...y traerlos también, muy separados entrantes de principales. Una pena pero nada recomendable, por el precio, cantidades y el espacio.¬;¬19 abril 2015¬;¬¬;¬¬;¬¬;¬28 € - 36 €¬;¬India, Asiática, Menú para celíacos¬;¬Comidas, Cenas, Abierto hasta tarde¬;¬Para llevar, Reservas, Terraza exterior, Capacidad, Camareros, Acceso para discapacitados, Sirve alcohol¬;¬Romántico, Grupos grandes, Ocasiones especiales, Reuniones de negocios, Familias con niños¬;¬domingo 13:00 - 16:00 martes 13:00 - 16:00 20:30 - 00:00 miércoles 13:00 - 16:00 20:30 - 00:00 jueves 13:00 - 16:00 20:30 - 00:00 viernes 13:00 - 16:00 20:30 - 00:00 sábado 13:00 - 16:00 20:30 - 00:00¬;¬Dirección: Calle Jose Ortega y Gasset 89, 28006 Madrid, España Ubicación: Europa  >  España  >  Comunidad de Madrid  >  Madrid>  > Barrio de Salamanca Barrio: Barrio de Salamanca Número de teléfono: +34 914 01 22 28¬;¬Dirección: Calle Jose Ortega y Gasset 89, 28006 Madrid, España Ubicación: Europa  >  España  >  Comunidad de Madrid  >  Madrid>  > Barrio de Salamanca Barrio: Barrio de Salamanca Número de teléfono: +34 914 01 22 28¬
¬Restaurante¬;¬Tandoori Station¬;¬RicoRicoRicco¬;¬¬;¬5¬;¬86¬;¬65¬;¬RicoRicoRiccoSe_La¬;¬2¬;¬Se han subido a la parra¬;¬La comida esta bien, pero para lo que dan es caro el local es bonito , los camareros no son demasiado amables, si correctos, en fin creo que se les está subiendo un poco a la cabeza.... Y eso es peligroso La comida esta bien, pero para lo que dan es caro el local es bonito , los camareros no son demasiado amables, si correctos, en fin creo que se les está subiendo un poco a la cabeza.... Y eso es peligroso¬;¬6 febrero 2015¬;¬¬;¬¬;¬¬;¬28 € - 36 €¬;¬India, Asiática, Menú para celíacos¬;¬Comidas, Cenas, Abierto hasta tarde¬;¬Para llevar, Reservas, Terraza exterior, Capacidad, Camareros, Acceso para discapacitados, Sirve alcohol¬;¬Romántico, Grupos grandes, Ocasiones especiales, Reuniones de negocios, Familias con niños¬;¬domingo 13:00 - 16:00 martes 13:00 - 16:00 20:30 - 00:00 miércoles 13:00 - 16:00 20:30 - 00:00 jueves 13:00 - 16:00 20:30 - 00:00 viernes 13:00 - 16:00 20:30 - 00:00 sábado 13:00 - 16:00 20:30 - 00:00¬;¬Dirección: Calle Jose Ortega y Gasset 89, 28006 Madrid, España Ubicación: Europa  >  España  >  Comunidad de Madrid  >  Madrid>  > Barrio de Salamanca Barrio: Barrio de Salamanca Número de teléfono: +34 914 01 22 28¬;¬Dirección: Calle Jose Ortega y Gasset 89, 28006 Madrid, España Ubicación: Europa  >  España  >  Comunidad de Madrid  >  Madrid>  > Barrio de Salamanca Barrio: Barrio de Salamanca Número de teléfono: +34 914 01 22 28¬
¬Restaurante¬;¬Tandoori Station¬;¬Victoria Eugeni... G¬;¬Madrid, Madrid, Spain¬;¬4¬;¬28¬;¬42¬;¬Victoria Eugeni... GDe_Iba¬;¬2¬;¬Demasiado caro, por lo escaso.¬;¬Iba con la mejor actitud. Me habían hablado maravillas. La comida me pareció bastante buena (tomamos menú degustación) pero ridículamente escasa. Éramos cinco y de algunos platos apenas pudimos probar un trocito cada uno. Era como jugar al las comiditas. Pero el postre ya fue exiguo, un chiste. Cuatro (eramos cinco , insisto, todos habíamos elegido el menú degustación de... Más  Iba con la mejor actitud. Me habían hablado maravillas. La comida me pareció bastante buena (tomamos menú degustación) pero ridículamente escasa. Éramos cinco y de algunos platos apenas pudimos probar un trocito cada uno. Era como jugar al las comiditas. Pero el postre ya fue exiguo, un chiste. Cuatro (eramos cinco , insisto, todos habíamos elegido el menú degustación de 30 euros) cubitos de helado de pistacho y de otra cosa que no me acuerdo, del tamaño de menos de un azucarillo cada uno. Con dos cervezas indias por cabeza, salimos a 38 euros cada uno y con hambre.Por lo visto el menú no incluye ni una consumición de bebida. Lamento no haber hecho una foto de los 4 minidaditos de helado. Pero no estábamos de humor, la verdad. Juzguen ustedes.¬;¬4 enero 2015¬;¬Visitado el diciembre de 2014¬;¬Relación calidad-precio 2;Ambiente 3;Servicio 3;Comida 4¬;¬¬;¬28 € - 36 €¬;¬India, Asiática, Menú para celíacos¬;¬Comidas, Cenas, Abierto hasta tarde¬;¬Para llevar, Reservas, Terraza exterior, Capacidad, Camareros, Acceso para discapacitados, Sirve alcohol¬;¬Romántico, Grupos grandes, Ocasiones especiales, Reuniones de negocios, Familias con niños¬;¬domingo 13:00 - 16:00 martes 13:00 - 16:00 20:30 - 00:00 miércoles 13:00 - 16:00 20:30 - 00:00 jueves 13:00 - 16:00 20:30 - 00:00 viernes 13:00 - 16:00 20:30 - 00:00 sábado 13:00 - 16:00 20:30 - 00:00¬;¬Dirección: Calle Jose Ortega y Gasset 89, 28006 Madrid, España Ubicación: Europa  >  España  >  Comunidad de Madrid  >  Madrid>  > Barrio de Salamanca Barrio: Barrio de Salamanca Número de teléfono: +34 914 01 22 28¬;¬Dirección: Calle Jose Ortega y Gasset 89, 28006 Madrid, España Ubicación: Europa  >  España  >  Comunidad de Madrid  >  Madrid>  > Barrio de Salamanca Barrio: Barrio de Salamanca Número de teléfono: +34 914 01 22 28¬
¬Restaurante¬;¬Tandoori Station¬;¬mangar1¬;¬Jaén, España¬;¬4¬;¬28¬;¬24¬;¬mangar1en_Res¬;¬2¬;¬enorme decepción¬;¬Resulta arriesgado hacer una crítica negativa a un restaurante que está de moda y que ha sido calificado por un cocinero mediático (Sr. Chicote) como el mejor restaurante indio de Madrid. Sé me que lloverán las descalificaciones, sobre todo de los propietarios y también desde el entorno del Sr. Chicote, pero considero que los seguidores de Trip Advisor deben tener... Más  Resulta arriesgado hacer una crítica negativa a un restaurante que está de moda y que ha sido calificado por un cocinero mediático (Sr. Chicote) como el mejor restaurante indio de Madrid. Sé me que lloverán las descalificaciones, sobre todo de los propietarios y también desde el entorno del Sr. Chicote, pero considero que los seguidores de Trip Advisor deben tener la oportunidad de conocer una opinión que se aleja de la verdad oficial. Después de residir un año en India por motivos laborales, algo he podido aprender de mis amigos indios sobre su gastronomía, sobre todo la que se realiza en Delhi. Y de entrada, habría que dejar una cosa clara aunque sea políticamente incorrecto decirlo: Tandoori Station ofrece una comida india muy normalita a un precio elevado y con un estilo y maneras que recuerdan a los locales de fast food. Como clientes todos sabemos lo que deseamos: local acogedor, amabilidad del personal, calidad de los productos y un precio razonable. Es decir, comer como acto social, para disfrutar sin prisas, sin incomodidades y sin fraudes; de manera que la cena se convierte en un placer y se abandona satisfecho el local y con ganas de volver. Si falla alguno o varios de estos pilares, la valoración se resiente y conviene criticarlo para evitar daños a otros incautos. En mi caso quedamos a cenar un fin de semana con unos amigos, todos con expectativas muy altas, sobre todo tras lo afirmado por el Sr. Chicote. Y lo que nos encontramos fue un local masificado con unas mesas pequeñas y muy próximas, que permitían escuchar todas las conversaciones de nuestros vecinos, pero que nos impedían charlar normalmente. En resumen: local ruidoso e incómodo. A ello se suma que, como la filosofía es despachar a los clientes cuanto más rápido mejor para utilizar una mesa 2 ó 3 veces, el ritmo de los camareros es frenético, la atención es mínima y poco menos que te arrojan el plato en la mesa al servir la comida y te lo quitan a toda velocidad al acabar para que te marches y dejes la mesa libre. Este trato tan seco, incluso hosco, es incompatible con un buen servicio. Respecto a la comida la decepción es todavía mayor. Entrantes aburridos, tandooris sólo correctos y los currys muy flojos. La comida no se parece nada a la de la India, y no sólo porque para adaptarla al gusto local hayan rebajado mucho las especias y los condimentos, sino porque la han desnaturalizado y la han convertido en irreconocible. Para que se me entienda: es como si voy al mejor restaurante español de Milán, pido una paella de marisco y me traen un risotto con 4 gambas. De sobra sé que en Tandoori Station no me van a poner el cordero o las lentejas de Bukhara o los thalis de Chor Bizarre, por citar dos restaurantes emblemáticos de Delhi. Pero al menos que utilicen ingredientes de buena calidad y bien elaborados. No puedo entender que el Sr. Chicote afirme que ésta es la mejor comida india de Madrid. A lo mejor a él, le dieron trato de VIP y le hicieron un menú degustación auténtico. Finalmente, el colmo es que el precio sea alto para una cena tan mediocre. Lo dicho: enorme decepción.¬;¬3 septiembre 2014¬;¬Visitado el junio de 2014¬;¬Relación calidad-precio 2;Ambiente 3;Servicio 2;Comida 3¬;¬¬;¬28 € - 36 €¬;¬India, Asiática, Menú para celíacos¬;¬Comidas, Cenas, Abierto hasta tarde¬;¬Para llevar, Reservas, Terraza exterior, Capacidad, Camareros, Acceso para discapacitados, Sirve alcohol¬;¬Romántico, Grupos grandes, Ocasiones especiales, Reuniones de negocios, Familias con niños¬;¬domingo 13:00 - 16:00 martes 13:00 - 16:00 20:30 - 00:00 miércoles 13:00 - 16:00 20:30 - 00:00 jueves 13:00 - 16:00 20:30 - 00:00 viernes 13:00 - 16:00 20:30 - 00:00 sábado 13:00 - 16:00 20:30 - 00:00¬;¬Dirección: Calle Jose Ortega y Gasset 89, 28006 Madrid, España Ubicación: Europa  >  España  >  Comunidad de Madrid  >  Madrid>  > Barrio de Salamanca Barrio: Barrio de Salamanca Número de teléfono: +34 914 01 22 28¬;¬Dirección: Calle Jose Ortega y Gasset 89, 28006 Madrid, España Ubicación: Europa  >  España  >  Comunidad de Madrid  >  Madrid>  > Barrio de Salamanca Barrio: Barrio de Salamanca Número de teléfono: +34 914 01 22 28¬
¬Restaurante¬;¬Tandoori Station¬;¬Tatiana S¬;¬Madrid¬;¬0¬;¬2¬;¬10¬;¬Tatiana SMa_No¬;¬2¬;¬Mal¬;¬No nos ha gustado, somos fans de comida India y este restaurante no cumpla ni con requisitos mínimos , entrantes sin sabor , segundo plato han tardado de traer un montón , han olvidado de traernos salsa que hemos pedido, cordero que ha pedido mi pareja, duro, albóndigas que he pedido yo picantes no llevaban nada picante. Restaurante en sí... Más  No nos ha gustado, somos fans de comida India y este restaurante no cumpla ni con requisitos mínimos , entrantes sin sabor , segundo plato han tardado de traer un montón , han olvidado de traernos salsa que hemos pedido, cordero que ha pedido mi pareja, duro, albóndigas que he pedido yo picantes no llevaban nada picante. Restaurante en sí mismo muy incómodo , camareros están pasando al lado de mesas, vienen muchas parejas con niños pequeños . Y encargada de chiste, nos dijo que segundos platos tardaron tanto por que fuimos a fumar! La hostia! Para ir corriendo y no regresar jamás ......y con estética de Mac Donalds¬;¬6 abril 2014¬;¬¬;¬¬;¬¬;¬28 € - 36 €¬;¬India, Asiática, Menú para celíacos¬;¬Comidas, Cenas, Abierto hasta tarde¬;¬Para llevar, Reservas, Terraza exterior, Capacidad, Camareros, Acceso para discapacitados, Sirve alcohol¬;¬Romántico, Grupos grandes, Ocasiones especiales, Reuniones de negocios, Familias con niños¬;¬domingo 13:00 - 16:00 martes 13:00 - 16:00 20:30 - 00:00 miércoles 13:00 - 16:00 20:30 - 00:00 jueves 13:00 - 16:00 20:30 - 00:00 viernes 13:00 - 16:00 20:30 - 00:00 sábado 13:00 - 16:00 20:30 - 00:00¬;¬Dirección: Calle Jose Ortega y Gasset 89, 28006 Madrid, España Ubicación: Europa  >  España  >  Comunidad de Madrid  >  Madrid>  > Barrio de Salamanca Barrio: Barrio de Salamanca Número de teléfono: +34 914 01 22 28¬;¬Dirección: Calle Jose Ortega y Gasset 89, 28006 Madrid, España Ubicación: Europa  >  España  >  Comunidad de Madrid  >  Madrid>  > Barrio de Salamanca Barrio: Barrio de Salamanca Número de teléfono: +34 914 01 22 28¬
¬Restaurante¬;¬Tandoori Station¬;¬Licomedes M¬;¬Madrid, España¬;¬4¬;¬43¬;¬27¬;¬Licomedes MEs_En¬;¬2¬;¬Estilo franquicia¬;¬En fin, esas cosas que se ponen para que se llene de gente deseando algo 'exótico'. Hay restaurantes indios en Madrid mucho más recomendables con sabores más ajustados a su cultura, creativos... Bueno, esto es un sitio para entrar 'según se pasa' si no hay otro plan y se busca estar sentados un rato... tampoco es que se pase mal. En fin, esas cosas que se ponen para que se llene de gente deseando algo 'exótico'. Hay restaurantes indios en Madrid mucho más recomendables con sabores más ajustados a su cultura, creativos... Bueno, esto es un sitio para entrar 'según se pasa' si no hay otro plan y se busca estar sentados un rato... tampoco es que se pase mal.¬;¬18 octubre 2013¬;¬¬;¬¬;¬¬;¬28 € - 36 €¬;¬India, Asiática, Menú para celíacos¬;¬Comidas, Cenas, Abierto hasta tarde¬;¬Para llevar, Reservas, Terraza exterior, Capacidad, Camareros, Acceso para discapacitados, Sirve alcohol¬;¬Romántico, Grupos grandes, Ocasiones especiales, Reuniones de negocios, Familias con niños¬;¬domingo 13:00 - 16:00 martes 13:00 - 16:00 20:30 - 00:00 miércoles 13:00 - 16:00 20:30 - 00:00 jueves 13:00 - 16:00 20:30 - 00:00 viernes 13:00 - 16:00 20:30 - 00:00 sábado 13:00 - 16:00 20:30 - 00:00¬;¬Dirección: Calle Jose Ortega y Gasset 89, 28006 Madrid, España Ubicación: Europa  >  España  >  Comunidad de Madrid  >  Madrid>  > Barrio de Salamanca Barrio: Barrio de Salamanca Número de teléfono: +34 914 01 22 28¬;¬Dirección: Calle Jose Ortega y Gasset 89, 28006 Madrid, España Ubicación: Europa  >  España  >  Comunidad de Madrid  >  Madrid>  > Barrio de Salamanca Barrio: Barrio de Salamanca Número de teléfono: +34 914 01 22 28¬
¬Restaurante¬;¬Tandoori Station¬;¬Javier M¬;¬Torrelavega, España¬;¬6¬;¬82¬;¬55¬;¬Javier MUn_Fui¬;¬2¬;¬Una decepción¬;¬Fui al Tandoori Station por una recomendación de un amigo, que era un sitio genial si pasaba por Madrid. Así que allí fui con mi novia. El aspecto exterior es atractivo y la decoración es original, aunque para esto habrá gustos. Nada más entrar, nos preguntaron si teníamos reserva. No teníamos, nos dijeron que nos colaban en algún sitio. Nos... Más  Fui al Tandoori Station por una recomendación de un amigo, que era un sitio genial si pasaba por Madrid. Así que allí fui con mi novia. El aspecto exterior es atractivo y la decoración es original, aunque para esto habrá gustos. Nada más entrar, nos preguntaron si teníamos reserva. No teníamos, nos dijeron que nos colaban en algún sitio. Nos pusieron en una mesa para dos, con otras dos mesas a ambos lados, apenas separadas 50cm unas de otras, lo suficiente para pasar. Cuando un camarero atendía una mesa, tenías su espalda (y lo que hay donde acaba la espalda) en tu cara. Hay una increible falta de espacio, que estropea la comida. No puedes tener una conversación tranquila con acompañantes, escuchas todo lo que hablan los de la mesa de al lado, ya que estais pegados. Nos trajeron la carta, y tuvimos tiempo de sobra para mirarla, ya que tardaron una eternidad en atendernos (El local estaba lleno, eso si). Al rato llegaron nuestros camareros, uno para las bebidas, y otro para la comida. Pedimos cosas del menú degustación aunque no el menú en si mismo, ya que no queríamos comer tanto (¡gran error!). Los camareros ""normales"", eran simpáticos y agradables, la recepcionista también, una de las camareras, insoportablemente borde (igual tuvo que ver algo que no tuviésemos reserva, puede). De primero pedimos unas empanadillas de entrantes para compartir (perdonadme si no me se los nombres) mi sorpresa es cuando vienen... DOS!!! dos empanadillas por 6,5€!!! De segundo pedimos dos platos de pollo (tampoco me se los nombres, lo siento), que siguen la misma regla: un poquito de comida y mucha guarnición. Vimos que la regla era la misma para casi todo lo que se pidiera, ya que las mesas de al lado, recibían platos similares. Hay que reconocer que los trozos de carne estaban riquísimos, pero si no llego a comer la guarnición y el pan (normal o de ajo), me quedo con hambre, y eso, pagando casi 60 euros por los dos, para mí, es indignante..... ¡¡¡3,6€ por una cerveza india!!!!! No lo recomiendo, salvo por probar como nueva experiencia. Yo no volveré.¬;¬14 septiembre 2013¬;¬Visitado el septiembre de 2013¬;¬Relación calidad-precio 1;Ambiente 2;Servicio 2;Comida 4¬;¬¬;¬28 € - 36 €¬;¬India, Asiática, Menú para celíacos¬;¬Comidas, Cenas, Abierto hasta tarde¬;¬Para llevar, Reservas, Terraza exterior, Capacidad, Camareros, Acceso para discapacitados, Sirve alcohol¬;¬Romántico, Grupos grandes, Ocasiones especiales, Reuniones de negocios, Familias con niños¬;¬domingo 13:00 - 16:00 martes 13:00 - 16:00 20:30 - 00:00 miércoles 13:00 - 16:00 20:30 - 00:00 jueves 13:00 - 16:00 20:30 - 00:00 viernes 13:00 - 16:00 20:30 - 00:00 sábado 13:00 - 16:00 20:30 - 00:00¬;¬Dirección: Calle Jose Ortega y Gasset 89, 28006 Madrid, España Ubicación: Europa  >  España  >  Comunidad de Madrid  >  Madrid>  > Barrio de Salamanca Barrio: Barrio de Salamanca Número de teléfono: +34 914 01 22 28¬;¬Dirección: Calle Jose Ortega y Gasset 89, 28006 Madrid, España Ubicación: Europa  >  España  >  Comunidad de Madrid  >  Madrid>  > Barrio de Salamanca Barrio: Barrio de Salamanca Número de teléfono: +34 914 01 22 28¬
¬Restaurante¬;¬Tandoori Station¬;¬Yaguilar67¬;¬Madrid, España¬;¬3¬;¬15¬;¬13¬;¬Yaguilar67De_Ama¬;¬2¬;¬Decepcionante¬;¬Amante de la cocina India, hacía tiempo que quería probar este restaurante. La primera impresión, por el ambiente y la decoración, fue agradable. Todo lo que vino después... francamente decepcionante. La comida deja mucho que desear, las samosas secas, el arroz pulau soso; el curry de pollo un pollo extremademente picante pero sin matices ni sabores; el RESHMI KEBAB anodino... Más  Amante de la cocina India, hacía tiempo que quería probar este restaurante. La primera impresión, por el ambiente y la decoración, fue agradable. Todo lo que vino después... francamente decepcionante. La comida deja mucho que desear, las samosas secas, el arroz pulau soso; el curry de pollo un pollo extremademente picante pero sin matices ni sabores; el RESHMI KEBAB anodino y para rematar, el TANDOORI JHINGE donde los langostinos parecían haber sido arrojados en el último momento sobre la salsa. Lo único realmente bueno fue el postre de yogur búlgaro con grosellas. El servicio tampoco fue especialmente bueno. Me quitaron (esa es la palabra) el plato de la mesa cuando todavía estaba comiendo. Vamos... como decía, una decepción.¬;¬2 julio 2013¬;¬Visitado el junio de 2013¬;¬Relación calidad-precio 2;Ambiente 4;Servicio 2;Comida 2¬;¬¬;¬28 € - 36 €¬;¬India, Asiática, Menú para celíacos¬;¬Comidas, Cenas, Abierto hasta tarde¬;¬Para llevar, Reservas, Terraza exterior, Capacidad, Camareros, Acceso para discapacitados, Sirve alcohol¬;¬Romántico, Grupos grandes, Ocasiones especiales, Reuniones de negocios, Familias con niños¬;¬domingo 13:00 - 16:00 martes 13:00 - 16:00 20:30 - 00:00 miércoles 13:00 - 16:00 20:30 - 00:00 jueves 13:00 - 16:00 20:30 - 00:00 viernes 13:00 - 16:00 20:30 - 00:00 sábado 13:00 - 16:00 20:30 - 00:00¬;¬Dirección: Calle Jose Ortega y Gasset 89, 28006 Madrid, España Ubicación: Europa  >  España  >  Comunidad de Madrid  >  Madrid>  > Barrio de Salamanca Barrio: Barrio de Salamanca Número de teléfono: +34 914 01 22 28¬;¬Dirección: Calle Jose Ortega y Gasset 89, 28006 Madrid, España Ubicación: Europa  >  España  >  Comunidad de Madrid  >  Madrid>  > Barrio de Salamanca Barrio: Barrio de Salamanca Número de teléfono: +34 914 01 22 28¬
¬Restaurante¬;¬Tandoori Station¬;¬115Jose¬;¬Madrid, España¬;¬5¬;¬71¬;¬60¬;¬115JoseSi_Me¬;¬2¬;¬Sitio de moda. No me gusta nada.¬;¬Me parece un sitio de moda, nada auténtico y sí europeo, para nada esto es un restaurante indio. No me gusta el ambiente y huele a refrito según entras, no desde luego a especias indias, que sería lo normal. Mucha demanda para tan poca chicha, pero se aplica el dicho... Donde va la gente, donde va Vicente. Me parece un sitio de moda, nada auténtico y sí europeo, para nada esto es un restaurante indio. No me gusta el ambiente y huele a refrito según entras, no desde luego a especias indias, que sería lo normal. Mucha demanda para tan poca chicha, pero se aplica el dicho... Donde va la gente, donde va Vicente.¬;¬3 marzo 2013¬;¬Visitado el marzo de 2013¬;¬Relación calidad-precio 2;Ambiente 1;Servicio 3;Comida 3¬;¬¬;¬28 € - 36 €¬;¬India, Asiática, Menú para celíacos¬;¬Comidas, Cenas, Abierto hasta tarde¬;¬Para llevar, Reservas, Terraza exterior, Capacidad, Camareros, Acceso para discapacitados, Sirve alcohol¬;¬Romántico, Grupos grandes, Ocasiones especiales, Reuniones de negocios, Familias con niños¬;¬domingo 13:00 - 16:00 martes 13:00 - 16:00 20:30 - 00:00 miércoles 13:00 - 16:00 20:30 - 00:00 jueves 13:00 - 16:00 20:30 - 00:00 viernes 13:00 - 16:00 20:30 - 00:00 sábado 13:00 - 16:00 20:30 - 00:00¬;¬Dirección: Calle Jose Ortega y Gasset 89, 28006 Madrid, España Ubicación: Europa  >  España  >  Comunidad de Madrid  >  Madrid>  > Barrio de Salamanca Barrio: Barrio de Salamanca Número de teléfono: +34 914 01 22 28¬;¬Dirección: Calle Jose Ortega y Gasset 89, 28006 Madrid, España Ubicación: Europa  >  España  >  Comunidad de Madrid  >  Madrid>  > Barrio de Salamanca Barrio: Barrio de Salamanca Número de teléfono: +34 914 01 22 28¬
¬Restaurante¬;¬Tandoori Station¬;¬garridoa¬;¬¬;¬2¬;¬5¬;¬12¬;¬garridoaLa_Cen¬;¬2¬;¬La mejor comida hindu de Madrid con el peor servicio¬;¬Cenamos en la terraza hace un par de dias y tardamos en cenar 3 horas! Quiero pensar que tuvieron una crisis de personal puntual, porque llego a tener tintes de tragicomedia. Se come de maravilla y tienen muy buen local. Deben ponese las pilas con el tema del servicio. Es una critica constructiva. Nos invitaron a una bebida y luego... Más  Cenamos en la terraza hace un par de dias y tardamos en cenar 3 horas! Quiero pensar que tuvieron una crisis de personal puntual, porque llego a tener tintes de tragicomedia. Se come de maravilla y tienen muy buen local. Deben ponese las pilas con el tema del servicio. Es una critica constructiva. Nos invitaron a una bebida y luego a chupitos, por lo menos tuvieron ese detalle.¬;¬29 agosto 2011¬;¬¬;¬Relación calidad-precio 3;Ambiente 4;Servicio 1;Comida 4¬;¬¬;¬28 € - 36 €¬;¬India, Asiática, Menú para celíacos¬;¬Comidas, Cenas, Abierto hasta tarde¬;¬Para llevar, Reservas, Terraza exterior, Capacidad, Camareros, Acceso para discapacitados, Sirve alcohol¬;¬Romántico, Grupos grandes, Ocasiones especiales, Reuniones de negocios, Familias con niños¬;¬domingo 13:00 - 16:00 martes 13:00 - 16:00 20:30 - 00:00 miércoles 13:00 - 16:00 20:30 - 00:00 jueves 13:00 - 16:00 20:30 - 00:00 viernes 13:00 - 16:00 20:30 - 00:00 sábado 13:00 - 16:00 20:30 - 00:00¬;¬Dirección: Calle Jose Ortega y Gasset 89, 28006 Madrid, España Ubicación: Europa  >  España  >  Comunidad de Madrid  >  Madrid>  > Barrio de Salamanca Barrio: Barrio de Salamanca Número de teléfono: +34 914 01 22 28¬;¬Dirección: Calle Jose Ortega y Gasset 89, 28006 Madrid, España Ubicación: Europa  >  España  >  Comunidad de Madrid  >  Madrid>  > Barrio de Salamanca Barrio: Barrio de Salamanca Número de teléfono: +34 914 01 22 28¬
