Tipo,NombreRestaurante_,NombreUsuario_,LocalizaciónUsario_,NivelUsuario_,OpinionesTotalesUsuario_,VotosUtiles_,IDComentario_,ValoracionComentario_,TituloComentario_,Comentario_,FechaCometario_,FechaVisitaRestaurante_,ValoracionesComentario_,ResumenPuntuacionesRestaurante_,PrecioMedio_,TipoCocina_,Comida_,CaracteristicasDelResaurante_,AconsejablePara_,Horarios_,DireccionCompletaRestaurante_,Descripcion_
¬Restaurante¬;¬Bacoa Sol¬;¬Alfonso C¬;¬¬;¬0¬;¬1¬;¬0¬;¬Alfonso CNo_Las¬;¬1¬;¬No dieron ni una en cocina¬;¬Las hamburguesas estaban buenas, aunque no son las mejores de Madrid. Sin embargo en cocina estarían de fiesta porque no dieron ni una con la comanda. No nos trajeron ni el pan ni los complementos que habíamos pedido (y pagado). Tras muchos viajes de la camarera, que muy amablemente fue arreglando los desatinos de cocina, pudimos disfrutar de nuestras hamburguesas,... Más  Las hamburguesas estaban buenas, aunque no son las mejores de Madrid. Sin embargo en cocina estarían de fiesta porque no dieron ni una con la comanda. No nos trajeron ni el pan ni los complementos que habíamos pedido (y pagado). Tras muchos viajes de la camarera, que muy amablemente fue arreglando los desatinos de cocina, pudimos disfrutar de nuestras hamburguesas, que ya estaban frías.¬;¬1 noviembre 2016¬;¬¬;¬¬;¬¬;¬5 € - 15 €¬;¬Americana, Comida rápida, Internacional, Menús vegetarianos, Opciones veganas¬;¬Comidas, Cenas¬;¬Para llevar, Capacidad, Camareros, Tronas disponibles, Acceso para discapacitados, Sirve alcohol, Vino y cerveza, Acepta Mastercard, Acepta Visa, Wifi gratuito¬;¬Comer barato, Familias con niños, Niños¬;¬domingo 12:30 - 00:00 lunes 12:30 - 00:00 martes 12:30 - 00:00 miércoles 12:30 - 00:00 jueves 12:30 - 00:00 viernes 12:30 - 02:00 sábado 12:30 - 02:00¬;¬Dirección: Carrera San Jeronimo 3, 28014 Madrid, España Ubicación: Europa  >  España  >  Comunidad de Madrid  >  Madrid>  > Centro Barrio: Centro Número de teléfono: +34 915 21 22 58¬;¬Bacoa es más que un restaurante. Es una hamburguesería, donde comida rápida es también comida de calidad. Ven a conocernos y prueba nuestras hamburguesas gourmet y nuestras patatas fritas cortadas a mano.¬
¬Restaurante¬;¬Bacoa Sol¬;¬Bmorenog¬;¬¬;¬3¬;¬16¬;¬16¬;¬BmorenogIm_Aca¬;¬1¬;¬Impresionada para mal¬;¬Acabo de sentarme en este bar para tomar una cerveza y una coca cola. Mientras pido, el camarero se acerca a mi mujer y la dice que primero tenemos q pedir y después sentarnos, pero q hoy nos perdona porque hay poca gente. Mas tarde se sientan unos chicos al lado y les levanta diciéndoles lo mismo....sin duda no volveré,... Más  Acabo de sentarme en este bar para tomar una cerveza y una coca cola. Mientras pido, el camarero se acerca a mi mujer y la dice que primero tenemos q pedir y después sentarnos, pero q hoy nos perdona porque hay poca gente. Mas tarde se sientan unos chicos al lado y les levanta diciéndoles lo mismo....sin duda no volveré, no por la calidad sino por la actitud.¬;¬14 agosto 2016¬;¬¬;¬¬;¬¬;¬5 € - 15 €¬;¬Americana, Comida rápida, Internacional, Menús vegetarianos, Opciones veganas¬;¬Comidas, Cenas¬;¬Para llevar, Capacidad, Camareros, Tronas disponibles, Acceso para discapacitados, Sirve alcohol, Vino y cerveza, Acepta Mastercard, Acepta Visa, Wifi gratuito¬;¬Comer barato, Familias con niños, Niños¬;¬domingo 12:30 - 00:00 lunes 12:30 - 00:00 martes 12:30 - 00:00 miércoles 12:30 - 00:00 jueves 12:30 - 00:00 viernes 12:30 - 02:00 sábado 12:30 - 02:00¬;¬Dirección: Carrera San Jeronimo 3, 28014 Madrid, España Ubicación: Europa  >  España  >  Comunidad de Madrid  >  Madrid>  > Centro Barrio: Centro Número de teléfono: +34 915 21 22 58¬;¬Bacoa es más que un restaurante. Es una hamburguesería, donde comida rápida es también comida de calidad. Ven a conocernos y prueba nuestras hamburguesas gourmet y nuestras patatas fritas cortadas a mano.¬
¬Restaurante¬;¬Bacoa Sol¬;¬Francesco F¬;¬Madrid, España¬;¬4¬;¬38¬;¬12¬;¬Francesco FYa_Bac¬;¬1¬;¬Ya no es lo que era antes¬;¬Bacoa me sorprendió hace unos años en Barcelona. Era una hamburguesería de nivel, con unas burguer esquisitas y suculentas. Tanto la calidad de la carne como el nivel de su preparación eran altos y reflejaban perfectamente el precio. He decidido darle una oportunidad hoy, tras ver que la franquicia había bajado de mucho la calidad y el nivel. Lamentablemente he... Más  Bacoa me sorprendió hace unos años en Barcelona. Era una hamburguesería de nivel, con unas burguer esquisitas y suculentas. Tanto la calidad de la carne como el nivel de su preparación eran altos y reflejaban perfectamente el precio. He decidido darle una oportunidad hoy, tras ver que la franquicia había bajado de mucho la calidad y el nivel. Lamentablemente he vivido la misma sensación que la última vez que estuve. Aquí una síntesis detallada de la calidad y del servicio: 1. Calidad: Es una burguer mediocre. Hemos pedido una de cordero y lechal para compartir. Respeto a la burguer original, el filete es bajo y seco. El sabor lo da el pan y el relleno de pimientos y crema de queso. Con la Burgos (el nombre con el que puedes encontrar la burguer) hemos pedido unas patatas gajos, que se presentaban bien y cuyo sabor era normal con un exceso de cocción que las hacía muy sequeronas, a pesar de su grosor. 2. Servicio: el exceso de cortesía, sin evaluar si el cliente ha estado ya en sus locales o no, más la falta de profesionalidad hacen que toda la experiencia sea nula. En ningún momento te preguntan a qué punto de cocción quieres la carne. Y se habían olvidado de las dos bebidas que habíamos pedido. Precio final: 16€ con algo para una hamburguesa, unas patatas, una cerveza y una cola. Definitivamente la relación calidad-servicio-precio no corresponde al nivel que quieren aparentar.¬;¬5 junio 2016¬;¬Visitado el junio de 2016¬;¬Relación calidad-precio 1;Servicio 1;Comida 1¬;¬¬;¬5 € - 15 €¬;¬Americana, Comida rápida, Internacional, Menús vegetarianos, Opciones veganas¬;¬Comidas, Cenas¬;¬Para llevar, Capacidad, Camareros, Tronas disponibles, Acceso para discapacitados, Sirve alcohol, Vino y cerveza, Acepta Mastercard, Acepta Visa, Wifi gratuito¬;¬Comer barato, Familias con niños, Niños¬;¬domingo 12:30 - 00:00 lunes 12:30 - 00:00 martes 12:30 - 00:00 miércoles 12:30 - 00:00 jueves 12:30 - 00:00 viernes 12:30 - 02:00 sábado 12:30 - 02:00¬;¬Dirección: Carrera San Jeronimo 3, 28014 Madrid, España Ubicación: Europa  >  España  >  Comunidad de Madrid  >  Madrid>  > Centro Barrio: Centro Número de teléfono: +34 915 21 22 58¬;¬Bacoa es más que un restaurante. Es una hamburguesería, donde comida rápida es también comida de calidad. Ven a conocernos y prueba nuestras hamburguesas gourmet y nuestras patatas fritas cortadas a mano.¬
¬Restaurante¬;¬Bacoa Sol¬;¬Diego d¬;¬¬;¬3¬;¬17¬;¬7¬;¬Diego dNo_Vol¬;¬1¬;¬No me gustó¬;¬Volví de nuevo a cenar en esta hamburguesería hará un par de semanas, ya que la primera vez salí bastante satisfecho. Siento decir que, cuando pidieron mi hamburguesa, no preguntaron el punto de la carne (que la quería poco hecha) así que, me levanté a decirlo y, los camareros, ajetreados por la cantidad de gente que había para sólo dos... Más  Volví de nuevo a cenar en esta hamburguesería hará un par de semanas, ya que la primera vez salí bastante satisfecho. Siento decir que, cuando pidieron mi hamburguesa, no preguntaron el punto de la carne (que la quería poco hecha) así que, me levanté a decirlo y, los camareros, ajetreados por la cantidad de gente que había para sólo dos personas atendiendo, me hicieron el caso justo, me dijeron que irían a decirlo a cocina y, cuál fue mi sorpresa cuando al rato aparece el camarero con mi hamburguesa, le pregunto sobre el punto y me dice que está al punto y no se ha podido hacer nada, le digo que si no se puede hacer nada me la tendré que comer así (ya había pagado, porque aquí se paga por adelantado y hasta que no pagas no puedes ni coger sitio), pese a que no me guste y que haya pedido el cambio antes de que saliera, y, sin respuesta, me la sirve. La conclusión de la otra camarera (que me hizo más caso y fue muy amable, por cierto) es que, si hubiera sido error suyo me la hubieran cambiado, pero como el error había sido mío, no se podía hacer nada. Mi conclusión: rellené un formulario donde me preguntan un montón de cosas sobre cómo quiero mi hamburguesa y no preguntan el punto, pagué la hamburguesa por adelantado, pedí el cambio en cuanto me di cuenta de que no me la habían pedido poco hecha y me tuve que comer una hamburguesa cara que no me gustaba. Con la de buenas hamburgueserías que hay, no vuelvo más a ésta.¬;¬10 mayo 2016¬;¬Visitado el abril de 2016¬;¬Relación calidad-precio 1;Servicio 1;Comida 1¬;¬¬;¬5 € - 15 €¬;¬Americana, Comida rápida, Internacional, Menús vegetarianos, Opciones veganas¬;¬Comidas, Cenas¬;¬Para llevar, Capacidad, Camareros, Tronas disponibles, Acceso para discapacitados, Sirve alcohol, Vino y cerveza, Acepta Mastercard, Acepta Visa, Wifi gratuito¬;¬Comer barato, Familias con niños, Niños¬;¬domingo 12:30 - 00:00 lunes 12:30 - 00:00 martes 12:30 - 00:00 miércoles 12:30 - 00:00 jueves 12:30 - 00:00 viernes 12:30 - 02:00 sábado 12:30 - 02:00¬;¬Dirección: Carrera San Jeronimo 3, 28014 Madrid, España Ubicación: Europa  >  España  >  Comunidad de Madrid  >  Madrid>  > Centro Barrio: Centro Número de teléfono: +34 915 21 22 58¬;¬Bacoa es más que un restaurante. Es una hamburguesería, donde comida rápida es también comida de calidad. Ven a conocernos y prueba nuestras hamburguesas gourmet y nuestras patatas fritas cortadas a mano.¬
¬Restaurante¬;¬Bacoa Sol¬;¬lalalanguages¬;¬Madrid, España¬;¬0¬;¬1¬;¬2¬;¬lalalanguagesDe_La¬;¬1¬;¬Decepcionante - de cara a calidad/precio y prácticas sostenibles¬;¬La relación calidad precio deja mucho de desear... Me pedí la Bacoa Burger con pan de brioche pensando que me iban a traer una hamburguesa jugosa y con el doble de queso, y resulta que me la sirven con media loncha (finísma!!) de queso Manchego y media loncha de queso Cheddar (hola?). Para el colmo la hamburguesa y las patatas... Más  La relación calidad precio deja mucho de desear... Me pedí la Bacoa Burger con pan de brioche pensando que me iban a traer una hamburguesa jugosa y con el doble de queso, y resulta que me la sirven con media loncha (finísma!!) de queso Manchego y media loncha de queso Cheddar (hola?). Para el colmo la hamburguesa y las patatas estaban frías. No sé si el pan de brioche era sin gluten quizás pero de elasticidad no tenía nada y, aunque había colocado la hamburguesa en el cartoncillo que te dan para que no se te ensucien las manos, se me desmigajaba todo el rato. Todo esto más una lata de Coca Cola me salió a 15€. Además me parece uno de los restaurantes menos ecológicos que conozco; aparte de servirte las servilletitas de bar que no absorben NADA y te gastas como 17 unidades por cabeza, también te hacen rellenar una carta (copia de papel) por persona para pedir tu comida. Realmente es necesario? Ósea...sirves ""ternera ecológica"" y fardas de prácticas sostenibles pero el papel como que da igual.¬;¬15 abril 2016¬;¬Visitado el abril de 2016¬;¬Relación calidad-precio 1;Servicio 1;Comida 1¬;¬¬;¬5 € - 15 €¬;¬Americana, Comida rápida, Internacional, Menús vegetarianos, Opciones veganas¬;¬Comidas, Cenas¬;¬Para llevar, Capacidad, Camareros, Tronas disponibles, Acceso para discapacitados, Sirve alcohol, Vino y cerveza, Acepta Mastercard, Acepta Visa, Wifi gratuito¬;¬Comer barato, Familias con niños, Niños¬;¬domingo 12:30 - 00:00 lunes 12:30 - 00:00 martes 12:30 - 00:00 miércoles 12:30 - 00:00 jueves 12:30 - 00:00 viernes 12:30 - 02:00 sábado 12:30 - 02:00¬;¬Dirección: Carrera San Jeronimo 3, 28014 Madrid, España Ubicación: Europa  >  España  >  Comunidad de Madrid  >  Madrid>  > Centro Barrio: Centro Número de teléfono: +34 915 21 22 58¬;¬Bacoa es más que un restaurante. Es una hamburguesería, donde comida rápida es también comida de calidad. Ven a conocernos y prueba nuestras hamburguesas gourmet y nuestras patatas fritas cortadas a mano.¬
