Tipo,NombreRestaurante_,NombreUsuario_,LocalizaciónUsario_,NivelUsuario_,OpinionesTotalesUsuario_,VotosUtiles_,IDComentario_,ValoracionComentario_,TituloComentario_,Comentario_,FechaCometario_,FechaVisitaRestaurante_,ValoracionesComentario_,ResumenPuntuacionesRestaurante_,PrecioMedio_,TipoCocina_,Comida_,CaracteristicasDelResaurante_,AconsejablePara_,Horarios_,DireccionCompletaRestaurante_,Descripcion_
¬Restaurante¬;¬Miyama Castellana¬;¬pedro p¬;¬Madrid, España¬;¬3¬;¬15¬;¬20¬;¬pedro pCo_Loc¬;¬3¬;¬Comida aceptable en raciones minimalistas¬;¬Local adecuado para el tipo de comida que brindan, si bien hay una gran diferencia entre las mesas de cuatro (cómodas y amplias) y las de dos personas (tan pequeñas que hay dificultades para colocar lo estrictamente necesario, p.e. las botellas no se dejan en las mesas, no caben). Nos atendió un camarero, el maitre estaba ocupado en otras mesas... Más  Local adecuado para el tipo de comida que brindan, si bien hay una gran diferencia entre las mesas de cuatro (cómodas y amplias) y las de dos personas (tan pequeñas que hay dificultades para colocar lo estrictamente necesario, p.e. las botellas no se dejan en las mesas, no caben). Nos atendió un camarero, el maitre estaba ocupado en otras mesas y ante la inexistencia de un menú de degustación nos dejamos aconsejar. Nos ofreció un menú (prácticamente el mismo que aconsejó a las mesas cercanas) consistente en: tartare de atún picante 16,50 €; surtido de 3 sashimis (un trocito de cada uno de ellos por persona) 26€; tataki de pez limón 21,50€, surtido de 3 nigiris (un nigiri de cada clase por persona) 24,80€; un rollo de wagyu 12€; un postre 6 € y cuatro cervezas de barril 12€. De todo ello lo único que nos ""sorprendió"" favorablemente fue el tartare (si bien de picante no tenía nada), el resto de platos eran correctos, materia prima fresca y muy bien cortada, pero no superiores a los que ponen en muchísimos japos de precios menos dolorosos. La parte más negativa de toda la visita fue la dimensión de las raciones que nos ofrecieron: francamente mínimas. Las dos personas que cenamos coincidimos en que pareció más un tapeo suave que una cena y desde luego no parece de recibo que pagando 120€ salgas con hambre, máxime si, como es nuestro caso, no somos de mucho comer.¬;¬15 diciembre 2015¬;¬Visitado el diciembre de 2015¬;¬Relación calidad-precio 3;Servicio 3;Comida 3¬;¬¬;¬¬;¬Japonesa, Sushi, Asiática, Menú para celíacos¬;¬Comidas, Cenas, Abierto hasta tarde¬;¬Reservas, Capacidad, Camareros, Sirve alcohol, Bar completo¬;¬Romántico, Ocasiones especiales, Reuniones de negocios¬;¬lunes 13:30 - 16:00 20:30 - 00:00 martes 13:30 - 16:00 20:30 - 00:00 miércoles 13:30 - 16:00 20:30 - 00:00 jueves 13:30 - 16:00 20:30 - 00:00 viernes 13:30 - 16:00 20:30 - 00:00 sábado 13:30 - 16:00 20:30 - 00:00¬;¬Dirección: Paseo de La Castellana, 45, 28046 Madrid, España Ubicación: Europa  >  España  >  Comunidad de Madrid  >  Madrid>  > Chamberí Barrio: Chamberí Número de teléfono: +34 913 91 00 26¬;¬Dirección: Paseo de La Castellana, 45, 28046 Madrid, España Ubicación: Europa  >  España  >  Comunidad de Madrid  >  Madrid>  > Chamberí Barrio: Chamberí Número de teléfono: +34 913 91 00 26¬
¬Restaurante¬;¬Miyama Castellana¬;¬Ldiagor¬;¬Barcelona, España¬;¬5¬;¬57¬;¬43¬;¬LdiagorAc_El¬;¬3¬;¬Aceptable¬;¬El sushi no está mal. Hay otros restaurantes mejores para sushi. El servicio es atento pero sigo diciendo que podría ser mejor. El sushi no está mal. Hay otros restaurantes mejores para sushi. El servicio es atento pero sigo diciendo que podría ser mejor.¬;¬4 diciembre 2015¬;¬Visitado el octubre de 2015¬;¬Relación calidad-precio 2;Servicio 3;Comida 3¬;¬¬;¬¬;¬Japonesa, Sushi, Asiática, Menú para celíacos¬;¬Comidas, Cenas, Abierto hasta tarde¬;¬Reservas, Capacidad, Camareros, Sirve alcohol, Bar completo¬;¬Romántico, Ocasiones especiales, Reuniones de negocios¬;¬lunes 13:30 - 16:00 20:30 - 00:00 martes 13:30 - 16:00 20:30 - 00:00 miércoles 13:30 - 16:00 20:30 - 00:00 jueves 13:30 - 16:00 20:30 - 00:00 viernes 13:30 - 16:00 20:30 - 00:00 sábado 13:30 - 16:00 20:30 - 00:00¬;¬Dirección: Paseo de La Castellana, 45, 28046 Madrid, España Ubicación: Europa  >  España  >  Comunidad de Madrid  >  Madrid>  > Chamberí Barrio: Chamberí Número de teléfono: +34 913 91 00 26¬;¬Dirección: Paseo de La Castellana, 45, 28046 Madrid, España Ubicación: Europa  >  España  >  Comunidad de Madrid  >  Madrid>  > Chamberí Barrio: Chamberí Número de teléfono: +34 913 91 00 26¬
¬Restaurante¬;¬Miyama Castellana¬;¬Nekane I¬;¬Bilbao, España¬;¬5¬;¬91¬;¬49¬;¬Nekane ISu_Igu¬;¬3¬;¬Sushi aceptable¬;¬Igual un poco caro para lo que ofrecen, pero el sushi es aceptable y los platos están ricos ( reconozco que tengo el listón muy alto en la comida japonesa y es difícil sorprenderme) el servicio es increíble como en casi todos los sitios de este estilo en la capital. Igual un poco caro para lo que ofrecen, pero el sushi es aceptable y los platos están ricos ( reconozco que tengo el listón muy alto en la comida japonesa y es difícil sorprenderme) el servicio es increíble como en casi todos los sitios de este estilo en la capital.¬;¬26 noviembre 2015¬;¬¬;¬¬;¬¬;¬¬;¬Japonesa, Sushi, Asiática, Menú para celíacos¬;¬Comidas, Cenas, Abierto hasta tarde¬;¬Reservas, Capacidad, Camareros, Sirve alcohol, Bar completo¬;¬Romántico, Ocasiones especiales, Reuniones de negocios¬;¬lunes 13:30 - 16:00 20:30 - 00:00 martes 13:30 - 16:00 20:30 - 00:00 miércoles 13:30 - 16:00 20:30 - 00:00 jueves 13:30 - 16:00 20:30 - 00:00 viernes 13:30 - 16:00 20:30 - 00:00 sábado 13:30 - 16:00 20:30 - 00:00¬;¬Dirección: Paseo de La Castellana, 45, 28046 Madrid, España Ubicación: Europa  >  España  >  Comunidad de Madrid  >  Madrid>  > Chamberí Barrio: Chamberí Número de teléfono: +34 913 91 00 26¬;¬Dirección: Paseo de La Castellana, 45, 28046 Madrid, España Ubicación: Europa  >  España  >  Comunidad de Madrid  >  Madrid>  > Chamberí Barrio: Chamberí Número de teléfono: +34 913 91 00 26¬
¬Restaurante¬;¬Miyama Castellana¬;¬¬;¬¬;¬0¬;¬0¬;¬0¬;¬me_Emp¬;¬3¬;¬me ha faltado algo...pocos sabores¬;¬Empezando por lo positivo, la gente que trabaja es espectacular, muy buenos profesionales y atentos. Lo demas que es la comida y el precio son bastante malos. Una carencia grande en los sabores, nos faltaba muchos sabores, era muy insipido. El precio es elevado para lo que nos dieron. Empezando por lo positivo, la gente que trabaja es espectacular, muy buenos profesionales y atentos. Lo demas que es la comida y el precio son bastante malos. Una carencia grande en los sabores, nos faltaba muchos sabores, era muy insipido. El precio es elevado para lo que nos dieron.¬;¬20 octubre 2015¬;¬¬;¬¬;¬¬;¬¬;¬Japonesa, Sushi, Asiática, Menú para celíacos¬;¬Comidas, Cenas, Abierto hasta tarde¬;¬Reservas, Capacidad, Camareros, Sirve alcohol, Bar completo¬;¬Romántico, Ocasiones especiales, Reuniones de negocios¬;¬lunes 13:30 - 16:00 20:30 - 00:00 martes 13:30 - 16:00 20:30 - 00:00 miércoles 13:30 - 16:00 20:30 - 00:00 jueves 13:30 - 16:00 20:30 - 00:00 viernes 13:30 - 16:00 20:30 - 00:00 sábado 13:30 - 16:00 20:30 - 00:00¬;¬Dirección: Paseo de La Castellana, 45, 28046 Madrid, España Ubicación: Europa  >  España  >  Comunidad de Madrid  >  Madrid>  > Chamberí Barrio: Chamberí Número de teléfono: +34 913 91 00 26¬;¬Dirección: Paseo de La Castellana, 45, 28046 Madrid, España Ubicación: Europa  >  España  >  Comunidad de Madrid  >  Madrid>  > Chamberí Barrio: Chamberí Número de teléfono: +34 913 91 00 26¬
¬Restaurante¬;¬Miyama Castellana¬;¬carlos p¬;¬Madrid, España¬;¬1¬;¬4¬;¬8¬;¬carlos pes_cre¬;¬3¬;¬esta bien!¬;¬creo que le falta ambiente pero la comida es alucinante. decoración de los platos también asombroso. totalmente recomendado para ir con amigos o con una pareja. creo que le falta ambiente pero la comida es alucinante. decoración de los platos también asombroso. totalmente recomendado para ir con amigos o con una pareja.¬;¬21 septiembre 2015¬;¬Visitado el julio de 2015¬;¬Relación calidad-precio 4;Servicio 2;Comida 4¬;¬¬;¬¬;¬Japonesa, Sushi, Asiática, Menú para celíacos¬;¬Comidas, Cenas, Abierto hasta tarde¬;¬Reservas, Capacidad, Camareros, Sirve alcohol, Bar completo¬;¬Romántico, Ocasiones especiales, Reuniones de negocios¬;¬lunes 13:30 - 16:00 20:30 - 00:00 martes 13:30 - 16:00 20:30 - 00:00 miércoles 13:30 - 16:00 20:30 - 00:00 jueves 13:30 - 16:00 20:30 - 00:00 viernes 13:30 - 16:00 20:30 - 00:00 sábado 13:30 - 16:00 20:30 - 00:00¬;¬Dirección: Paseo de La Castellana, 45, 28046 Madrid, España Ubicación: Europa  >  España  >  Comunidad de Madrid  >  Madrid>  > Chamberí Barrio: Chamberí Número de teléfono: +34 913 91 00 26¬;¬Dirección: Paseo de La Castellana, 45, 28046 Madrid, España Ubicación: Europa  >  España  >  Comunidad de Madrid  >  Madrid>  > Chamberí Barrio: Chamberí Número de teléfono: +34 913 91 00 26¬
¬Restaurante¬;¬Miyama Castellana¬;¬HeXiFu¬;¬Madrid, España¬;¬6¬;¬53¬;¬21¬;¬HeXiFu¿D_Res¬;¬3¬;¬¿Demasiadas expectativas puestas o elección errónea de platos?¬;¬Restaurante japonés minimalista con buena materia prima, pero que por precio no llega a la altura de otros como Kabuki. Probamos su espectacular tataki de toro, sashimi de vieiras y de pescado blanco que nos recomendaron, unos deliciosas makis de atún picante y crujientes de tempura, y los clásicos california con aguacate y cangrejo. Para terminar un sorbete de lichi... Más  Restaurante japonés minimalista con buena materia prima, pero que por precio no llega a la altura de otros como Kabuki. Probamos su espectacular tataki de toro, sashimi de vieiras y de pescado blanco que nos recomendaron, unos deliciosas makis de atún picante y crujientes de tempura, y los clásicos california con aguacate y cangrejo. Para terminar un sorbete de lichi con crema de chocolate blanco y perlas de rosas, que estaba realmente rico, pero algo caro para ser un postre (8,50 euros).No sé si es que íbamos con las expectativas demasiadas altas, pero nuestra visita a Miyama no la considero nada fuera de lo normal. Quizás esperábamos una mejor relación calidad precio.¬;¬8 julio 2015¬;¬Visitado el febrero de 2015¬;¬Relación calidad-precio 2;Servicio 4;Comida 3¬;¬¬;¬¬;¬Japonesa, Sushi, Asiática, Menú para celíacos¬;¬Comidas, Cenas, Abierto hasta tarde¬;¬Reservas, Capacidad, Camareros, Sirve alcohol, Bar completo¬;¬Romántico, Ocasiones especiales, Reuniones de negocios¬;¬lunes 13:30 - 16:00 20:30 - 00:00 martes 13:30 - 16:00 20:30 - 00:00 miércoles 13:30 - 16:00 20:30 - 00:00 jueves 13:30 - 16:00 20:30 - 00:00 viernes 13:30 - 16:00 20:30 - 00:00 sábado 13:30 - 16:00 20:30 - 00:00¬;¬Dirección: Paseo de La Castellana, 45, 28046 Madrid, España Ubicación: Europa  >  España  >  Comunidad de Madrid  >  Madrid>  > Chamberí Barrio: Chamberí Número de teléfono: +34 913 91 00 26¬;¬Dirección: Paseo de La Castellana, 45, 28046 Madrid, España Ubicación: Europa  >  España  >  Comunidad de Madrid  >  Madrid>  > Chamberí Barrio: Chamberí Número de teléfono: +34 913 91 00 26¬
¬Restaurante¬;¬Miyama Castellana¬;¬ivansob123¬;¬Madrid, España¬;¬6¬;¬66¬;¬52¬;¬ivansob123Ca_Pla¬;¬3¬;¬Cantidad pequeña precio caro¬;¬Platos con cantidades muy pequeñas y precios muy elevados. Nigiris y makis muy pequeños. Wagyu pequeñisima ración, 100gr que eran 90gr 44€. Camareros muy súbditos de modales. Maitre más de lo mismo. No volveré. Hay otros sitios en Madrid de igual calidad con un precio inferior y dan mas cantidad. Recomiendo Naomi un Japones autentico o 19 sushi bar. Platos con cantidades muy pequeñas y precios muy elevados. Nigiris y makis muy pequeños. Wagyu pequeñisima ración, 100gr que eran 90gr 44€. Camareros muy súbditos de modales. Maitre más de lo mismo. No volveré. Hay otros sitios en Madrid de igual calidad con un precio inferior y dan mas cantidad. Recomiendo Naomi un Japones autentico o 19 sushi bar.¬;¬11 abril 2015¬;¬¬;¬¬;¬¬;¬¬;¬Japonesa, Sushi, Asiática, Menú para celíacos¬;¬Comidas, Cenas, Abierto hasta tarde¬;¬Reservas, Capacidad, Camareros, Sirve alcohol, Bar completo¬;¬Romántico, Ocasiones especiales, Reuniones de negocios¬;¬lunes 13:30 - 16:00 20:30 - 00:00 martes 13:30 - 16:00 20:30 - 00:00 miércoles 13:30 - 16:00 20:30 - 00:00 jueves 13:30 - 16:00 20:30 - 00:00 viernes 13:30 - 16:00 20:30 - 00:00 sábado 13:30 - 16:00 20:30 - 00:00¬;¬Dirección: Paseo de La Castellana, 45, 28046 Madrid, España Ubicación: Europa  >  España  >  Comunidad de Madrid  >  Madrid>  > Chamberí Barrio: Chamberí Número de teléfono: +34 913 91 00 26¬;¬Dirección: Paseo de La Castellana, 45, 28046 Madrid, España Ubicación: Europa  >  España  >  Comunidad de Madrid  >  Madrid>  > Chamberí Barrio: Chamberí Número de teléfono: +34 913 91 00 26¬
¬Restaurante¬;¬Miyama Castellana¬;¬Miguel Angel F¬;¬Madrid, España¬;¬5¬;¬60¬;¬17¬;¬Miguel Angel FCo_La¬;¬3¬;¬Comida muy buena pero precio excesivo¬;¬La comida es de gran calidad. El servicio es muy agradable. En general está muy bien, pero el precio un tanto elevado comparado con otros restaurantes japoneses de alta cocina. La comida es de gran calidad. El servicio es muy agradable. En general está muy bien, pero el precio un tanto elevado comparado con otros restaurantes japoneses de alta cocina.¬;¬27 marzo 2015¬;¬¬;¬¬;¬¬;¬¬;¬Japonesa, Sushi, Asiática, Menú para celíacos¬;¬Comidas, Cenas, Abierto hasta tarde¬;¬Reservas, Capacidad, Camareros, Sirve alcohol, Bar completo¬;¬Romántico, Ocasiones especiales, Reuniones de negocios¬;¬lunes 13:30 - 16:00 20:30 - 00:00 martes 13:30 - 16:00 20:30 - 00:00 miércoles 13:30 - 16:00 20:30 - 00:00 jueves 13:30 - 16:00 20:30 - 00:00 viernes 13:30 - 16:00 20:30 - 00:00 sábado 13:30 - 16:00 20:30 - 00:00¬;¬Dirección: Paseo de La Castellana, 45, 28046 Madrid, España Ubicación: Europa  >  España  >  Comunidad de Madrid  >  Madrid>  > Chamberí Barrio: Chamberí Número de teléfono: +34 913 91 00 26¬;¬Dirección: Paseo de La Castellana, 45, 28046 Madrid, España Ubicación: Europa  >  España  >  Comunidad de Madrid  >  Madrid>  > Chamberí Barrio: Chamberí Número de teléfono: +34 913 91 00 26¬
¬Restaurante¬;¬Miyama Castellana¬;¬Cristina X¬;¬Madrid, España¬;¬6¬;¬66¬;¬28¬;¬Cristina XRe_La¬;¬3¬;¬Res.japones¬;¬La comida es excelente, pero respecto al precio el servicio no fue de su agrado. Recuerdo q tenéis q hacer reserva antes de ir. Precio :50-70/persona La comida es excelente, pero respecto al precio el servicio no fue de su agrado. Recuerdo q tenéis q hacer reserva antes de ir. Precio :50-70/persona¬;¬24 marzo 2015¬;¬¬;¬¬;¬¬;¬¬;¬Japonesa, Sushi, Asiática, Menú para celíacos¬;¬Comidas, Cenas, Abierto hasta tarde¬;¬Reservas, Capacidad, Camareros, Sirve alcohol, Bar completo¬;¬Romántico, Ocasiones especiales, Reuniones de negocios¬;¬lunes 13:30 - 16:00 20:30 - 00:00 martes 13:30 - 16:00 20:30 - 00:00 miércoles 13:30 - 16:00 20:30 - 00:00 jueves 13:30 - 16:00 20:30 - 00:00 viernes 13:30 - 16:00 20:30 - 00:00 sábado 13:30 - 16:00 20:30 - 00:00¬;¬Dirección: Paseo de La Castellana, 45, 28046 Madrid, España Ubicación: Europa  >  España  >  Comunidad de Madrid  >  Madrid>  > Chamberí Barrio: Chamberí Número de teléfono: +34 913 91 00 26¬;¬Dirección: Paseo de La Castellana, 45, 28046 Madrid, España Ubicación: Europa  >  España  >  Comunidad de Madrid  >  Madrid>  > Chamberí Barrio: Chamberí Número de teléfono: +34 913 91 00 26¬
¬Restaurante¬;¬Miyama Castellana¬;¬David R¬;¬Palma de Mallorca, España¬;¬6¬;¬115¬;¬49¬;¬David RCo_Me¬;¬3¬;¬Comida japonesa sin más¬;¬Me habían recomendado mucho este restaurante. Quizá por eso esperaba más. La comida estaba buena y de muy buena calidad, pero no hubo ningún plato que me sorprendiera excesivamente. El trato muy bueno. Me pareció un poco caro para lo que nos ofrecieron. Me habían recomendado mucho este restaurante. Quizá por eso esperaba más. La comida estaba buena y de muy buena calidad, pero no hubo ningún plato que me sorprendiera excesivamente. El trato muy bueno. Me pareció un poco caro para lo que nos ofrecieron.¬;¬7 marzo 2015¬;¬¬;¬¬;¬¬;¬¬;¬Japonesa, Sushi, Asiática, Menú para celíacos¬;¬Comidas, Cenas, Abierto hasta tarde¬;¬Reservas, Capacidad, Camareros, Sirve alcohol, Bar completo¬;¬Romántico, Ocasiones especiales, Reuniones de negocios¬;¬lunes 13:30 - 16:00 20:30 - 00:00 martes 13:30 - 16:00 20:30 - 00:00 miércoles 13:30 - 16:00 20:30 - 00:00 jueves 13:30 - 16:00 20:30 - 00:00 viernes 13:30 - 16:00 20:30 - 00:00 sábado 13:30 - 16:00 20:30 - 00:00¬;¬Dirección: Paseo de La Castellana, 45, 28046 Madrid, España Ubicación: Europa  >  España  >  Comunidad de Madrid  >  Madrid>  > Chamberí Barrio: Chamberí Número de teléfono: +34 913 91 00 26¬;¬Dirección: Paseo de La Castellana, 45, 28046 Madrid, España Ubicación: Europa  >  España  >  Comunidad de Madrid  >  Madrid>  > Chamberí Barrio: Chamberí Número de teléfono: +34 913 91 00 26¬
