Tipo,NombreRestaurante_,NombreUsuario_,LocalizaciónUsario_,NivelUsuario_,OpinionesTotalesUsuario_,VotosUtiles_,IDComentario_,ValoracionComentario_,TituloComentario_,Comentario_,FechaCometario_,FechaVisitaRestaurante_,ValoracionesComentario_,ResumenPuntuacionesRestaurante_,PrecioMedio_,TipoCocina_,Comida_,CaracteristicasDelResaurante_,AconsejablePara_,Horarios_,DireccionCompletaRestaurante_,Descripcion_
¬Restaurante¬;¬Tandoori Station¬;¬jaumeabellana¬;¬Puigverd d'Agramunt¬;¬6¬;¬102¬;¬69¬;¬jaumeabellanaDe_Hoy¬;¬1¬;¬Decepción total¬;¬Hoy 31 de Mayo de 2014 tras ver en un programa a Chicote decir que era el mejor indú de Madrid nos hemos decidido a ir a comer al Tandoori Station y uff ¡qué decepción! Por partes: -Si no eligen todos los de la mesa el menú degustación no puedes cogerlo. -Cantidad súper deficiente; han sido 3 platitos de nada... Más  Hoy 31 de Mayo de 2014 tras ver en un programa a Chicote decir que era el mejor indú de Madrid nos hemos decidido a ir a comer al Tandoori Station y uff ¡qué decepción! Por partes: -Si no eligen todos los de la mesa el menú degustación no puedes cogerlo. -Cantidad súper deficiente; han sido 3 platitos de nada SIN PAN y en el postre me ha entrado la risa. Sólo decíros que he tenido que comprarme un helado ha media tarde ya que me estaba muriendo de hambre, a, después de pagar 35 eurotes. -Servicio deficiente. Una chica argentina antipatica. Un indio joven que iva sucio y el dueño que ni presentaba los platos.. -Después de todo esto el precio lo he encontrado desorbitado y yo no voy a ir nunca más. Mirád chicos id a otro sitio no perdaís el tiempo y dinero en este sitio.¬;¬31 mayo 2014¬;¬¬;¬¬;¬¬;¬28 € - 36 €¬;¬India, Asiática, Menú para celíacos¬;¬Comidas, Cenas, Abierto hasta tarde¬;¬Para llevar, Reservas, Terraza exterior, Capacidad, Camareros, Acceso para discapacitados, Sirve alcohol¬;¬Romántico, Grupos grandes, Ocasiones especiales, Reuniones de negocios, Familias con niños¬;¬domingo 13:00 - 16:00 martes 13:00 - 16:00 20:30 - 00:00 miércoles 13:00 - 16:00 20:30 - 00:00 jueves 13:00 - 16:00 20:30 - 00:00 viernes 13:00 - 16:00 20:30 - 00:00 sábado 13:00 - 16:00 20:30 - 00:00¬;¬Dirección: Calle Jose Ortega y Gasset 89, 28006 Madrid, España Ubicación: Europa  >  España  >  Comunidad de Madrid  >  Madrid>  > Barrio de Salamanca Barrio: Barrio de Salamanca Número de teléfono: +34 914 01 22 28¬;¬Dirección: Calle Jose Ortega y Gasset 89, 28006 Madrid, España Ubicación: Europa  >  España  >  Comunidad de Madrid  >  Madrid>  > Barrio de Salamanca Barrio: Barrio de Salamanca Número de teléfono: +34 914 01 22 28¬
¬Restaurante¬;¬Tandoori Station¬;¬Christianpieeper¬;¬¬;¬0¬;¬2¬;¬13¬;¬ChristianpieeperUn_Hay¬;¬1¬;¬Un robo!!¬;¬Hay mejores restaurantes de comida india en madrid a precio low cost, que pagar ese robo y la comida tampoco esta tan buena! He ido a muchos restaurantes de comida india y la comida de este sitio no es tan buena, ademas el precio me parece un robo! En general no vayáis. Hay mejores restaurantes de comida india en madrid a precio low cost, que pagar ese robo y la comida tampoco esta tan buena! He ido a muchos restaurantes de comida india y la comida de este sitio no es tan buena, ademas el precio me parece un robo! En general no vayáis.¬;¬3 mayo 2014¬;¬Visitado el mayo de 2014¬;¬Relación calidad-precio 1;Ambiente 1;Servicio 1;Comida 1¬;¬¬;¬28 € - 36 €¬;¬India, Asiática, Menú para celíacos¬;¬Comidas, Cenas, Abierto hasta tarde¬;¬Para llevar, Reservas, Terraza exterior, Capacidad, Camareros, Acceso para discapacitados, Sirve alcohol¬;¬Romántico, Grupos grandes, Ocasiones especiales, Reuniones de negocios, Familias con niños¬;¬domingo 13:00 - 16:00 martes 13:00 - 16:00 20:30 - 00:00 miércoles 13:00 - 16:00 20:30 - 00:00 jueves 13:00 - 16:00 20:30 - 00:00 viernes 13:00 - 16:00 20:30 - 00:00 sábado 13:00 - 16:00 20:30 - 00:00¬;¬Dirección: Calle Jose Ortega y Gasset 89, 28006 Madrid, España Ubicación: Europa  >  España  >  Comunidad de Madrid  >  Madrid>  > Barrio de Salamanca Barrio: Barrio de Salamanca Número de teléfono: +34 914 01 22 28¬;¬Dirección: Calle Jose Ortega y Gasset 89, 28006 Madrid, España Ubicación: Europa  >  España  >  Comunidad de Madrid  >  Madrid>  > Barrio de Salamanca Barrio: Barrio de Salamanca Número de teléfono: +34 914 01 22 28¬
¬Restaurante¬;¬Tandoori Station¬;¬MirwaniMOTI¬;¬Las Palmas de Gran Canaria, España¬;¬2¬;¬8¬;¬19¬;¬MirwaniMOTILa_Pas¬;¬1¬;¬Larga lista espera pero servico mal¬;¬Pase por este restaurante hindu por buenos opinons en trip adviser, 4 dias lista de espera despues de explicar q no soy de madriid estoy de vacaciones aqui no puedo esperar mas dias. Fuemos viernes 1nov..los camereros no llegavan dar comida a mesa donde han pedido. Comida no fue tan mala, pero hay otros hindu in madrid con mejor comida... Más  Pase por este restaurante hindu por buenos opinons en trip adviser, 4 dias lista de espera despues de explicar q no soy de madriid estoy de vacaciones aqui no puedo esperar mas dias. Fuemos viernes 1nov..los camereros no llegavan dar comida a mesa donde han pedido. Comida no fue tan mala, pero hay otros hindu in madrid con mejor comida y mucho mas barata Los se que esta en corzon de madrid..por eso la comida es tan cara, pero seimpre hay q mantaner calidad de comida Yo no volver aqui de nuevo.¬;¬5 noviembre 2013¬;¬Visitado el noviembre de 2013¬;¬Relación calidad-precio 1;Ambiente 3;Servicio 1;Comida 3¬;¬¬;¬28 € - 36 €¬;¬India, Asiática, Menú para celíacos¬;¬Comidas, Cenas, Abierto hasta tarde¬;¬Para llevar, Reservas, Terraza exterior, Capacidad, Camareros, Acceso para discapacitados, Sirve alcohol¬;¬Romántico, Grupos grandes, Ocasiones especiales, Reuniones de negocios, Familias con niños¬;¬domingo 13:00 - 16:00 martes 13:00 - 16:00 20:30 - 00:00 miércoles 13:00 - 16:00 20:30 - 00:00 jueves 13:00 - 16:00 20:30 - 00:00 viernes 13:00 - 16:00 20:30 - 00:00 sábado 13:00 - 16:00 20:30 - 00:00¬;¬Dirección: Calle Jose Ortega y Gasset 89, 28006 Madrid, España Ubicación: Europa  >  España  >  Comunidad de Madrid  >  Madrid>  > Barrio de Salamanca Barrio: Barrio de Salamanca Número de teléfono: +34 914 01 22 28¬;¬Dirección: Calle Jose Ortega y Gasset 89, 28006 Madrid, España Ubicación: Europa  >  España  >  Comunidad de Madrid  >  Madrid>  > Barrio de Salamanca Barrio: Barrio de Salamanca Número de teléfono: +34 914 01 22 28¬
¬Restaurante¬;¬Tandoori Station¬;¬Tatiana S¬;¬Madrid, España¬;¬0¬;¬2¬;¬11¬;¬Tatiana SNa_La¬;¬1¬;¬Nada del otro mundo¬;¬La verdad es que no me ha gustado nada....no sentias ningun ambiente indio...parecia que estabas en una fabrica de metal...y la comida...bueno el habre te quitaba pero sin ningun disfrute. La verdad es que no me ha gustado nada....no sentias ningun ambiente indio...parecia que estabas en una fabrica de metal...y la comida...bueno el habre te quitaba pero sin ningun disfrute.¬;¬15 agosto 2013¬;¬Visitado el agosto de 2013¬;¬Relación calidad-precio 1;Ambiente 1;Servicio 3;Comida 2¬;¬¬;¬28 € - 36 €¬;¬India, Asiática, Menú para celíacos¬;¬Comidas, Cenas, Abierto hasta tarde¬;¬Para llevar, Reservas, Terraza exterior, Capacidad, Camareros, Acceso para discapacitados, Sirve alcohol¬;¬Romántico, Grupos grandes, Ocasiones especiales, Reuniones de negocios, Familias con niños¬;¬domingo 13:00 - 16:00 martes 13:00 - 16:00 20:30 - 00:00 miércoles 13:00 - 16:00 20:30 - 00:00 jueves 13:00 - 16:00 20:30 - 00:00 viernes 13:00 - 16:00 20:30 - 00:00 sábado 13:00 - 16:00 20:30 - 00:00¬;¬Dirección: Calle Jose Ortega y Gasset 89, 28006 Madrid, España Ubicación: Europa  >  España  >  Comunidad de Madrid  >  Madrid>  > Barrio de Salamanca Barrio: Barrio de Salamanca Número de teléfono: +34 914 01 22 28¬;¬Dirección: Calle Jose Ortega y Gasset 89, 28006 Madrid, España Ubicación: Europa  >  España  >  Comunidad de Madrid  >  Madrid>  > Barrio de Salamanca Barrio: Barrio de Salamanca Número de teléfono: +34 914 01 22 28¬
¬Restaurante¬;¬Tandoori Station¬;¬Juanjo M¬;¬Madrid, España¬;¬0¬;¬1¬;¬22¬;¬Juanjo MSe_Lo¬;¬1¬;¬Se les ha subido a la cabeza¬;¬Lo conocía de ir a comer algún mediodía, menú y esas cosas. Intenté ir a cenar una noche, y fuí unas tres horas antes de que empezara el servicio a reservar. El problema no es que no haya sitio, y que tenga mucho éxito (se entiende y hasta es positivo).....se le explica al cliente, una sonrisa y todos felices. Para... Más  Lo conocía de ir a comer algún mediodía, menú y esas cosas. Intenté ir a cenar una noche, y fuí unas tres horas antes de que empezara el servicio a reservar. El problema no es que no haya sitio, y que tenga mucho éxito (se entiende y hasta es positivo).....se le explica al cliente, una sonrisa y todos felices. Para eso somos gente educada. Pero no; va la señorita, y cuando le pido a ver si puedo reservar, se carcajea en mi cara y me suelta ""Que iluso!, si ya tengo lleno hasta la semana que viene!"". Luego me señala las tarjetitas del restaurante, y me dice que la próxima vez coja una y les llame. En fin, que un poco de educación y un poco menos de soberbia, que el restaurante está bien pero que vive de los clientes.¬;¬11 junio 2013¬;¬¬;¬¬;¬¬;¬28 € - 36 €¬;¬India, Asiática, Menú para celíacos¬;¬Comidas, Cenas, Abierto hasta tarde¬;¬Para llevar, Reservas, Terraza exterior, Capacidad, Camareros, Acceso para discapacitados, Sirve alcohol¬;¬Romántico, Grupos grandes, Ocasiones especiales, Reuniones de negocios, Familias con niños¬;¬domingo 13:00 - 16:00 martes 13:00 - 16:00 20:30 - 00:00 miércoles 13:00 - 16:00 20:30 - 00:00 jueves 13:00 - 16:00 20:30 - 00:00 viernes 13:00 - 16:00 20:30 - 00:00 sábado 13:00 - 16:00 20:30 - 00:00¬;¬Dirección: Calle Jose Ortega y Gasset 89, 28006 Madrid, España Ubicación: Europa  >  España  >  Comunidad de Madrid  >  Madrid>  > Barrio de Salamanca Barrio: Barrio de Salamanca Número de teléfono: +34 914 01 22 28¬;¬Dirección: Calle Jose Ortega y Gasset 89, 28006 Madrid, España Ubicación: Europa  >  España  >  Comunidad de Madrid  >  Madrid>  > Barrio de Salamanca Barrio: Barrio de Salamanca Número de teléfono: +34 914 01 22 28¬
¬Restaurante¬;¬Tandoori Station¬;¬Jorge-Maria¬;¬Madrid, España¬;¬6¬;¬478¬;¬226¬;¬Jorge-MariaVo_Es¬;¬1¬;¬Vomitona segura¬;¬Es uno de los pocos restaurantes en que la comida me sentó mal, muy mal, no recuedo haber estado peor nunca. No lo recomiendo bajo ningún concepto. Es uno de los pocos restaurantes en que la comida me sentó mal, muy mal, no recuedo haber estado peor nunca. No lo recomiendo bajo ningún concepto.¬;¬5 enero 2012¬;¬¬;¬¬;¬¬;¬28 € - 36 €¬;¬India, Asiática, Menú para celíacos¬;¬Comidas, Cenas, Abierto hasta tarde¬;¬Para llevar, Reservas, Terraza exterior, Capacidad, Camareros, Acceso para discapacitados, Sirve alcohol¬;¬Romántico, Grupos grandes, Ocasiones especiales, Reuniones de negocios, Familias con niños¬;¬domingo 13:00 - 16:00 martes 13:00 - 16:00 20:30 - 00:00 miércoles 13:00 - 16:00 20:30 - 00:00 jueves 13:00 - 16:00 20:30 - 00:00 viernes 13:00 - 16:00 20:30 - 00:00 sábado 13:00 - 16:00 20:30 - 00:00¬;¬Dirección: Calle Jose Ortega y Gasset 89, 28006 Madrid, España Ubicación: Europa  >  España  >  Comunidad de Madrid  >  Madrid>  > Barrio de Salamanca Barrio: Barrio de Salamanca Número de teléfono: +34 914 01 22 28¬;¬Dirección: Calle Jose Ortega y Gasset 89, 28006 Madrid, España Ubicación: Europa  >  España  >  Comunidad de Madrid  >  Madrid>  > Barrio de Salamanca Barrio: Barrio de Salamanca Número de teléfono: +34 914 01 22 28¬
