Tipo,NombreRestaurante_,NombreUsuario_,LocalizaciónUsario_,NivelUsuario_,OpinionesTotalesUsuario_,VotosUtiles_,IDComentario_,ValoracionComentario_,TituloComentario_,Comentario_,FechaCometario_,FechaVisitaRestaurante_,ValoracionesComentario_,ResumenPuntuacionesRestaurante_,PrecioMedio_,TipoCocina_,Comida_,CaracteristicasDelResaurante_,AconsejablePara_,Horarios_,DireccionCompletaRestaurante_,Descripcion_
¬Restaurante¬;¬Restaurante Algarabía¬;¬Quico_12¬;¬Barcelona, España¬;¬2¬;¬6¬;¬3¬;¬Quico_12un_Hac¬;¬1¬;¬una mala experiencia¬;¬Hace tiempo que dudaba sobre enviar un comentario sobre nuestra cena allí, ya hace un par de años, para no perjudicar al establecimiento. Como veo que, para mi sorpresa, sigue apareciendo en el top de los restaurantes de Madrid, quiero dejar mi opinión negativa: Mal trato (brusco) de la propietaria que atiende las mesas, comida ""impuesta"" por insistencia de la... Más  Hace tiempo que dudaba sobre enviar un comentario sobre nuestra cena allí, ya hace un par de años, para no perjudicar al establecimiento. Como veo que, para mi sorpresa, sigue apareciendo en el top de los restaurantes de Madrid, quiero dejar mi opinión negativa: Mal trato (brusco) de la propietaria que atiende las mesas, comida ""impuesta"" por insistencia de la señora, platos mal cocinados, un único vino ""de la casa"" tambien impuesto. Me prometí no volver jamás, y sigo asombrado por el ranking en Tripadvisor.¬;¬22 agosto 2016¬;¬Visitado el septiembre de 2015¬;¬Relación calidad-precio 1;Servicio 2;Comida 2¬;¬¬;¬25 € - 30 €¬;¬Mediterránea, Española¬;¬Cenas¬;¬Bar completo, Reservas, Capacidad, Camareros, Sirve alcohol, Vino y cerveza, Acepta American Express, Acepta Mastercard, Acepta Visa¬;¬Romántico, Ocasiones especiales, Cocina local¬;¬lunes 21:30 - 23:30 martes 21:30 - 23:30 miércoles 21:30 - 23:30 jueves 21:30 - 23:30 viernes 21:30 - 23:30 sábado 21:30 - 23:30¬;¬Dirección: Calle de la Union 8, 28013 Madrid, España Ubicación: Europa  >  España  >  Comunidad de Madrid  >  Madrid>  > Centro Barrio: Centro Número de teléfono: +34 915424131¬;¬Pequeño y familiar restaurante de cocina tradicional (riojana)en el centro de Madrid¬
¬Restaurante¬;¬Restaurante Algarabía¬;¬rosch27¬;¬Puente Genil, España¬;¬5¬;¬31¬;¬1¬;¬rosch27Co_La¬;¬1¬;¬Comida buena, precios altos, sitio feo¬;¬La comida estaba muy buena. Las raciones pequeñas. Bastante caro: 6 croquetas, 6 espárragos, una cerveza y un vino tinto: 34 euros. El sitio muy pequeño, no parecía un restaurante, mesas llenas de libros, revistas o catálogos. Olía extraño.... La señora parecía padecer sinusitis y no paraba de hacer sonidos de absorción. La comida estaba muy buena. Las raciones pequeñas. Bastante caro: 6 croquetas, 6 espárragos, una cerveza y un vino tinto: 34 euros. El sitio muy pequeño, no parecía un restaurante, mesas llenas de libros, revistas o catálogos. Olía extraño.... La señora parecía padecer sinusitis y no paraba de hacer sonidos de absorción.¬;¬17 agosto 2016¬;¬¬;¬¬;¬¬;¬25 € - 30 €¬;¬Mediterránea, Española¬;¬Cenas¬;¬Bar completo, Reservas, Capacidad, Camareros, Sirve alcohol, Vino y cerveza, Acepta American Express, Acepta Mastercard, Acepta Visa¬;¬Romántico, Ocasiones especiales, Cocina local¬;¬lunes 21:30 - 23:30 martes 21:30 - 23:30 miércoles 21:30 - 23:30 jueves 21:30 - 23:30 viernes 21:30 - 23:30 sábado 21:30 - 23:30¬;¬Dirección: Calle de la Union 8, 28013 Madrid, España Ubicación: Europa  >  España  >  Comunidad de Madrid  >  Madrid>  > Centro Barrio: Centro Número de teléfono: +34 915424131¬;¬Pequeño y familiar restaurante de cocina tradicional (riojana)en el centro de Madrid¬
¬Restaurante¬;¬Restaurante Algarabía¬;¬David G¬;¬¬;¬4¬;¬26¬;¬7¬;¬David GDe_Atr¬;¬1¬;¬Decepcionante¬;¬Atraídos x la alta puntuación de TripAdvisor decidí reservar mesa para dos.Al llegar con mi mujer e hijo pequeño,la dueña no se mostró muy contenta de ver un niño del que no habíamos advertido.Al mantener la puerta abierta durante unos segundos para subir el carrito,me advirtió que el aire acondicionado se iba x la puerta.....Las dos primeras frases y el... Más  Atraídos x la alta puntuación de TripAdvisor decidí reservar mesa para dos.Al llegar con mi mujer e hijo pequeño,la dueña no se mostró muy contenta de ver un niño del que no habíamos advertido.Al mantener la puerta abierta durante unos segundos para subir el carrito,me advirtió que el aire acondicionado se iba x la puerta.....Las dos primeras frases y el recibimiento nos hicieron pensar en una cámara oculta. Aun sobrecogidos por tan cálida bienvenida,no fuimos conscientes de la ""original"" decoración hasta haber superado el shock inicial.Cosas enmarcadas sin ningún sentido y la sensación de estar en la sala de estar de cualquier abuela de pueblo(como las mías).De verdad que a veces pienso que algo no funciona bien en TripAdvisor. Cuando se busca un sitio especial para llevar a alguien,no puedes darte de bruces con algo tan diferente a lo descrito en las críticas. Mucho extranjero atraído por las buenas críticas de TripAdvisor y mucha cara de sorpresa entre los comensales al ver el extraño local. La comida standard;casera sí era,eso es cierto. Lamento tener que escribir tan negativamente,pero no se puede dar ese recibimiento a ningún cliente en ningún negocio.¬;¬6 agosto 2016¬;¬¬;¬¬;¬¬;¬25 € - 30 €¬;¬Mediterránea, Española¬;¬Cenas¬;¬Bar completo, Reservas, Capacidad, Camareros, Sirve alcohol, Vino y cerveza, Acepta American Express, Acepta Mastercard, Acepta Visa¬;¬Romántico, Ocasiones especiales, Cocina local¬;¬lunes 21:30 - 23:30 martes 21:30 - 23:30 miércoles 21:30 - 23:30 jueves 21:30 - 23:30 viernes 21:30 - 23:30 sábado 21:30 - 23:30¬;¬Dirección: Calle de la Union 8, 28013 Madrid, España Ubicación: Europa  >  España  >  Comunidad de Madrid  >  Madrid>  > Centro Barrio: Centro Número de teléfono: +34 915424131¬;¬Pequeño y familiar restaurante de cocina tradicional (riojana)en el centro de Madrid¬
¬Restaurante¬;¬Restaurante Algarabía¬;¬JJorgeA¬;¬Madrid, España¬;¬1¬;¬3¬;¬8¬;¬JJorgeASi_La¬;¬1¬;¬Si eres español no vayas¬;¬La camarera no sabe ingles y entonces no habla con los extranjeros por eso este restaurante tiene tan buena evaluacion. Todos son extranjeros. La camarera nos ha dejado frases para nuestro anecdotario: me trae una cuchara por favor? -No, que asi se enfria. Ya sabemos lo que queremos. - Pues no peden pedir porque tenian reserva a las 21:30 y... Más  La camarera no sabe ingles y entonces no habla con los extranjeros por eso este restaurante tiene tan buena evaluacion. Todos son extranjeros. La camarera nos ha dejado frases para nuestro anecdotario: me trae una cuchara por favor? -No, que asi se enfria. Ya sabemos lo que queremos. - Pues no peden pedir porque tenian reserva a las 21:30 y faltan 3 min. Queremos compartir 6 entrantes. -Buf mesa complicada. Esa tia (la camarera) debe estar mal de alguna parte de su cuerpo. En mi vida habia visto nada igual. He hecho el ridiculo llevando a mis amigos a cenar aqui. Que verguenza de tia¬;¬5 junio 2016¬;¬¬;¬¬;¬¬;¬25 € - 30 €¬;¬Mediterránea, Española¬;¬Cenas¬;¬Bar completo, Reservas, Capacidad, Camareros, Sirve alcohol, Vino y cerveza, Acepta American Express, Acepta Mastercard, Acepta Visa¬;¬Romántico, Ocasiones especiales, Cocina local¬;¬lunes 21:30 - 23:30 martes 21:30 - 23:30 miércoles 21:30 - 23:30 jueves 21:30 - 23:30 viernes 21:30 - 23:30 sábado 21:30 - 23:30¬;¬Dirección: Calle de la Union 8, 28013 Madrid, España Ubicación: Europa  >  España  >  Comunidad de Madrid  >  Madrid>  > Centro Barrio: Centro Número de teléfono: +34 915424131¬;¬Pequeño y familiar restaurante de cocina tradicional (riojana)en el centro de Madrid¬
¬Restaurante¬;¬Restaurante Algarabía¬;¬Luis S¬;¬¬;¬1¬;¬3¬;¬6¬;¬Luis Sca_el¬;¬1¬;¬calidad media a precio elevado¬;¬el lugar es acogedor ideal para ir con tu pareja hasta...que aparecen las hermanas ,dueñas del local y queriendo tener un trato amable...llega a ser pesado e incómodo,la comida,nada del otro mundo,vino de la casa normalito,y todo a precio de oro,no tienen ningún tipo de detalle,y son de mente clasistas. el lugar es acogedor ideal para ir con tu pareja hasta...que aparecen las hermanas ,dueñas del local y queriendo tener un trato amable...llega a ser pesado e incómodo,la comida,nada del otro mundo,vino de la casa normalito,y todo a precio de oro,no tienen ningún tipo de detalle,y son de mente clasistas.¬;¬6 enero 2015¬;¬Visitado el diciembre de 2014¬;¬Relación calidad-precio 1;Ambiente 3;Servicio 2;Comida 3¬;¬¬;¬25 € - 30 €¬;¬Mediterránea, Española¬;¬Cenas¬;¬Bar completo, Reservas, Capacidad, Camareros, Sirve alcohol, Vino y cerveza, Acepta American Express, Acepta Mastercard, Acepta Visa¬;¬Romántico, Ocasiones especiales, Cocina local¬;¬lunes 21:30 - 23:30 martes 21:30 - 23:30 miércoles 21:30 - 23:30 jueves 21:30 - 23:30 viernes 21:30 - 23:30 sábado 21:30 - 23:30¬;¬Dirección: Calle de la Union 8, 28013 Madrid, España Ubicación: Europa  >  España  >  Comunidad de Madrid  >  Madrid>  > Centro Barrio: Centro Número de teléfono: +34 915424131¬;¬Pequeño y familiar restaurante de cocina tradicional (riojana)en el centro de Madrid¬
¬Restaurante¬;¬Restaurante Algarabía¬;¬Maria N¬;¬¬;¬1¬;¬3¬;¬7¬;¬Maria NNo_est¬;¬1¬;¬No es un restaurante español.¬;¬estado en una causa de Algarabia TripAdvisor críticas y fue un completo desastre. Parece un antiguo casa privada que te hacen sentir muy cómodo. El servicio fue grosero y la comida era de baja calidad y muy caro. tipo de restaurante que intenta conseguir dinero de los turistas.¬;¬11 marzo 2015¬;¬¬;¬¬;¬¬;¬25 € - 30 €¬;¬Mediterránea, Española¬;¬Cenas¬;¬Bar completo, Reservas, Capacidad, Camareros, Sirve alcohol, Vino y cerveza, Acepta American Express, Acepta Mastercard, Acepta Visa¬;¬Romántico, Ocasiones especiales, Cocina local¬;¬lunes 21:30 - 23:30 martes 21:30 - 23:30 miércoles 21:30 - 23:30 jueves 21:30 - 23:30 viernes 21:30 - 23:30 sábado 21:30 - 23:30¬;¬Dirección: Calle de la Union 8, 28013 Madrid, España Ubicación: Europa  >  España  >  Comunidad de Madrid  >  Madrid>  > Centro Barrio: Centro Número de teléfono: +34 915424131¬;¬Pequeño y familiar restaurante de cocina tradicional (riojana)en el centro de Madrid¬
¬Restaurante¬;¬Restaurante Algarabía¬;¬Adalsys¬;¬Londres, Reino Unido¬;¬2¬;¬8¬;¬17¬;¬Adalsyscl_lee¬;¬1¬;¬clasificación Undeserved. Bien por debajo de la media¬;¬leer los comentarios de otros visitantes (que utilizamos como base para reservar el restaurante) nos esperaba un poco más. prácticamente todo el mundo en el restaurante era extranjero. No hay problema pero la falta de gente siempre que una primera indicación. La mesa nos sentamos estaba saltando. La respuesta del propietario fue: ""No puedes magro brazos sobre la mesa"". No... Más ¬;¬11 marzo 2015¬;¬¬;¬¬;¬¬;¬25 € - 30 €¬;¬Mediterránea, Española¬;¬Cenas¬;¬Bar completo, Reservas, Capacidad, Camareros, Sirve alcohol, Vino y cerveza, Acepta American Express, Acepta Mastercard, Acepta Visa¬;¬Romántico, Ocasiones especiales, Cocina local¬;¬lunes 21:30 - 23:30 martes 21:30 - 23:30 miércoles 21:30 - 23:30 jueves 21:30 - 23:30 viernes 21:30 - 23:30 sábado 21:30 - 23:30¬;¬Dirección: Calle de la Union 8, 28013 Madrid, España Ubicación: Europa  >  España  >  Comunidad de Madrid  >  Madrid>  > Centro Barrio: Centro Número de teléfono: +34 915424131¬;¬Pequeño y familiar restaurante de cocina tradicional (riojana)en el centro de Madrid¬
