Tipo,NombreRestaurante_,NombreUsuario_,LocalizaciónUsario_,NivelUsuario_,OpinionesTotalesUsuario_,VotosUtiles_,IDComentario_,ValoracionComentario_,TituloComentario_,Comentario_,FechaCometario_,FechaVisitaRestaurante_,ValoracionesComentario_,ResumenPuntuacionesRestaurante_,PrecioMedio_,TipoCocina_,Comida_,CaracteristicasDelResaurante_,AconsejablePara_,Horarios_,DireccionCompletaRestaurante_,Descripcion_
¬Restaurante¬;¬DSTAGE¬;¬Virginia V¬;¬Madrid, España¬;¬1¬;¬3¬;¬5¬;¬Virginia VEx_El¬;¬4¬;¬Experiencia especial¬;¬El entorno es una maravilla y te reciben muy cordialmente. Tomas un aperitivo en el bar, luego pasas a la cocina y finalmente a la mesa. Todos los platos son especiales y se nota que llevan mucho trabajo detrás. Se disfruta mucho si te gusta este tipo de restaurantes. Solo diria dos peros...algunos camareros llevaban los trajes un poco sucios... Más  El entorno es una maravilla y te reciben muy cordialmente. Tomas un aperitivo en el bar, luego pasas a la cocina y finalmente a la mesa. Todos los platos son especiales y se nota que llevan mucho trabajo detrás. Se disfruta mucho si te gusta este tipo de restaurantes. Solo diria dos peros...algunos camareros llevaban los trajes un poco sucios y eran excesivamente simpaticos, hasta resultar un poco molestos. Tambien es el tipo de cocina que requiere que estén todo el rato pendiente del comensal. En general es recomendable...eso si, se paga.¬;¬9 abril 2015¬;¬Visitado el marzo de 2015¬;¬Relación calidad-precio 3;Servicio 4;Comida 5¬;¬¬;¬¬;¬Internacional, Mediterránea, Europea, Española, Contemporánea¬;¬Comidas, Cenas, Abierto hasta tarde¬;¬Reservas, Capacidad, Camareros, Acceso para discapacitados, Sirve alcohol, Bar completo¬;¬Romántico, Reuniones de negocios, Ocasiones especiales¬;¬lunes 13:30 - 15:00 21:00 - 23:00 martes 13:30 - 15:00 21:00 - 23:00 miércoles 13:30 - 15:00 21:00 - 23:00 jueves 13:30 - 15:00 21:00 - 23:00 viernes 13:30 - 15:00 21:00 - 23:00¬;¬Dirección: C/ Regueros,8, 28004 Madrid, España Ubicación: Europa  >  España  >  Comunidad de Madrid  >  Madrid>  > Chueca Barrio: Chueca Número de teléfono: 917021586¬;¬Dirección: C/ Regueros,8, 28004 Madrid, España Ubicación: Europa  >  España  >  Comunidad de Madrid  >  Madrid>  > Chueca Barrio: Chueca Número de teléfono: 917021586¬
¬Restaurante¬;¬DSTAGE¬;¬Alfredtraveller¬;¬Barcelona, España¬;¬6¬;¬174¬;¬109¬;¬AlfredtravellerIm_La¬;¬4¬;¬Imprescindible experiencia¬;¬La idea de los varios espacios por los que circula el comensal hasta la mesa final es agradable y permite interactuar con varios de los profesionales de la casa. El espacio global quizas esta un poco desequilibrado segun las mesas ya que no es amplio, por lo que unas poseen una ubicacion mejor que otras respecto a la vision de... Más  La idea de los varios espacios por los que circula el comensal hasta la mesa final es agradable y permite interactuar con varios de los profesionales de la casa. El espacio global quizas esta un poco desequilibrado segun las mesas ya que no es amplio, por lo que unas poseen una ubicacion mejor que otras respecto a la vision de la cocina. Las propuestas de Diego son de gran factura con excelente materia prima, ejecuciones no faltas de sorpresa pero con sabores netos y reconocibles. La carta de vinos sin ser extensa presenta adecuadas alternativas. En definitiva una experiencia que vale la pena y que estoy seguro que en este emplazamiento ira a mucho mas. Quedamos a la espera.¬;¬6 abril 2015¬;¬Visitado el febrero de 2015¬;¬Relación calidad-precio 3;Servicio 4;Comida 4¬;¬¬;¬¬;¬Internacional, Mediterránea, Europea, Española, Contemporánea¬;¬Comidas, Cenas, Abierto hasta tarde¬;¬Reservas, Capacidad, Camareros, Acceso para discapacitados, Sirve alcohol, Bar completo¬;¬Romántico, Reuniones de negocios, Ocasiones especiales¬;¬lunes 13:30 - 15:00 21:00 - 23:00 martes 13:30 - 15:00 21:00 - 23:00 miércoles 13:30 - 15:00 21:00 - 23:00 jueves 13:30 - 15:00 21:00 - 23:00 viernes 13:30 - 15:00 21:00 - 23:00¬;¬Dirección: C/ Regueros,8, 28004 Madrid, España Ubicación: Europa  >  España  >  Comunidad de Madrid  >  Madrid>  > Chueca Barrio: Chueca Número de teléfono: 917021586¬;¬Dirección: C/ Regueros,8, 28004 Madrid, España Ubicación: Europa  >  España  >  Comunidad de Madrid  >  Madrid>  > Chueca Barrio: Chueca Número de teléfono: 917021586¬
¬Restaurante¬;¬DSTAGE¬;¬Lesamp¬;¬Madrid, España¬;¬5¬;¬33¬;¬27¬;¬LesampPa_Pre¬;¬4¬;¬Para ir, si o si¬;¬Precio menú corto 88€ por 11 platos; y todos y cada uno de ellos excelentes. Lo que es verdad, y lo siento porque las comparaciones son odiosas, es que ciertos platos/preparaciones recuerdan a las que hacía en el Club Allard, pero lo veo normal dado que (no le voy a descubrir nada a nadie) el chef es el mismo. La... Más  Precio menú corto 88€ por 11 platos; y todos y cada uno de ellos excelentes. Lo que es verdad, y lo siento porque las comparaciones son odiosas, es que ciertos platos/preparaciones recuerdan a las que hacía en el Club Allard, pero lo veo normal dado que (no le voy a descubrir nada a nadie) el chef es el mismo. La comida fue toda una experiencia de principio a fin; eso sí, ojo a la hora del aperitivo porque la caña y la coca cola están a precio de sangre de unicornio, 6€. Una vez advertidos, no dejen de ir y reserven con tiempo. Para ver la descripción completa de los platos: lesamp.tumblr.com/post/114143560690/dstage¬;¬20 marzo 2015¬;¬Visitado el noviembre de 2014¬;¬Relación calidad-precio 3;Ambiente 4;Servicio 5;Comida 4¬;¬¬;¬¬;¬Internacional, Mediterránea, Europea, Española, Contemporánea¬;¬Comidas, Cenas, Abierto hasta tarde¬;¬Reservas, Capacidad, Camareros, Acceso para discapacitados, Sirve alcohol, Bar completo¬;¬Romántico, Reuniones de negocios, Ocasiones especiales¬;¬lunes 13:30 - 15:00 21:00 - 23:00 martes 13:30 - 15:00 21:00 - 23:00 miércoles 13:30 - 15:00 21:00 - 23:00 jueves 13:30 - 15:00 21:00 - 23:00 viernes 13:30 - 15:00 21:00 - 23:00¬;¬Dirección: C/ Regueros,8, 28004 Madrid, España Ubicación: Europa  >  España  >  Comunidad de Madrid  >  Madrid>  > Chueca Barrio: Chueca Número de teléfono: 917021586¬;¬Dirección: C/ Regueros,8, 28004 Madrid, España Ubicación: Europa  >  España  >  Comunidad de Madrid  >  Madrid>  > Chueca Barrio: Chueca Número de teléfono: 917021586¬
¬Restaurante¬;¬DSTAGE¬;¬ace51¬;¬Cáceres, España¬;¬6¬;¬62¬;¬16¬;¬ace51Un_El¬;¬4¬;¬Una experiencia diferente¬;¬El tipo de local nada mas entrar ya te traslada a Tribeca en Nueva York; el concepto de servicio es diferente, entrada en el bar, otra en la barra alta donde detrás están cocinando , incluido Diego Guerrero, al que te alegras de ver, por cierto muy agradable, y luego ya pasas a la mesa, de tipo informal, sin mantel... Más  El tipo de local nada mas entrar ya te traslada a Tribeca en Nueva York; el concepto de servicio es diferente, entrada en el bar, otra en la barra alta donde detrás están cocinando , incluido Diego Guerrero, al que te alegras de ver, por cierto muy agradable, y luego ya pasas a la mesa, de tipo informal, sin mantel y vajillas rústicas. los platos son muy divertidos algunos fantásticos de sabor, otros menos pero todos sorprendentes ; pasas un rato muy agradable y divertido. los riquísimos para mi fueron los raviolis de alubias, y unas verduritas con una cremita con trufa que te preparaban en la mesa, solo ver el mimo con que lo preparaban era un placer.¬;¬1 marzo 2015¬;¬Visitado el febrero de 2015¬;¬Relación calidad-precio 4;Ambiente 4;Servicio 4;Comida 4¬;¬¬;¬¬;¬Internacional, Mediterránea, Europea, Española, Contemporánea¬;¬Comidas, Cenas, Abierto hasta tarde¬;¬Reservas, Capacidad, Camareros, Acceso para discapacitados, Sirve alcohol, Bar completo¬;¬Romántico, Reuniones de negocios, Ocasiones especiales¬;¬lunes 13:30 - 15:00 21:00 - 23:00 martes 13:30 - 15:00 21:00 - 23:00 miércoles 13:30 - 15:00 21:00 - 23:00 jueves 13:30 - 15:00 21:00 - 23:00 viernes 13:30 - 15:00 21:00 - 23:00¬;¬Dirección: C/ Regueros,8, 28004 Madrid, España Ubicación: Europa  >  España  >  Comunidad de Madrid  >  Madrid>  > Chueca Barrio: Chueca Número de teléfono: 917021586¬;¬Dirección: C/ Regueros,8, 28004 Madrid, España Ubicación: Europa  >  España  >  Comunidad de Madrid  >  Madrid>  > Chueca Barrio: Chueca Número de teléfono: 917021586¬
¬Restaurante¬;¬DSTAGE¬;¬Patricio A¬;¬¬;¬3¬;¬10¬;¬1¬;¬Patricio ACa_Exp¬;¬4¬;¬Casi 5 estrellas¬;¬Explosión de sabores plato tras plato. Lo mejor un aperitivo de ceviche de carabinero. Lo mas flojo el postre. La amabilidad y afabilidad de los camareros es destacable. Explosión de sabores plato tras plato. Lo mejor un aperitivo de ceviche de carabinero. Lo mas flojo el postre. La amabilidad y afabilidad de los camareros es destacable.¬;¬7 febrero 2015¬;¬¬;¬¬;¬¬;¬¬;¬Internacional, Mediterránea, Europea, Española, Contemporánea¬;¬Comidas, Cenas, Abierto hasta tarde¬;¬Reservas, Capacidad, Camareros, Acceso para discapacitados, Sirve alcohol, Bar completo¬;¬Romántico, Reuniones de negocios, Ocasiones especiales¬;¬lunes 13:30 - 15:00 21:00 - 23:00 martes 13:30 - 15:00 21:00 - 23:00 miércoles 13:30 - 15:00 21:00 - 23:00 jueves 13:30 - 15:00 21:00 - 23:00 viernes 13:30 - 15:00 21:00 - 23:00¬;¬Dirección: C/ Regueros,8, 28004 Madrid, España Ubicación: Europa  >  España  >  Comunidad de Madrid  >  Madrid>  > Chueca Barrio: Chueca Número de teléfono: 917021586¬;¬Dirección: C/ Regueros,8, 28004 Madrid, España Ubicación: Europa  >  España  >  Comunidad de Madrid  >  Madrid>  > Chueca Barrio: Chueca Número de teléfono: 917021586¬
¬Restaurante¬;¬DSTAGE¬;¬antoniotunon¬;¬Jaén, España¬;¬4¬;¬24¬;¬11¬;¬antoniotunonMa_Una¬;¬4¬;¬Magnifico día¬;¬Una elección muy recomendable Atención, Comida, Ubicación, Coste, Elaboración.....Todo digno de las mejores elaboraciones Una elección muy recomendable Atención, Comida, Ubicación, Coste, Elaboración.....Todo digno de las mejores elaboraciones¬;¬7 enero 2015¬;¬Visitado el diciembre de 2014¬;¬Relación calidad-precio 4;Ambiente 4;Servicio 4;Comida 4¬;¬¬;¬¬;¬Internacional, Mediterránea, Europea, Española, Contemporánea¬;¬Comidas, Cenas, Abierto hasta tarde¬;¬Reservas, Capacidad, Camareros, Acceso para discapacitados, Sirve alcohol, Bar completo¬;¬Romántico, Reuniones de negocios, Ocasiones especiales¬;¬lunes 13:30 - 15:00 21:00 - 23:00 martes 13:30 - 15:00 21:00 - 23:00 miércoles 13:30 - 15:00 21:00 - 23:00 jueves 13:30 - 15:00 21:00 - 23:00 viernes 13:30 - 15:00 21:00 - 23:00¬;¬Dirección: C/ Regueros,8, 28004 Madrid, España Ubicación: Europa  >  España  >  Comunidad de Madrid  >  Madrid>  > Chueca Barrio: Chueca Número de teléfono: 917021586¬;¬Dirección: C/ Regueros,8, 28004 Madrid, España Ubicación: Europa  >  España  >  Comunidad de Madrid  >  Madrid>  > Chueca Barrio: Chueca Número de teléfono: 917021586¬
¬Restaurante¬;¬DSTAGE¬;¬mmcolino¬;¬Madrid¬;¬6¬;¬98¬;¬64¬;¬mmcolinoCa_Lle¬;¬4¬;¬Cambio de cultura, cambio de concepto.¬;¬Llevo tres días dándole vuelta a la única neurona que me queda para ver que podía aportar a la comunidad de tripadvisor respecto a DSTAGE. Ahí va: Creo que lo más importante que percibí es que el ambiente es relajado, distendido, que si les das pie cómo hice yo, pues puedes hablar con ellos y puedes aprender cosas. Dan la... Más  Llevo tres días dándole vuelta a la única neurona que me queda para ver que podía aportar a la comunidad de tripadvisor respecto a DSTAGE. Ahí va: Creo que lo más importante que percibí es que el ambiente es relajado, distendido, que si les das pie cómo hice yo, pues puedes hablar con ellos y puedes aprender cosas. Dan la oportunidad en la cocina de ver la preparación de un plato, de hablar con el cocinero/a, lo cual yo agradezco. Aprendí que es un Finger Lime (Citrus australasica o lima dedo), pude tocar este fruto, romperlo y comer las bolitas que soltaba (sabían a lima, suave, muy rica y fresca), aprendí también que es una ajo negro y lo probé como ingrediente en el postre que nos sirvieron y luego el propio ajo (nos lo trajo la persona que nos atendió) y nos explicó cómo se elabora. Yo creo que Diego pretende cambiar el concepto de alta cocina y acercarlo de una manera más natural al público, (a lo mejor estoy equivocado) pero yo lo percibo en multitud de detalles: el local, es diferente, muy moderno pero a la vez acogedor, la iluminación (tenue), el bar (pequeño, entrañable), las mesas sin mantelería, el hilo musical (la listas de canciones las eligen ellos y son muy buenas, jazz, soul) incluso el volumen, que está algo elevado pero puedes hablar sin gritar (perfecto), la cocina (abierta al público) y sobre todo el hecho de que puedes preguntar y te responden, te enseñan cómo se hace, qué lleva. Diego Guerrero terminó de montar un plato delante de nosotros, nos explico todos los ingredientes y vimos cómo lo hizo, a mí eso me parece más que interesante. Por cierto este fue uno de los platos que más me gustó (Del verano al otoño, ¿o era al invierno?, no lo recuerdo bien, pido disculpas). Dos variedades de setas (rebozuelo, trompeta de los muertos), tupinambo, apio-nabo, yema de huevo, trufa negra, aceite de vainilla, brotes de pino, hojas de regaliz azteca, cebolleta, pulpo de tierra (berza gallega autóctona –interesantísima la historia que hay detrás de este ingrediente por cierto-), en fin, creo que creatividad no faltaba, el plato te transportaba al bosque: recuerdos de humedad, frescura del aire después de la lluvia, olor a pino, a madera ahumada, … Excelente !!!!!. En cuanto a la comida en general, puedo estar de acuerdo con alguna opinión en cuanto a que parece un menú inconexo, a mi no me sorprendió mucho (cada vez es más difícil, también hay que ser justos), los sabores que probé eran muy sutiles, y en algunos platos, los ingredientes principales eran barridos por secundarios, cebiche de carabinero (se lo llevaba por medio la cebolla frita), o al salmonete en salmuera (sabía más a azafrán que a pescado), aunque lo de las escamas crujientes era un puntazo, lo reconozco. En resumen, creo que Diego es muy, pero que muy creativo y el concepto que quiere transmitir me parece una muy buena idea, supongo que será una cuestión de tiempo y que a medida que vaya sacando nuevos platos irá mejorando aún más. No me importaría volver a ir más adelante. Por último, mi apunte como siempre, sobre el precio, las bebidas (cocktail, spirituosos) algo caras, el precio del vino también, por encima del 100%, esto es lo que peor llevamos los clientes que nos gusta el buen beber. Sin embargo el menú no me pareció elevado, está en su precio para ser un restaurante con estrella. El servicio muy amable y cercano, EXCELENTE, de 10. Bueno, espero haber aportado algo positivo a los futuros clientes, creo que merece la pena ir y vivir la experiencia dStage, sobre todo para aquellas personas que se quieran acercar por primera vez a la alta cocina y que les da un poco de reparo por si creen que pueden desentonar en un sitio demasiado ""ELEGANTE"", creo que en dStage van a estar relajadas y a comer tranquilas sin tensiones, como en casa.¬;¬25 diciembre 2014¬;¬Visitado el diciembre de 2014¬;¬Relación calidad-precio 3;Ambiente 5;Servicio 5;Comida 4¬;¬¬;¬¬;¬Internacional, Mediterránea, Europea, Española, Contemporánea¬;¬Comidas, Cenas, Abierto hasta tarde¬;¬Reservas, Capacidad, Camareros, Acceso para discapacitados, Sirve alcohol, Bar completo¬;¬Romántico, Reuniones de negocios, Ocasiones especiales¬;¬lunes 13:30 - 15:00 21:00 - 23:00 martes 13:30 - 15:00 21:00 - 23:00 miércoles 13:30 - 15:00 21:00 - 23:00 jueves 13:30 - 15:00 21:00 - 23:00 viernes 13:30 - 15:00 21:00 - 23:00¬;¬Dirección: C/ Regueros,8, 28004 Madrid, España Ubicación: Europa  >  España  >  Comunidad de Madrid  >  Madrid>  > Chueca Barrio: Chueca Número de teléfono: 917021586¬;¬Dirección: C/ Regueros,8, 28004 Madrid, España Ubicación: Europa  >  España  >  Comunidad de Madrid  >  Madrid>  > Chueca Barrio: Chueca Número de teléfono: 917021586¬
¬Restaurante¬;¬DSTAGE¬;¬Chucote¬;¬¬;¬0¬;¬2¬;¬0¬;¬ChucoteAp_Est¬;¬4¬;¬Apuesta arriesgada¬;¬Este restaurante reúne muchos de los aspectos que busco cuando salgo a comer: buena decoración, espacioso, buen trato del personal desde que entras, propuesta atrevida y diferente y, lo más importante, buena cocina. Si tuviera que poner un ""pero"", haría referencia a la relación calidad-precio, en mi opinión, desproporcionada con respecto a lo recibido. Mucha suerte y muchos éxitos! Este restaurante reúne muchos de los aspectos que busco cuando salgo a comer: buena decoración, espacioso, buen trato del personal desde que entras, propuesta atrevida y diferente y, lo más importante, buena cocina. Si tuviera que poner un ""pero"", haría referencia a la relación calidad-precio, en mi opinión, desproporcionada con respecto a lo recibido. Mucha suerte y muchos éxitos!¬;¬10 diciembre 2014¬;¬¬;¬¬;¬¬;¬¬;¬Internacional, Mediterránea, Europea, Española, Contemporánea¬;¬Comidas, Cenas, Abierto hasta tarde¬;¬Reservas, Capacidad, Camareros, Acceso para discapacitados, Sirve alcohol, Bar completo¬;¬Romántico, Reuniones de negocios, Ocasiones especiales¬;¬lunes 13:30 - 15:00 21:00 - 23:00 martes 13:30 - 15:00 21:00 - 23:00 miércoles 13:30 - 15:00 21:00 - 23:00 jueves 13:30 - 15:00 21:00 - 23:00 viernes 13:30 - 15:00 21:00 - 23:00¬;¬Dirección: C/ Regueros,8, 28004 Madrid, España Ubicación: Europa  >  España  >  Comunidad de Madrid  >  Madrid>  > Chueca Barrio: Chueca Número de teléfono: 917021586¬;¬Dirección: C/ Regueros,8, 28004 Madrid, España Ubicación: Europa  >  España  >  Comunidad de Madrid  >  Madrid>  > Chueca Barrio: Chueca Número de teléfono: 917021586¬
¬Restaurante¬;¬DSTAGE¬;¬Javier M¬;¬León, España¬;¬5¬;¬40¬;¬39¬;¬Javier MPo_Hac¬;¬4¬;¬Por los pelos.....¬;¬Hace unas semanas, después de mucho esperar, tuve la oportunidad de visitar el nuevi restaurante del Chef Diego Guerrero, al que ya conocia de su anterior Club Allard...y como no, la comparación es obligada Tomamo el menu largo La puesa en escena, aun completamente distinta al Club, me parece muy buena, pasando por la barra del bar (Oricios cítricos) a... Más  Hace unas semanas, después de mucho esperar, tuve la oportunidad de visitar el nuevi restaurante del Chef Diego Guerrero, al que ya conocia de su anterior Club Allard...y como no, la comparación es obligada Tomamo el menu largo La puesa en escena, aun completamente distinta al Club, me parece muy buena, pasando por la barra del bar (Oricios cítricos) a la barra de cocina (Tiradito de Carabinero y Jamaicas) y de allí a la mesa y los platos fantásticos, auqnue el carabinero quizas pelin complicado de comer sin mancharse En la mesa se inicia el pase con los ""glóbulos rojos"", que recuerda en exceso a su ya conocido minibabybel, y a los poco amantes de sabores tipo morteruelo puede desagradarle. El pastel de arroz con hualicoche, fantástico. La cebolla en texturas, las pochas de tolosa, el huevo en pan tostado, por clásicos... no dicen nada a pesar de su mas estricta perfeccióón Llamativamente bunea la sardina sobre torrija de tomate El bonito, que no puede estar más jugoso y mejor tratado como producto se ve arruinado por el excesivo, pero muyyyy excesivo punto de sal del caldo coreano El bosque... su pecera sin agua, nada nuevo El ajo de los postres, muy bueno, pero no le llega a la suela de aquel huevo de mango... El servicio, correcto, en ocasiones pelin empalagoso El chef, al que conocemos todos los que vemos la tele, sale a unas cuantas mesas y no a otras, no se con que criterio, pero seguro que alguien más suspicaz que yo le sentaría mal. Creo que es hacer un feo innecasrio a comensales que se van a dejar sus buenas perras. La estrella michelin estaba cantadda, pero hay muchos que se la merecen y sigien esperando Espero volver en un par de años y ... ya veremos. Ahora, pesa más el recuierdo de su anterior cocina que la actual¬;¬9 diciembre 2014¬;¬Visitado el noviembre de 2014¬;¬Relación calidad-precio 3;Ambiente 3;Servicio 3;Comida 4¬;¬¬;¬¬;¬Internacional, Mediterránea, Europea, Española, Contemporánea¬;¬Comidas, Cenas, Abierto hasta tarde¬;¬Reservas, Capacidad, Camareros, Acceso para discapacitados, Sirve alcohol, Bar completo¬;¬Romántico, Reuniones de negocios, Ocasiones especiales¬;¬lunes 13:30 - 15:00 21:00 - 23:00 martes 13:30 - 15:00 21:00 - 23:00 miércoles 13:30 - 15:00 21:00 - 23:00 jueves 13:30 - 15:00 21:00 - 23:00 viernes 13:30 - 15:00 21:00 - 23:00¬;¬Dirección: C/ Regueros,8, 28004 Madrid, España Ubicación: Europa  >  España  >  Comunidad de Madrid  >  Madrid>  > Chueca Barrio: Chueca Número de teléfono: 917021586¬;¬Dirección: C/ Regueros,8, 28004 Madrid, España Ubicación: Europa  >  España  >  Comunidad de Madrid  >  Madrid>  > Chueca Barrio: Chueca Número de teléfono: 917021586¬
¬Restaurante¬;¬DSTAGE¬;¬Javierrrrrrrrr¬;¬¬;¬3¬;¬16¬;¬4¬;¬JavierrrrrrrrrSe_Res¬;¬4¬;¬Servicio excelente, muy agradables.¬;¬Restaurante muy bonito y con un trato muy agradable. Buena Relación calidad-precio Recomendable 100% Restaurante muy bonito y con un trato muy agradable. Buena Relación calidad-precio Recomendable 100%¬;¬2 diciembre 2014¬;¬Visitado el noviembre de 2014¬;¬Relación calidad-precio 5;Ambiente 5;Servicio 5;Comida 4¬;¬¬;¬¬;¬Internacional, Mediterránea, Europea, Española, Contemporánea¬;¬Comidas, Cenas, Abierto hasta tarde¬;¬Reservas, Capacidad, Camareros, Acceso para discapacitados, Sirve alcohol, Bar completo¬;¬Romántico, Reuniones de negocios, Ocasiones especiales¬;¬lunes 13:30 - 15:00 21:00 - 23:00 martes 13:30 - 15:00 21:00 - 23:00 miércoles 13:30 - 15:00 21:00 - 23:00 jueves 13:30 - 15:00 21:00 - 23:00 viernes 13:30 - 15:00 21:00 - 23:00¬;¬Dirección: C/ Regueros,8, 28004 Madrid, España Ubicación: Europa  >  España  >  Comunidad de Madrid  >  Madrid>  > Chueca Barrio: Chueca Número de teléfono: 917021586¬;¬Dirección: C/ Regueros,8, 28004 Madrid, España Ubicación: Europa  >  España  >  Comunidad de Madrid  >  Madrid>  > Chueca Barrio: Chueca Número de teléfono: 917021586¬
