Tipo,NombreRestaurante_,NombreUsuario_,LocalizaciónUsario_,NivelUsuario_,OpinionesTotalesUsuario_,VotosUtiles_,IDComentario_,ValoracionComentario_,TituloComentario_,Comentario_,FechaCometario_,FechaVisitaRestaurante_,ValoracionesComentario_,ResumenPuntuacionesRestaurante_,PrecioMedio_,TipoCocina_,Comida_,CaracteristicasDelResaurante_,AconsejablePara_,Horarios_,DireccionCompletaRestaurante_,Descripcion_
¬Restaurante¬;¬Tacos & Tapas¬;¬Ederick C¬;¬Mexico City, Distrito Federal, Mexico¬;¬2¬;¬7¬;¬2¬;¬Ederick CAl_No¬;¬5¬;¬Alegría.¬;¬No hay nada mejor que volver y ver que tus pronósticos eran ciertos, el lugar ñ, todo un éxito, el servicio inmejorable, la comida deliciosa y que más se puede pedir si lo acompañamos con una cerveza mexicana. De nuevo muchas gracias por las atenciones al dueño y manager Eduardo, hasta la próxima. No hay nada mejor que volver y ver que tus pronósticos eran ciertos, el lugar ñ, todo un éxito, el servicio inmejorable, la comida deliciosa y que más se puede pedir si lo acompañamos con una cerveza mexicana. De nuevo muchas gracias por las atenciones al dueño y manager Eduardo, hasta la próxima.¬;¬26 enero 2016¬;¬¬;¬¬;¬¬;¬30 € - 50 €¬;¬Mexicana¬;¬Comidas, Cenas¬;¬Reservas, Camareros, Aparcamiento en la calle, Sirve alcohol, Bar completo, Vino y cerveza, Acepta Mastercard, Acepta Visa, Wifi gratuito¬;¬Ocasiones especiales¬;¬martes 13:30 - 16:00 19:00 - 23:00 miércoles 13:30 - 16:00 19:00 - 23:00 jueves 13:30 - 16:00 19:00 - 23:00 viernes 13:30 - 16:00 19:00 - 23:00 sábado 13:30 - 16:00 19:00 - 23:00¬;¬Dirección: Calle Redondilla, 7, 28005 Madrid, España Ubicación: Europa  >  España  >  Comunidad de Madrid  >  Madrid>  > La Latina Barrio: La Latina Número de teléfono: +34 8105247 25¬;¬Restaurante de especialidad mexicana. Local pequeño y acogedor. Atención personalizada. No apto para grupos grandes.¬
¬Restaurante¬;¬Tacos & Tapas¬;¬Gabriela D¬;¬Barcelona, España¬;¬0¬;¬1¬;¬0¬;¬Gabriela DEx_Exc¬;¬5¬;¬Excelente cena¬;¬Excelente comida, con todo el sabor mexicano en el platillo. Y la atencion del personal de las mejores, atentos y calurosos. Excelente comida, con todo el sabor mexicano en el platillo. Y la atencion del personal de las mejores, atentos y calurosos.¬;¬24 enero 2016¬;¬Visitado el enero de 2016¬;¬Relación calidad-precio 5;Servicio 5;Comida 5¬;¬¬;¬30 € - 50 €¬;¬Mexicana¬;¬Comidas, Cenas¬;¬Reservas, Camareros, Aparcamiento en la calle, Sirve alcohol, Bar completo, Vino y cerveza, Acepta Mastercard, Acepta Visa, Wifi gratuito¬;¬Ocasiones especiales¬;¬martes 13:30 - 16:00 19:00 - 23:00 miércoles 13:30 - 16:00 19:00 - 23:00 jueves 13:30 - 16:00 19:00 - 23:00 viernes 13:30 - 16:00 19:00 - 23:00 sábado 13:30 - 16:00 19:00 - 23:00¬;¬Dirección: Calle Redondilla, 7, 28005 Madrid, España Ubicación: Europa  >  España  >  Comunidad de Madrid  >  Madrid>  > La Latina Barrio: La Latina Número de teléfono: +34 8105247 25¬;¬Restaurante de especialidad mexicana. Local pequeño y acogedor. Atención personalizada. No apto para grupos grandes.¬
¬Restaurante¬;¬Tacos & Tapas¬;¬Aquitannia¬;¬¬;¬2¬;¬6¬;¬2¬;¬AquitanniaGe_Vin¬;¬5¬;¬Genuina materia prima mexica.¬;¬Vinimos por las buenas críticas a comer y nos quedamos por los sabores y el servicio. Es muy difícil encontrar un restaurante mexicano con los verdaderos sabores de allí. Genuina materia prima mexica. Vinimos por las buenas críticas a comer y nos quedamos por los sabores y el servicio. Es muy difícil encontrar un restaurante mexicano con los verdaderos sabores de allí. Genuina materia prima mexica.¬;¬22 enero 2016¬;¬¬;¬¬;¬¬;¬30 € - 50 €¬;¬Mexicana¬;¬Comidas, Cenas¬;¬Reservas, Camareros, Aparcamiento en la calle, Sirve alcohol, Bar completo, Vino y cerveza, Acepta Mastercard, Acepta Visa, Wifi gratuito¬;¬Ocasiones especiales¬;¬martes 13:30 - 16:00 19:00 - 23:00 miércoles 13:30 - 16:00 19:00 - 23:00 jueves 13:30 - 16:00 19:00 - 23:00 viernes 13:30 - 16:00 19:00 - 23:00 sábado 13:30 - 16:00 19:00 - 23:00¬;¬Dirección: Calle Redondilla, 7, 28005 Madrid, España Ubicación: Europa  >  España  >  Comunidad de Madrid  >  Madrid>  > La Latina Barrio: La Latina Número de teléfono: +34 8105247 25¬;¬Restaurante de especialidad mexicana. Local pequeño y acogedor. Atención personalizada. No apto para grupos grandes.¬
¬Restaurante¬;¬Tacos & Tapas¬;¬47pablo¬;¬Valencia, España¬;¬0¬;¬2¬;¬0¬;¬47pabloMe_Tie¬;¬5¬;¬Mejicano increible¬;¬Tienen una comida espectacular. Los mejores nachos con una salsa guacamole increíble y autentica. Un trato por parte de los dueños excelente y amable. He acudido ya 5 veces y seguiré haciéndolo. También preparar unos margaritas muy buenos. El sitio es pequeño con pocas mesas y eso conlleva a tener un trato y atención excelente. Tienen una comida espectacular. Los mejores nachos con una salsa guacamole increíble y autentica. Un trato por parte de los dueños excelente y amable. He acudido ya 5 veces y seguiré haciéndolo. También preparar unos margaritas muy buenos. El sitio es pequeño con pocas mesas y eso conlleva a tener un trato y atención excelente.¬;¬17 enero 2016¬;¬Visitado el enero de 2016¬;¬Relación calidad-precio 5;Servicio 5;Comida 5¬;¬¬;¬30 € - 50 €¬;¬Mexicana¬;¬Comidas, Cenas¬;¬Reservas, Camareros, Aparcamiento en la calle, Sirve alcohol, Bar completo, Vino y cerveza, Acepta Mastercard, Acepta Visa, Wifi gratuito¬;¬Ocasiones especiales¬;¬martes 13:30 - 16:00 19:00 - 23:00 miércoles 13:30 - 16:00 19:00 - 23:00 jueves 13:30 - 16:00 19:00 - 23:00 viernes 13:30 - 16:00 19:00 - 23:00 sábado 13:30 - 16:00 19:00 - 23:00¬;¬Dirección: Calle Redondilla, 7, 28005 Madrid, España Ubicación: Europa  >  España  >  Comunidad de Madrid  >  Madrid>  > La Latina Barrio: La Latina Número de teléfono: +34 8105247 25¬;¬Restaurante de especialidad mexicana. Local pequeño y acogedor. Atención personalizada. No apto para grupos grandes.¬
¬Restaurante¬;¬Tacos & Tapas¬;¬PManzano¬;¬Madrid, Spain¬;¬1¬;¬4¬;¬0¬;¬PManzanoMu_El¬;¬5¬;¬Muy buena comida y un trato excelente¬;¬El espacio es muy agradable, la comida de calidad (se nota que saben lo que se hacen), y sólo les criticaría un exceso de prudencia a la hora de administrar el picante (lógico, porque los españoles no estamos acostumbrados y no querrán que haya clientes que lo pasen mal). Los platos están bien elaborados y presentados, hay variedad de tacos,... Más  El espacio es muy agradable, la comida de calidad (se nota que saben lo que se hacen), y sólo les criticaría un exceso de prudencia a la hora de administrar el picante (lógico, porque los españoles no estamos acostumbrados y no querrán que haya clientes que lo pasen mal). Los platos están bien elaborados y presentados, hay variedad de tacos, fajitas, y entrantes como nachos con guacamole, quesadillas etc. También se pueden tomar enchiladas muy auténticas. Un apartado muy interesante de la carta es el de los cocktails, que además del margarita tradicional y una variación, incluyen otras opciones menos conocidas, como el Ojo rojo (cocktail de cerveza con salsa de tomate y algún condimento picante), que no conocía y que recomiendo. Lo mejor de todo, sin embargo, es la cuidadísima atención al cliente del dueño y de quienes le acompañan. Son tan amables que consiguen que la comida te sepa todavía mejor. El restaurante cumple bien en todos sus apartados, pero especialmente en el trato. Se está muy a gusto.¬;¬17 enero 2016¬;¬Visitado el enero de 2016¬;¬Relación calidad-precio 5;Servicio 5;Comida 5¬;¬¬;¬30 € - 50 €¬;¬Mexicana¬;¬Comidas, Cenas¬;¬Reservas, Camareros, Aparcamiento en la calle, Sirve alcohol, Bar completo, Vino y cerveza, Acepta Mastercard, Acepta Visa, Wifi gratuito¬;¬Ocasiones especiales¬;¬martes 13:30 - 16:00 19:00 - 23:00 miércoles 13:30 - 16:00 19:00 - 23:00 jueves 13:30 - 16:00 19:00 - 23:00 viernes 13:30 - 16:00 19:00 - 23:00 sábado 13:30 - 16:00 19:00 - 23:00¬;¬Dirección: Calle Redondilla, 7, 28005 Madrid, España Ubicación: Europa  >  España  >  Comunidad de Madrid  >  Madrid>  > La Latina Barrio: La Latina Número de teléfono: +34 8105247 25¬;¬Restaurante de especialidad mexicana. Local pequeño y acogedor. Atención personalizada. No apto para grupos grandes.¬
¬Restaurante¬;¬Tacos & Tapas¬;¬José Miguel M¬;¬¬;¬1¬;¬4¬;¬0¬;¬José Miguel MUn_He¬;¬5¬;¬Un placer¬;¬He estado comiendo con un amigo y todo fenomenal, un sitio pequeño pero acogedor, el trato excelente, la comida muy buena, cantidades las justas, muy rico lo que probamos, recomiendo el picante habanero a los valientes, pica pero bien, en general todo muy bien, volveré a repetir. He estado comiendo con un amigo y todo fenomenal, un sitio pequeño pero acogedor, el trato excelente, la comida muy buena, cantidades las justas, muy rico lo que probamos, recomiendo el picante habanero a los valientes, pica pero bien, en general todo muy bien, volveré a repetir.¬;¬10 enero 2016¬;¬¬;¬¬;¬¬;¬30 € - 50 €¬;¬Mexicana¬;¬Comidas, Cenas¬;¬Reservas, Camareros, Aparcamiento en la calle, Sirve alcohol, Bar completo, Vino y cerveza, Acepta Mastercard, Acepta Visa, Wifi gratuito¬;¬Ocasiones especiales¬;¬martes 13:30 - 16:00 19:00 - 23:00 miércoles 13:30 - 16:00 19:00 - 23:00 jueves 13:30 - 16:00 19:00 - 23:00 viernes 13:30 - 16:00 19:00 - 23:00 sábado 13:30 - 16:00 19:00 - 23:00¬;¬Dirección: Calle Redondilla, 7, 28005 Madrid, España Ubicación: Europa  >  España  >  Comunidad de Madrid  >  Madrid>  > La Latina Barrio: La Latina Número de teléfono: +34 8105247 25¬;¬Restaurante de especialidad mexicana. Local pequeño y acogedor. Atención personalizada. No apto para grupos grandes.¬
¬Restaurante¬;¬Tacos & Tapas¬;¬AlexDapousa¬;¬Madrid, España¬;¬0¬;¬1¬;¬0¬;¬AlexDapousaCa_Un¬;¬5¬;¬Calidad y cercanía¬;¬Un placer y verdadera comida mexicana. El dueño, Eduarno, muy simpatico y nos atendio estupendamente. Muy recomendable. Un placer y verdadera comida mexicana. El dueño, Eduarno, muy simpatico y nos atendio estupendamente. Muy recomendable.¬;¬9 enero 2016¬;¬Visitado el enero de 2016¬;¬Relación calidad-precio 4;Servicio 5;Comida 5¬;¬¬;¬30 € - 50 €¬;¬Mexicana¬;¬Comidas, Cenas¬;¬Reservas, Camareros, Aparcamiento en la calle, Sirve alcohol, Bar completo, Vino y cerveza, Acepta Mastercard, Acepta Visa, Wifi gratuito¬;¬Ocasiones especiales¬;¬martes 13:30 - 16:00 19:00 - 23:00 miércoles 13:30 - 16:00 19:00 - 23:00 jueves 13:30 - 16:00 19:00 - 23:00 viernes 13:30 - 16:00 19:00 - 23:00 sábado 13:30 - 16:00 19:00 - 23:00¬;¬Dirección: Calle Redondilla, 7, 28005 Madrid, España Ubicación: Europa  >  España  >  Comunidad de Madrid  >  Madrid>  > La Latina Barrio: La Latina Número de teléfono: +34 8105247 25¬;¬Restaurante de especialidad mexicana. Local pequeño y acogedor. Atención personalizada. No apto para grupos grandes.¬
¬Restaurante¬;¬Tacos & Tapas¬;¬andreae525¬;¬Madrid, España¬;¬0¬;¬2¬;¬1¬;¬andreae525Co_En¬;¬5¬;¬Comida mexicana buensísima¬;¬En un restaurante con pocas mesas, cuando llegamos tenia el cartel de completo, menos mal que reservamos el día anterior, pedimos un poco de todo, nachos con guacamole, quesadillas, tacos, fajitas y enchiladas, estaba todo buenisimo, sobre todo las enchiladas, muy natural y suave, y acompañado de una salsa picante muy buena. Recomiendo las enchiladas, los tacos y los margaritas.... Más  En un restaurante con pocas mesas, cuando llegamos tenia el cartel de completo, menos mal que reservamos el día anterior, pedimos un poco de todo, nachos con guacamole, quesadillas, tacos, fajitas y enchiladas, estaba todo buenisimo, sobre todo las enchiladas, muy natural y suave, y acompañado de una salsa picante muy buena. Recomiendo las enchiladas, los tacos y los margaritas. Los camareros muy simpáticos y agradables. Vamos una comida genial.¬;¬6 enero 2016¬;¬Visitado el enero de 2016¬;¬Relación calidad-precio 4;Servicio 5;Comida 5¬;¬¬;¬30 € - 50 €¬;¬Mexicana¬;¬Comidas, Cenas¬;¬Reservas, Camareros, Aparcamiento en la calle, Sirve alcohol, Bar completo, Vino y cerveza, Acepta Mastercard, Acepta Visa, Wifi gratuito¬;¬Ocasiones especiales¬;¬martes 13:30 - 16:00 19:00 - 23:00 miércoles 13:30 - 16:00 19:00 - 23:00 jueves 13:30 - 16:00 19:00 - 23:00 viernes 13:30 - 16:00 19:00 - 23:00 sábado 13:30 - 16:00 19:00 - 23:00¬;¬Dirección: Calle Redondilla, 7, 28005 Madrid, España Ubicación: Europa  >  España  >  Comunidad de Madrid  >  Madrid>  > La Latina Barrio: La Latina Número de teléfono: +34 8105247 25¬;¬Restaurante de especialidad mexicana. Local pequeño y acogedor. Atención personalizada. No apto para grupos grandes.¬
¬Restaurante¬;¬Tacos & Tapas¬;¬Maria M¬;¬Bucarest, Rumania¬;¬5¬;¬51¬;¬11¬;¬Maria MCo_Est¬;¬5¬;¬Comida mexicana autentica¬;¬Estabamos visitando Madrid y entramos por casualidad a este local con comida mexicana y fue una grata sopresa.hemos disfrutado mucho. La comida es deliciosa y muy bien presentada. Hemos comido unas quesadias deliciosas y tambien probamos fajitas de pollo muy ricas. El trato fue rapido y servicial. Lo recomiendo . Estabamos visitando Madrid y entramos por casualidad a este local con comida mexicana y fue una grata sopresa.hemos disfrutado mucho. La comida es deliciosa y muy bien presentada. Hemos comido unas quesadias deliciosas y tambien probamos fajitas de pollo muy ricas. El trato fue rapido y servicial. Lo recomiendo .¬;¬5 enero 2016¬;¬Visitado el diciembre de 2015¬;¬Relación calidad-precio 5;Servicio 5;Comida 5¬;¬¬;¬30 € - 50 €¬;¬Mexicana¬;¬Comidas, Cenas¬;¬Reservas, Camareros, Aparcamiento en la calle, Sirve alcohol, Bar completo, Vino y cerveza, Acepta Mastercard, Acepta Visa, Wifi gratuito¬;¬Ocasiones especiales¬;¬martes 13:30 - 16:00 19:00 - 23:00 miércoles 13:30 - 16:00 19:00 - 23:00 jueves 13:30 - 16:00 19:00 - 23:00 viernes 13:30 - 16:00 19:00 - 23:00 sábado 13:30 - 16:00 19:00 - 23:00¬;¬Dirección: Calle Redondilla, 7, 28005 Madrid, España Ubicación: Europa  >  España  >  Comunidad de Madrid  >  Madrid>  > La Latina Barrio: La Latina Número de teléfono: +34 8105247 25¬;¬Restaurante de especialidad mexicana. Local pequeño y acogedor. Atención personalizada. No apto para grupos grandes.¬
¬Restaurante¬;¬Tacos & Tapas¬;¬Elena V¬;¬¬;¬1¬;¬4¬;¬0¬;¬Elena VFa_La¬;¬5¬;¬Fabuloso y profesional¬;¬La comida es exquisita y además está genial presentada. Súper recomendable. Los tacos son una pasada!! La comida es exquisita y además está genial presentada. Súper recomendable. Los tacos son una pasada!!¬;¬24 diciembre 2015¬;¬Visitado el diciembre de 2015¬;¬Relación calidad-precio 4;Servicio 5;Comida 4¬;¬¬;¬30 € - 50 €¬;¬Mexicana¬;¬Comidas, Cenas¬;¬Reservas, Camareros, Aparcamiento en la calle, Sirve alcohol, Bar completo, Vino y cerveza, Acepta Mastercard, Acepta Visa, Wifi gratuito¬;¬Ocasiones especiales¬;¬martes 13:30 - 16:00 19:00 - 23:00 miércoles 13:30 - 16:00 19:00 - 23:00 jueves 13:30 - 16:00 19:00 - 23:00 viernes 13:30 - 16:00 19:00 - 23:00 sábado 13:30 - 16:00 19:00 - 23:00¬;¬Dirección: Calle Redondilla, 7, 28005 Madrid, España Ubicación: Europa  >  España  >  Comunidad de Madrid  >  Madrid>  > La Latina Barrio: La Latina Número de teléfono: +34 8105247 25¬;¬Restaurante de especialidad mexicana. Local pequeño y acogedor. Atención personalizada. No apto para grupos grandes.¬
